Hotels,Distance,District,Price,Rating,Stars,Comments,Link,Descriptions
flat family near center and jardin turia avenida del cid,"a 2,3 km del centro","Olivereta, Valencia",€ 760,"7,9",4 de 5,8 comentarios,https://www.booking.com/hotel/es/flat-family-near-center-and-jardin-turia-avenida-del-cid.es.html?aid=304142&label=gen173nr-1FCAEoggI46AdIClgEaEaIAQGYAQq4AQfIAQ_YAQHoAQH4AQKIAgGoAgO4Aurq-a0GwAIB0gIkYjQ4ODAyOGEtYThmNy00YzdmLWI3NGUtNzk5YTY3OWE1MjE22AIF4AIB&ucfs=1&arphpl=1&checkin=2024-02-25&checkout=2024-03-01&group_adults=2&req_adults=2&no_rooms=1&group_children=0&req_children=0&hpos=1&hapos=326&sr_order=popularity&srpvid=b17d79be562c0490&srepoch=1706980854&all_sr_blocks=1022290101_374711536_6_0_0&highlighted_blocks=1022290101_374711536_6_0_0&matching_block_id=1022290101_374711536_6_0_0&sr_pri_blocks=1022290101_374711536_6_0_0__76000&from=searchresults#hotelTmpl,"Flat family near center and jardin turia avenida del cid es un alojamiento con vistas al jardín que está en Valencia, a 18 min a pie de Bioparc Valencia y a 2,9 km de Church of Saint Nicolás. Este alojamiento ofrece parking privado gratis, wifi gratis y acceso a un patio.

Este apartamento con aire acondicionado consta de 3 dormitorios, una sala de estar, una cocina totalmente equipada con nevera y cafetera, y 1 baño con bidet y ducha. Hay toallas y ropa de cama en el apartamento.

Estación de tren del Norte está a 4 km del alojamiento, y Basílica de la Virgen de los Desamparados está a 4,5 km. El aeropuerto (Aeropuerto de Valencia) está a 5 km."
ApartUP Concorde,"a 2,6 km del centro","Camins al Grau, Valencia",€ 805,"8,1",4 de 5,16 comentarios,https://www.booking.com/hotel/es/apartup-concorde.es.html?aid=304142&label=gen173nr-1FCAEoggI46AdIClgEaEaIAQGYAQq4AQfIAQ_YAQHoAQH4AQKIAgGoAgO4Aurq-a0GwAIB0gIkYjQ4ODAyOGEtYThmNy00YzdmLWI3NGUtNzk5YTY3OWE1MjE22AIF4AIB&ucfs=1&arphpl=1&checkin=2024-02-25&checkout=2024-03-01&group_adults=2&req_adults=2&no_rooms=1&group_children=0&req_children=0&hpos=2&hapos=327&sr_order=popularity&srpvid=b17d79be562c0490&srepoch=1706980854&all_sr_blocks=233066401_326430792_4_0_0&highlighted_blocks=233066401_326430792_4_0_0&matching_block_id=233066401_326430792_4_0_0&sr_pri_blocks=233066401_326430792_4_0_0__80500&from=searchresults#hotelTmpl,"ApartUP Concorde se encuentra en Valencia, a 1,8 km de Puerto de Valencia y a 15 min a pie de Oceanográfico, y ofrece alojamiento con wifi gratis, aire acondicionado y jardín. El alojamiento ofrece vistas a la piscina y está a 2,7 km de Jardín del Turia y a 3,2 km de Jardines de Monforte.

Este apartamento se encuentra en la planta baja y cuenta con 1 dormitorio, cocina bien equipada con nevera y horno, una sala de estar y TV de pantalla plana. Hay toallas y ropa de cama en el apartamento.

Museo Nacional de Cerámica y Artes Santuarias González Martí está a 3,5 km del alojamiento, y Estación de tren del Norte está a 3,5 km. El aeropuerto más cercano (Aeropuerto de Valencia) está a 12 km del alojamiento, que ofrece servicio de traslado de pago para ir o volver del aeropuerto."
Hogar Vera Apartments&Bikes,"a 0,7 km del centro","Ciutat Vella, Valencia",€ 1.010,"8,9",4 de 5,156 comentarios,https://www.booking.com/hotel/es/hogar-ciutat-vella.es.html?aid=304142&label=gen173nr-1FCAEoggI46AdIClgEaEaIAQGYAQq4AQfIAQ_YAQHoAQH4AQKIAgGoAgO4Aurq-a0GwAIB0gIkYjQ4ODAyOGEtYThmNy00YzdmLWI3NGUtNzk5YTY3OWE1MjE22AIF4AIB&ucfs=1&arphpl=1&checkin=2024-02-25&checkout=2024-03-01&group_adults=2&req_adults=2&no_rooms=1&group_children=0&req_children=0&hpos=3&hapos=328&sr_order=popularity&srpvid=b17d79be562c0490&srepoch=1706980854&all_sr_blocks=180791901_328017893_2_0_0&highlighted_blocks=180791901_328017893_2_0_0&matching_block_id=180791901_328017893_2_0_0&sr_pri_blocks=180791901_328017893_2_0_0__101000&from_sustainable_property_sr=1&from=searchresults#hotelTmpl,"Hogar Vera Apartments&Bikes está en el centro de Valencia, a 5 min a pie de Church of Saint Nicolás y a 1,2 km de Estación de tren del Norte, y ofrece alojamiento con wifi gratis y zona de estar.

El alojamiento tiene aire acondicionado, cocina totalmente equipada y con zona de comedor, TV de pantalla plana y baño privado con ducha, artículos de aseo gratuitos y secador de pelo. También hay nevera, horno y microondas, además de cafetera y hervidor.

Se puede descubrir la zona practicando ciclismo en los alrededores y el apartamento ofrece servicio de alquiler de bicicletas.

Cerca del alojamiento hay puntos de interés como Basílica de la Virgen de los Desamparados, Jardines de Monforte y Jardín del Turia. El aeropuerto más cercano (Aeropuerto de Valencia) está a 8 km del alojamiento, que ofrece servicio de traslado de pago para ir o volver del aeropuerto."
Apartamentos Las Ciencias R,"a 2,1 km del centro","Quatre Carreres, Valencia",€ 980,"9,3",4 de 5,3 comentarios,https://www.booking.com/hotel/es/apartamentos-las-ciencias-r.es.html?aid=304142&label=gen173nr-1FCAEoggI46AdIClgEaEaIAQGYAQq4AQfIAQ_YAQHoAQH4AQKIAgGoAgO4Aurq-a0GwAIB0gIkYjQ4ODAyOGEtYThmNy00YzdmLWI3NGUtNzk5YTY3OWE1MjE22AIF4AIB&ucfs=1&arphpl=1&checkin=2024-02-25&checkout=2024-03-01&group_adults=2&req_adults=2&no_rooms=1&group_children=0&req_children=0&hpos=4&hapos=329&sr_order=popularity&srpvid=b17d79be562c0490&srepoch=1706980854&all_sr_blocks=1082816602_380867271_4_0_0&highlighted_blocks=1082816602_380867271_4_0_0&matching_block_id=1082816602_380867271_4_0_0&sr_pri_blocks=1082816602_380867271_4_0_0__98000&from_sustainable_property_sr=1&from=searchresults#hotelTmpl,"Apartamentos Las Ciencias R se encuentra en el barrio de Quatre Carreres, en Valencia, cerca de Oceanográfico. Tiene terraza y lavadora. El alojamiento está a 1,9 km de Jardín del Turia y ofrece parking privado en el propio alojamiento y wifi gratis.

Este apartamento con aire acondicionado consta de 1 dormitorio, una sala de estar, una cocina totalmente equipada con nevera y cafetera, y 1 baño con ducha y secador de pelo. Hay toallas y ropa de cama en el apartamento.

Estación de tren del Norte está a 2,5 km del alojamiento, y Jardines de Monforte está a 2,9 km. El aeropuerto más cercano (Aeropuerto de Valencia) está a 11 km."
Mon Suites Carmen,a 1 km del centro,"Ciutat Vella, Valencia",€ 778,"8,5",4 de 5,1.071 comentarios,https://www.booking.com/hotel/es/mon-suites-carmen.es.html?aid=304142&label=gen173nr-1FCAEoggI46AdIClgEaEaIAQGYAQq4AQfIAQ_YAQHoAQH4AQKIAgGoAgO4Aurq-a0GwAIB0gIkYjQ4ODAyOGEtYThmNy00YzdmLWI3NGUtNzk5YTY3OWE1MjE22AIF4AIB&ucfs=1&arphpl=1&checkin=2024-02-25&checkout=2024-03-01&group_adults=2&req_adults=2&no_rooms=1&group_children=0&req_children=0&hpos=5&hapos=330&sr_order=popularity&srpvid=b17d79be562c0490&srepoch=1706980854&all_sr_blocks=680423303_277334285_0_0_0&highlighted_blocks=680423303_277334285_0_0_0&matching_block_id=680423303_277334285_0_0_0&sr_pri_blocks=680423303_277334285_0_0_0__77832&from_sustainable_property_sr=1&from=searchresults#hotelTmpl,"Mon Suites Carmen ofrece alojamiento con aire acondicionado en el centro de Valencia, a 4 min a pie de Church of Saint Nicolás, a 700 metros de Basílica de la Virgen de los Desamparados y a 19 min a pie de Jardines de Monforte. Se ofrece wifi gratis en todo el alojamiento.

Cada unidad cuenta con sofá cama, zona de estar, TV de pantalla plana con canales vía satélite, cocina bien equipada y baño privado con ducha. También hay nevera, microondas y fogones, además de cafetera y hervidor.

El apartamento ofrece servicio de alquiler de bicicletas.

Cerca del alojamiento hay puntos de interés como Jardín del Turia, Museo Nacional de Cerámica y Artes Santuarias González Martí y Estación de tren del Norte. El aeropuerto más cercano (Aeropuerto de Valencia) está a 8 km del alojamiento."
Luxury loft on the beach,a 4 km del centro,"Poblados marítimos, Valencia",€ 510,"9,7",4 de 5,3 comentarios,https://www.booking.com/hotel/es/luxury-loft-on-the-beach.es.html?aid=304142&label=gen173nr-1FCAEoggI46AdIClgEaEaIAQGYAQq4AQfIAQ_YAQHoAQH4AQKIAgGoAgO4Aurq-a0GwAIB0gIkYjQ4ODAyOGEtYThmNy00YzdmLWI3NGUtNzk5YTY3OWE1MjE22AIF4AIB&ucfs=1&arphpl=1&checkin=2024-02-25&checkout=2024-03-01&group_adults=2&req_adults=2&no_rooms=1&group_children=0&req_children=0&hpos=6&hapos=331&sr_order=popularity&srpvid=b17d79be562c0490&srepoch=1706980854&all_sr_blocks=1056415501_377809946_2_0_0&highlighted_blocks=1056415501_377809946_2_0_0&matching_block_id=1056415501_377809946_2_0_0&sr_pri_blocks=1056415501_377809946_2_0_0__51000&from=searchresults#hotelTmpl,"Luxury loft on the beach está en Valencia, a 9 min a pie de Playa de las Arenas y a 1,4 km de Playa de la Malvarrosa, y ofrece wifi gratis y aire acondicionado. Este apartamento está a 2,3 km de Playa de Patacona y a menos de 1 km de Puerto de Valencia.

El apartamento se encuentra en la planta baja y dispone de 1 dormitorio, TV de pantalla plana y cocina totalmente equipada con nevera, horno, lavadora, microondas y fogones. Hay toallas y ropa de cama en el apartamento.

Oceanográfico está a 4,2 km del alojamiento, y Jardín del Turia está a 4,3 km. El aeropuerto (Aeropuerto de Valencia) está a 14 km."
Apartamento valencia centro,"a 1,3 km del centro","Eixample, Valencia",€ 941,"9,0",3 de 5,43 comentarios,https://www.booking.com/hotel/es/centrico-y-cogedor-apartamento.es.html?aid=304142&label=gen173nr-1FCAEoggI46AdIClgEaEaIAQGYAQq4AQfIAQ_YAQHoAQH4AQKIAgGoAgO4Aurq-a0GwAIB0gIkYjQ4ODAyOGEtYThmNy00YzdmLWI3NGUtNzk5YTY3OWE1MjE22AIF4AIB&ucfs=1&arphpl=1&checkin=2024-02-25&checkout=2024-03-01&group_adults=2&req_adults=2&no_rooms=1&group_children=0&req_children=0&hpos=7&hapos=332&sr_order=popularity&srpvid=b17d79be562c0490&srepoch=1706980854&all_sr_blocks=892865101_369102871_0_0_0&highlighted_blocks=892865101_369102871_0_0_0&matching_block_id=892865101_369102871_0_0_0&sr_pri_blocks=892865101_369102871_0_0_0__94050&from=searchresults#hotelTmpl,"Apartamento valencia centro se encuentra en el barrio de Extramurs, en Valencia, cerca de Estación de tren del Norte. Dispone de terraza, wifi gratis y lavadora. Este apartamento está a 16 min a pie de Basílica de la Virgen de los Desamparados y a 4,1 km de Jardines de Monforte.

Este apartamento tiene aire acondicionado y cuenta con 1 dormitorio, TV de pantalla plana, zona de comedor, cocina con nevera y sala de estar. Hay toallas y ropa de cama en el apartamento.

Cerca del alojamiento hay puntos de interés como Church of Saint Nicolás, Jardín del Turia y Museo Nacional de Cerámica y Artes Santuarias González Martí. El aeropuerto más cercano (Aeropuerto de Valencia) está a 8 km."
Apartamento valencia centro,"a 1,3 km del centro","Eixample, Valencia",€ 941,"9,0",3 de 5,43 comentarios,https://www.booking.com/hotel/es/centrico-y-cogedor-apartamento.es.html?aid=304142&label=gen173nr-1FCAEoggI46AdIClgEaEaIAQGYAQq4AQfIAQ_YAQHoAQH4AQKIAgGoAgO4Aurq-a0GwAIB0gIkYjQ4ODAyOGEtYThmNy00YzdmLWI3NGUtNzk5YTY3OWE1MjE22AIF4AIB&ucfs=1&arphpl=1&checkin=2024-02-25&checkout=2024-03-01&group_adults=2&req_adults=2&no_rooms=1&group_children=0&req_children=0&hpos=7&hapos=332&sr_order=popularity&srpvid=b17d79be562c0490&srepoch=1706980854&all_sr_blocks=892865101_369102871_0_0_0&highlighted_blocks=892865101_369102871_0_0_0&matching_block_id=892865101_369102871_0_0_0&sr_pri_blocks=892865101_369102871_0_0_0__94050&from=searchresults#hotelTmpl,"Apartamento valencia centro, que cuenta con vistas a la ciudad, ofrece alojamiento con terraza y balcón a unos 16 min a pie de Estación de tren del Norte. El apartamento cuenta con parking privado y está a 19 min a pie de Jardín del Turia.

Este apartamento con aire acondicionado consta de 2 dormitorios, una sala de estar, una cocina totalmente equipada con nevera y cafetera, y 2 baños con bidet y ducha. Hay toallas y ropa de cama en el apartamento.

En recepción se habla inglés, español, francés y italiano, y el personal está siempre dispuesto a echar una mano.

Museo Nacional de Cerámica y Artes Santuarias González Martí está a 18 min a pie del alojamiento, y Jardines de Monforte está a 2,7 km. El aeropuerto más cercano (Aeropuerto de Valencia) está a 10 km del alojamiento."
Travel Habitat Plaza del Pilar.,"a 0,6 km del centro","Ciutat Vella, Valencia",€ 657,"7,2",4 de 5,47 comentarios,https://www.booking.com/hotel/es/travel-habitat-plaza-del-pilar.es.html?aid=304142&label=gen173nr-1FCAEoggI46AdIClgEaEaIAQGYAQq4AQfIAQ_YAQHoAQH4AQKIAgGoAgO4Aurq-a0GwAIB0gIkYjQ4ODAyOGEtYThmNy00YzdmLWI3NGUtNzk5YTY3OWE1MjE22AIF4AIB&ucfs=1&arphpl=1&checkin=2024-02-25&checkout=2024-03-01&group_adults=2&req_adults=2&no_rooms=1&group_children=0&req_children=0&hpos=8&hapos=333&sr_order=popularity&srpvid=b17d79be562c0490&srepoch=1706980854&all_sr_blocks=221541301_98102028_2_0_0&highlighted_blocks=221541301_98102028_2_0_0&matching_block_id=221541301_98102028_2_0_0&sr_pri_blocks=221541301_98102028_2_0_0__65710&from=searchresults#hotelTmpl,"Travel Habitat Plaza del Pilar. Está en pleno corazón de Valencia y ofrece vistas a la ciudad desde el balcón. El alojamiento está a menos de 1 km de Estación de tren del Norte y tiene wifi gratis en todo el alojamiento.

Este apartamento con aire acondicionado consta de 1 dormitorio, una sala de estar, una cocina totalmente equipada con nevera y hervidor, y 1 baño con ducha y artículos de aseo gratuitos. Hay toallas y ropa de cama en el apartamento.

El apartamento ofrece servicio de alquiler de bicicletas.

Cerca del alojamiento hay puntos de interés como Church of Saint Nicolás, Jardín del Turia y Museo Nacional de Cerámica y Artes Santuarias González Martí. El aeropuerto más cercano (Aeropuerto de Valencia) está a 8 km del alojamiento, que ofrece servicio de traslado de pago para ir o volver del aeropuerto."
VLC Mercat Central Flats,"a 0,6 km del centro","Ciutat Vella, Valencia",€ 831,"8,0",4 de 5,319 comentarios,https://www.booking.com/hotel/es/vlc-eixarchs-flats.es.html?aid=304142&label=gen173nr-1FCAEoggI46AdIClgEaEaIAQGYAQq4AQfIAQ_YAQHoAQH4AQKIAgGoAgO4Aurq-a0GwAIB0gIkYjQ4ODAyOGEtYThmNy00YzdmLWI3NGUtNzk5YTY3OWE1MjE22AIF4AIB&ucfs=1&arphpl=1&checkin=2024-02-25&checkout=2024-03-01&group_adults=2&req_adults=2&no_rooms=1&group_children=0&req_children=0&hpos=9&hapos=334&sr_order=popularity&srpvid=b17d79be562c0490&srepoch=1706980854&all_sr_blocks=764026103_333458590_2_0_0&highlighted_blocks=764026103_333458590_2_0_0&matching_block_id=764026103_333458590_2_0_0&sr_pri_blocks=764026103_333458590_2_0_0__83066&from_sustainable_property_sr=1&from=searchresults#hotelTmpl,"VLC Mercat Central Flats se encuentra en el centro de Valencia, a 4 min a pie de Church of Saint Nicolás y a 1,2 km de Estación de tren del Norte, y ofrece alojamiento con wifi gratis y zona de estar.

El alojamiento tiene aire acondicionado, cocina totalmente equipada, TV de pantalla plana y baño privado con ducha, artículos de aseo gratuitos y secador de pelo. También se ofrece nevera, lavavajillas y horno, además de cafetera y hervidor.

El apartamento ofrece servicio de alquiler de bicicletas.

Cerca del alojamiento hay puntos de interés como Basílica de la Virgen de los Desamparados, Jardines de Monforte y Jardín del Turia. El aeropuerto más cercano (Aeropuerto de Valencia) está a 8 km del alojamiento."
Suites Rooms Valencia,"a 1,2 km del centro","Extramurs, Valencia",€ 408,"7,2",4 de 5,833 comentarios,https://www.booking.com/hotel/es/monalisa-luxury-suites.es.html?aid=304142&label=gen173nr-1FCAEoggI46AdIClgEaEaIAQGYAQq4AQfIAQ_YAQHoAQH4AQKIAgGoAgO4Aurq-a0GwAIB0gIkYjQ4ODAyOGEtYThmNy00YzdmLWI3NGUtNzk5YTY3OWE1MjE22AIF4AIB&ucfs=1&arphpl=1&checkin=2024-02-25&checkout=2024-03-01&group_adults=2&req_adults=2&no_rooms=1&group_children=0&req_children=0&hpos=10&hapos=335&sr_order=popularity&srpvid=b17d79be562c0490&srepoch=1706980854&all_sr_blocks=383422402_121177984_2_0_0&highlighted_blocks=383422402_121177984_2_0_0&matching_block_id=383422402_121177984_2_0_0&sr_pri_blocks=383422402_121177984_2_0_0__40800&from=searchresults#hotelTmpl,"La Suites Rooms Valencia ofrece alojamiento con WiFi gratuita, aire acondicionado y TV de pantalla plana a 2 km del mercado central de Valencia y a 2,4 km de la basílica de la Virgen de los Desamparados.

Hay una zona de salón compartida.

La Suites Rooms Valencia se encuentra a 2,5 km del Museo Nacional de Cerámica y Artes Suntuarias González Martí y a 2,6 km de la iglesia de San Nicolás. El aeropuerto de Valencia, el más cercano, está a 10 km."
Sunny Patacona Seaview,"a 4,7 km del centro","Poblados marítimos, Valencia",€ 822,"9,5",4 de 5,26 comentarios,https://www.booking.com/hotel/es/reinapart-patacona-pool-amp-sea.es.html?aid=304142&label=gen173nr-1FCAEoggI46AdIClgEaEaIAQGYAQq4AQfIAQ_YAQHoAQH4AQKIAgGoAgO4Aurq-a0GwAIB0gIkYjQ4ODAyOGEtYThmNy00YzdmLWI3NGUtNzk5YTY3OWE1MjE22AIF4AIB&ucfs=1&arphpl=1&checkin=2024-02-25&checkout=2024-03-01&group_adults=2&req_adults=2&no_rooms=1&group_children=0&req_children=0&hpos=11&hapos=336&sr_order=popularity&srpvid=b17d79be562c0490&srepoch=1706980854&all_sr_blocks=982794601_383207886_4_0_0&highlighted_blocks=982794601_383207886_4_0_0&matching_block_id=982794601_383207886_4_0_0&sr_pri_blocks=982794601_383207886_4_0_0__82200&from=searchresults#hotelTmpl,"Sunny Patacona Seaview es un alojamiento con piscina de temporada al aire libre que se encuentra en Valencia, a 9 min a pie de Playa de la Malvarrosa, a 1,9 km de Playa de las Arenas y a 4,1 km de Puerto de Valencia. Este alojamiento está a 4 min a pie de Playa de Patacona y ofrece wifi gratis y parking privado en el propio alojamiento.

Este apartamento tiene aire acondicionado y cuenta con 2 dormitorios, TV de pantalla plana, zona de comedor y cocina con nevera y lavavajillas.

Jardines de Monforte está a 5,8 km del alojamiento, y Jardín del Turia está a 6,1 km. El aeropuerto más cercano (Aeropuerto de Valencia) está a 18 km del alojamiento."
Best Valencia Beach Homestay-Historic Area,a 4 km del centro,"Jesús, Valencia",€ 496,"6,9",4 de 5,37 comentarios,https://www.booking.com/hotel/es/best-valencia-beach-homestay-historic-area.es.html?aid=304142&label=gen173nr-1FCAEoggI46AdIClgEaEaIAQGYAQq4AQfIAQ_YAQHoAQH4AQKIAgGoAgO4Aurq-a0GwAIB0gIkYjQ4ODAyOGEtYThmNy00YzdmLWI3NGUtNzk5YTY3OWE1MjE22AIF4AIB&ucfs=1&arphpl=1&checkin=2024-02-25&checkout=2024-03-01&group_adults=2&req_adults=2&no_rooms=1&group_children=0&req_children=0&hpos=12&hapos=337&sr_order=popularity&srpvid=b17d79be562c0490&srepoch=1706980854&all_sr_blocks=804395501_341826845_2_0_0&highlighted_blocks=804395501_341826845_2_0_0&matching_block_id=804395501_341826845_2_0_0&sr_pri_blocks=804395501_341826845_2_0_0__49550&from_sustainable_property_sr=1&from=searchresults#hotelTmpl,"Best Valencia Beach Homestay-Historic Area está a 9 min a pie de Playa de las Arenas y ofrece salón de uso común y terraza, así como alojamiento con aire acondicionado, patio y wifi gratis.

Cada unidad dispone de nevera, microondas, cafetera, fogones y hervidor. Hay un baño compartido totalmente equipado con ducha y secador de pelo.

Se puede practicar esquí y ciclismo en los alrededores.

Cerca del alojamiento hay puntos de interés como Playa de la Malvarrosa, Playa de Patacona y Puerto de Valencia. El aeropuerto (Aeropuerto de Valencia) está a 13 km."
Brand New Stylish Apartment with Fluffy Beds 1,"a 1,7 km del centro","Benicalap, Valencia",€ 870,"9,2",4 de 5,9 comentarios,https://www.booking.com/hotel/es/brand-new-stylish-apartment-with-fluffy-beds-1.es.html?aid=304142&label=gen173nr-1FCAEoggI46AdIClgEaEaIAQGYAQq4AQfIAQ_YAQHoAQH4AQKIAgGoAgO4Aurq-a0GwAIB0gIkYjQ4ODAyOGEtYThmNy00YzdmLWI3NGUtNzk5YTY3OWE1MjE22AIF4AIB&ucfs=1&arphpl=1&checkin=2024-02-25&checkout=2024-03-01&group_adults=2&req_adults=2&no_rooms=1&group_children=0&req_children=0&hpos=13&hapos=338&sr_order=popularity&srpvid=b17d79be562c0490&srepoch=1706980854&all_sr_blocks=831204302_360336058_2_0_0&highlighted_blocks=831204302_360336058_2_0_0&matching_block_id=831204302_360336058_2_0_0&sr_pri_blocks=831204302_360336058_2_0_0__86955&from=searchresults#hotelTmpl,"Brand New Stylish Apartment with Fluffy Beds 1 está en el barrio de Jesús, en Valencia, a 1,8 km de Estación de tren del Norte y a 3,7 km de Church of Saint Nicolás, y ofrece alojamiento equipado con balcón y wifi gratis. Este apartamento está a 4,2 km de Jardín del Turia y a 4,3 km de Museo Nacional de Cerámica y Artes Santuarias González Martí.

Este apartamento con aire acondicionado consta de 3 dormitorios, una sala de estar, una cocina totalmente equipada con nevera y cafetera, y 2 baños con bidet y ducha. Hay toallas y ropa de cama en el apartamento.

Basílica de la Virgen de los Desamparados está a 4,4 km del alojamiento, y Bioparc Valencia está a 4,5 km. El aeropuerto (Aeropuerto de Valencia) está a 8 km."
Eurostars Gran Valencia,a 3 km del centro,"Quatre Carreres, Valencia",€ 1.115,"8,5",4 de 5,3.288 comentarios,https://www.booking.com/hotel/es/eurostars-gran-valencia.es.html?aid=304142&label=gen173nr-1FCAEoggI46AdIClgEaEaIAQGYAQq4AQfIAQ_YAQHoAQH4AQKIAgGoAgO4Aurq-a0GwAIB0gIkYjQ4ODAyOGEtYThmNy00YzdmLWI3NGUtNzk5YTY3OWE1MjE22AIF4AIB&ucfs=1&arphpl=1&checkin=2024-02-25&checkout=2024-03-01&group_adults=2&req_adults=2&no_rooms=1&group_children=0&req_children=0&hpos=14&hapos=339&sr_order=popularity&srpvid=b17d79be562c0490&srepoch=1706980854&all_sr_blocks=9048401_327750429_2_34_0&highlighted_blocks=9048401_327750429_2_34_0&matching_block_id=9048401_327750429_2_34_0&sr_pri_blocks=9048401_327750429_2_34_0__111496&from_sustainable_property_sr=1&from=searchresults#hotelTmpl,"Este moderno establecimiento se encuentra junto al centro de congresos de Valencia y ofrece vistas al centro de la ciudad y WiFi gratuita. El Eurostars cuenta con centro de fitness, sauna y piscina en la azotea.

Todas las habitaciones del Gran Valencia cuentan con aire acondicionado, TV de pantalla plana vía satélite, caja fuerte y minibar.

Además, hay un bar, y el restaurante sirve platos de cocina típica mediterránea, como marisco fresco. Hay servicio de habitaciones y se sirve un desayuno para llevar en la habitación.

El Eurostars Gran Valencia ofrece un servicio de lavandería y limpieza en seco. El centro histórico de Valencia está a 3 km y en las inmediaciones hay paradas de autobús, tren y metro."
Apartamentos Las Ciencias Studio Y,"a 2,1 km del centro","Poblados marítimos, Valencia",€ 815,"6,9",4 de 5,,https://www.booking.com/hotel/es/apartamentos-las-ciencias-studio-y.es.html?aid=304142&label=gen173nr-1FCAEoggI46AdIClgEaEaIAQGYAQq4AQfIAQ_YAQHoAQH4AQKIAgGoAgO4Aurq-a0GwAIB0gIkYjQ4ODAyOGEtYThmNy00YzdmLWI3NGUtNzk5YTY3OWE1MjE22AIF4AIB&ucfs=1&arphpl=1&checkin=2024-02-25&checkout=2024-03-01&group_adults=2&req_adults=2&no_rooms=1&group_children=0&req_children=0&hpos=15&hapos=340&sr_order=popularity&srpvid=b17d79be562c0490&srepoch=1706980854&all_sr_blocks=1104861302_383299393_2_0_0&highlighted_blocks=1104861302_383299393_2_0_0&matching_block_id=1104861302_383299393_2_0_0&sr_pri_blocks=1104861302_383299393_2_0_0__81500&from_sustainable_property_sr=1&from=searchresults#hotelTmpl,"Apartamentos Las Ciencias Studio Y se encuentra en el barrio de Quatre Carreres, en Valencia, cerca de Oceanográfico. Tiene terraza y lavadora. Este alojamiento con aire acondicionado está a 1,9 km de Jardín del Turia y ofrece wifi gratis y parking privado en el propio alojamiento.

El apartamento dispone de TV vía satélite. La cocina está equipada con nevera, lavavajillas y horno, además de cafetera y hervidor.

Estación de tren del Norte está a 2,5 km del alojamiento, y Jardines de Monforte está a 2,9 km. El aeropuerto (Aeropuerto de Valencia) está a 11 km."
Beamar 2,"a 5,3 km del centro","La Saïdia, Valencia",€ 450,"9,0",4 de 5,51 comentarios,https://www.booking.com/hotel/es/beamar-2.es.html?aid=304142&label=gen173nr-1FCAEoggI46AdIClgEaEaIAQGYAQq4AQfIAQ_YAQHoAQH4AQKIAgGoAgO4Aurq-a0GwAIB0gIkYjQ4ODAyOGEtYThmNy00YzdmLWI3NGUtNzk5YTY3OWE1MjE22AIF4AIB&ucfs=1&arphpl=1&checkin=2024-02-25&checkout=2024-03-01&group_adults=2&req_adults=2&no_rooms=1&group_children=0&req_children=0&hpos=16&hapos=341&sr_order=popularity&srpvid=b17d79be562c0490&srepoch=1706980854&all_sr_blocks=838024301_378961266_4_0_0&highlighted_blocks=838024301_378961266_4_0_0&matching_block_id=838024301_378961266_4_0_0&sr_pri_blocks=838024301_378961266_4_0_0__45000&from=searchresults#hotelTmpl,"Beamar 2 está en Valencia y ofrece alojamiento con wifi gratis a 2,6 km de Playa de la Malvarrosa, a 3,7 km de Puerto de Valencia y a 5,1 km de Oceanográfico. El alojamiento, que está a menos de 1 km de Playa de las Arenas, dispone de terraza y parking privado gratis.

Este barco consta de 1 dormitorio independiente, 1 baño y una zona de estar. Hay toallas y ropa de cama en el barco.

Jardín del Turia está a 7,3 km del alojamiento, y Jardines de Monforte está a 7,5 km. El aeropuerto (Aeropuerto de Valencia) está a 16 km."
