Hotels,Distance,District,Price,Rating,Stars,Comments,Link,Descriptions
Bonito apartamento con encanto en casco antiguo RON 7 VALENCIAYOLE,"a 0,6 km del centro","Poblados marítimos, Valencia",€ 655,"6,8",3 de 5,87 comentarios,https://www.booking.com/hotel/es/bonito-apartamento-con-encanto-en-casco-antiguo-ron-7.es.html?aid=304142&label=gen173nr-1FCAEoggI46AdIClgEaEaIAQGYAQq4AQfIAQ_YAQHoAQH4AQKIAgGoAgO4Aurq-a0GwAIB0gIkYjQ4ODAyOGEtYThmNy00YzdmLWI3NGUtNzk5YTY3OWE1MjE22AIF4AIB&ucfs=1&arphpl=1&checkin=2024-02-25&checkout=2024-03-01&group_adults=2&req_adults=2&no_rooms=1&group_children=0&req_children=0&hpos=5&hapos=480&sr_order=popularity&srpvid=b17d79be562c0490&srepoch=1706980916&all_sr_blocks=851865301_352567890_2_0_0&highlighted_blocks=851865301_352567890_2_0_0&matching_block_id=851865301_352567890_2_0_0&sr_pri_blocks=851865301_352567890_2_0_0__65500&from=searchresults#hotelTmpl,"Bonito apartamento con encanto en casco antiguo RON 7 VALENCIAYOLE está en el centro de Valencia, a 12 min a pie de Estación de tren del Norte y a 300 metros de Church of Saint Nicolás, y ofrece alojamiento con wifi gratis.

Cerca del alojamiento hay puntos de interés como Jardín del Turia, Museo Nacional de Cerámica y Artes Santuarias González Martí y Basílica de la Virgen de los Desamparados. El aeropuerto más cercano (Aeropuerto de Valencia) está a 8 km."
RealRent Marina Real,"a 3,5 km del centro","Eixample, Valencia",€ 590,"8,0",3 de 5,190 comentarios,https://www.booking.com/hotel/es/realrent-marina-real.es.html?aid=304142&label=gen173nr-1FCAEoggI46AdIClgEaEaIAQGYAQq4AQfIAQ_YAQHoAQH4AQKIAgGoAgO4Aurq-a0GwAIB0gIkYjQ4ODAyOGEtYThmNy00YzdmLWI3NGUtNzk5YTY3OWE1MjE22AIF4AIB&ucfs=1&arphpl=1&checkin=2024-02-25&checkout=2024-03-01&group_adults=2&req_adults=2&no_rooms=1&group_children=0&req_children=0&hpos=6&hapos=481&sr_order=popularity&srpvid=b17d79be562c0490&srepoch=1706980916&all_sr_blocks=33718001_89022359_4_0_0&highlighted_blocks=33718001_89022359_4_0_0&matching_block_id=33718001_89022359_4_0_0&sr_pri_blocks=33718001_89022359_4_0_0__58952&from=searchresults#hotelTmpl,"El RealRent Marina Real ofrece apartamentos de 2 dormitorios con conexión Wi-Fi gratuita a 1,5 km de la terminal de ferris de Valencia y la playa de la Malvarrosa. La Ciudad de las Artes y las Ciencias está a 15 minutos a pie.

Los modernos apartamentos del RealRent Marina Real disponen de una amplia zona de salón comedor con sofá cama y TV. La zona de cocina está equipada con vitrocerámica, horno, microondas y nevera. Los apartamentos también incluyen baño con secador de pelo y lavadora. Hay aire acondicionado.

A poca distancia a pie de los apartamentos hay varios bares y restaurantes, así como un supermercado Consum a solo 2 minutos a pie.

Hay una parada de autobús a menos de 100 metros y una estación de metro a 7 minutos a pie. Tanto el autobús como el metro le llevarán al centro histórico y a las playas del norte de la ciudad, incluida la playa de La Patacona."
Port Feria Valencia,"a 5,5 km del centro","Eixample, Valencia",€ 833,"9,6",4 de 5,5.623 comentarios,https://www.booking.com/hotel/es/port-valencia-feria.es.html?aid=304142&label=gen173nr-1FCAEoggI46AdIClgEaEaIAQGYAQq4AQfIAQ_YAQHoAQH4AQKIAgGoAgO4Aurq-a0GwAIB0gIkYjQ4ODAyOGEtYThmNy00YzdmLWI3NGUtNzk5YTY3OWE1MjE22AIF4AIB&ucfs=1&arphpl=1&checkin=2024-02-25&checkout=2024-03-01&group_adults=2&req_adults=2&no_rooms=1&group_children=0&req_children=0&hpos=7&hapos=482&sr_order=popularity&srpvid=b17d79be562c0490&srepoch=1706980916&all_sr_blocks=9285201_372552674_2_2_0&highlighted_blocks=9285201_372552674_2_2_0&matching_block_id=9285201_372552674_2_2_0&sr_pri_blocks=9285201_372552674_2_2_0__83326&from_sustainable_property_sr=1&from=searchresults#hotelTmpl,"El Port Feria Valencia, situado cerca del Centro de Convenciones Feria Valencia y muy cerca del centro de la ciudad, es la mejor opción para descubrir Valencia gracias a sus excelentes conexiones con todos las zonas de la ciudad, sus completas instalaciones y sus servicios de calidad. Este hotel moderno está muy bien comunicado con el centro histórico, la plaza del Ayuntamiento, el aeropuerto y la Ciudad de las Artes y las Ciencias.

El Port Feria Valencia ofrece servicios excelentes y prácticos. Alberga un restaurante a la carta con platos mediterráneos y especialidades valencianas. Cuenta con piscina al aire libre, terraza solárium, gimnasio, restaurante y cafetería. Hay WiFi gratuita en todas las zonas del hotel. El aparcamiento y el servicio de enlace con el aeropuerto conllevan un suplemento.

El Port Feria Valencia ofrece habitaciones espléndidas con todas las comodidades necesarias para garantizar una estancia inmejorable. Cuenta con 3 salas para reuniones con una capacidad máxima de 78 personas, entre otros servicios e instalaciones.

La estación de metro de Benimàmet queda a 400 metros. El hotel está bien comunicado con las principales carreteras. El aeropuerto de Valencia se encuentra a 10 minutos en coche."
Casa Mediterranea- Les mil i una nits,"a 3,9 km del centro","Quatre Carreres, Valencia",€ 1.450,10,4 de 5,12 comentarios,https://www.booking.com/hotel/es/casa-mediterranea-la-serena.es.html?aid=304142&label=gen173nr-1FCAEoggI46AdIClgEaEaIAQGYAQq4AQfIAQ_YAQHoAQH4AQKIAgGoAgO4Aurq-a0GwAIB0gIkYjQ4ODAyOGEtYThmNy00YzdmLWI3NGUtNzk5YTY3OWE1MjE22AIF4AIB&ucfs=1&arphpl=1&checkin=2024-02-25&checkout=2024-03-01&group_adults=2&req_adults=2&no_rooms=1&group_children=0&req_children=0&hpos=8&hapos=483&sr_order=popularity&srpvid=b17d79be562c0490&srepoch=1706980916&all_sr_blocks=1010427601_373894070_5_0_0&highlighted_blocks=1010427601_373894070_5_0_0&matching_block_id=1010427601_373894070_5_0_0&sr_pri_blocks=1010427601_373894070_5_0_0__145000&from=searchresults#hotelTmpl,"Casa Mediterranea- Les mil i una nits, que cuenta con vistas al jardín, ofrece alojamiento con terraza y balcón a unos 4,8 km de Church of Saint Nicolás. Esta casa o chalet ofrece alojamiento con patio y wifi gratis.

Esta casa o chalet tiene aire acondicionado y cuenta con 3 dormitorios, TV de pantalla plana y cocina con nevera y lavavajillas. Hay toallas y ropa de cama en la casa o chalet.

Basílica de la Virgen de los Desamparados está a 5 km del alojamiento, y Jardines de Monforte está a 5 km. El aeropuerto más cercano (Aeropuerto de Valencia) está a 13 km del alojamiento, que ofrece servicio de traslado de pago para ir o volver del aeropuerto."
Arena Delux,"a 2,6 km del centro","Poblados marítimos, Valencia",€ 454,"7,2",3 de 5,,https://www.booking.com/hotel/es/arena-delux.es.html?aid=304142&label=gen173nr-1FCAEoggI46AdIClgEaEaIAQGYAQq4AQfIAQ_YAQHoAQH4AQKIAgGoAgO4Aurq-a0GwAIB0gIkYjQ4ODAyOGEtYThmNy00YzdmLWI3NGUtNzk5YTY3OWE1MjE22AIF4AIB&ucfs=1&arphpl=1&checkin=2024-02-25&checkout=2024-03-01&group_adults=2&req_adults=2&no_rooms=1&group_children=0&req_children=0&hpos=9&hapos=484&sr_order=popularity&srpvid=b17d79be562c0490&srepoch=1706980916&all_sr_blocks=1148545802_387682720_2_0_0&highlighted_blocks=1148545802_387682720_2_0_0&matching_block_id=1148545802_387682720_2_0_0&sr_pri_blocks=1148545802_387682720_2_0_0__45360&from=searchresults#hotelTmpl,"Arena Delux está a 2,9 km de Oceanográfico, en Valencia, y ofrece alojamiento con aire acondicionado y wifi gratis.

Todas las unidades tienen cocina totalmente equipada con cafetera, sala de estar con TV y baño privado con secador de pelo y ducha. También hay nevera, lavavajillas y microondas, además de hervidor.

Estación de tren del Norte está a 3,4 km del alojamiento, y Puerto de Valencia está a 4,1 km. El aeropuerto (Aeropuerto de Valencia) está a 12 km."
Ático de lujo frente Mercado Colon only adults,"a 0,7 km del centro","Ciutat Vella, Valencia",€ 1.500,"9,0",4 de 5,1 comentario,https://www.booking.com/hotel/es/atico-de-lujo-frente-mercado-colon-only-adults.es.html?aid=304142&label=gen173nr-1FCAEoggI46AdIClgEaEaIAQGYAQq4AQfIAQ_YAQHoAQH4AQKIAgGoAgO4Aurq-a0GwAIB0gIkYjQ4ODAyOGEtYThmNy00YzdmLWI3NGUtNzk5YTY3OWE1MjE22AIF4AIB&ucfs=1&arphpl=1&checkin=2024-02-25&checkout=2024-03-01&group_adults=2&req_adults=2&no_rooms=1&group_children=0&req_children=0&hpos=10&hapos=485&sr_order=popularity&srpvid=b17d79be562c0490&srepoch=1706980916&all_sr_blocks=1056894801_377878730_2_0_0&highlighted_blocks=1056894801_377878730_2_0_0&matching_block_id=1056894801_377878730_2_0_0&sr_pri_blocks=1056894801_377878730_2_0_0__150000&from=searchresults#hotelTmpl,"Ático de lujo frente Mercado Colon only adults está en Valencia, a 8 min a pie de Jardín del Turia y a menos de 1 km de Museo Nacional de Cerámica y Artes Santuarias González Martí, y ofrece wifi gratis, terraza y aire acondicionado. Este apartamento está a 18 min a pie de Church of Saint Nicolás y a 3,6 km de Oceanográfico.

El apartamento tiene 2 dormitorios, TV de pantalla plana con canales por cable, una cocina equipada con nevera y lavavajillas, lavadora y 2 baños con ducha. Hay toallas y ropa de cama en el apartamento.

Cerca del alojamiento hay puntos de interés como Estación de tren del Norte, Basílica de la Virgen de los Desamparados y Jardines de Monforte. El aeropuerto más cercano (Aeropuerto de Valencia) está a 9 km."
El 16 Ruzafa,"a 0,8 km del centro","Poblados marítimos, Valencia",€ 721,"9,1",4 de 5,1.409 comentarios,https://www.booking.com/hotel/es/el-16-de-ruzafa.es.html?aid=304142&label=gen173nr-1FCAEoggI46AdIClgEaEaIAQGYAQq4AQfIAQ_YAQHoAQH4AQKIAgGoAgO4Aurq-a0GwAIB0gIkYjQ4ODAyOGEtYThmNy00YzdmLWI3NGUtNzk5YTY3OWE1MjE22AIF4AIB&ucfs=1&arphpl=1&checkin=2024-02-25&checkout=2024-03-01&group_adults=2&req_adults=2&no_rooms=1&group_children=0&req_children=0&hpos=11&hapos=486&sr_order=popularity&srpvid=b17d79be562c0490&srepoch=1706980916&all_sr_blocks=86546106_89041267_0_0_0&highlighted_blocks=86546106_89041267_0_0_0&matching_block_id=86546106_89041267_0_0_0&sr_pri_blocks=86546106_89041267_0_0_0__72100&from=searchresults#hotelTmpl,"El 16 Ruzafa está situado en el barrio del Eixample, a 10 minutos a pie del centro histórico de Valencia. Ofrece apartamentos con WiFi gratuita, aire acondicionado y calefacción.

Todos los apartamentos están ubicados en la 1ª o 2ª planta y cuentan con cocina equipada con horno, lavavajillas, microondas y hervidor eléctrico. En la zona de estar hay zona de comedor, TV de pantalla plana vía satélite y sofá. El baño es privado e incluye bañera o ducha y secador de pelo. Los apartamentos también tienen balcón o terraza.

Hay WiFi gratuita en todas las instalaciones.

El 16 Ruzafa está situado en el moderno distrito valenciano de Ruzafa, en un edificio de principios del siglo XX restaurado. A unos 500 metros del establecimiento hay restaurantes, cafeterías y un mercado, mientras que la estación de tren y autobuses está a 15 minutos a pie.

El 16 Ruzafa está a 15 minutos a pie del parque de los Jardines del Turia, a 6 minutos en coche del mercado de Colón y a 15 minutos en autobús de la Ciudad de las Artes y las Ciencias."
"chalet, villa rodeada de naturaleza con piscina cerca de la ciudad","a 11,2 km del centro","Eixample, Valencia",€ 1.210,"8,6",4 de 5,4 comentarios,https://www.booking.com/hotel/es/agradable-villa-rodeada-de-naturaleza-con-piscina-cerca-de-la-ciudad.es.html?aid=304142&label=gen173nr-1FCAEoggI46AdIClgEaEaIAQGYAQq4AQfIAQ_YAQHoAQH4AQKIAgGoAgO4Aurq-a0GwAIB0gIkYjQ4ODAyOGEtYThmNy00YzdmLWI3NGUtNzk5YTY3OWE1MjE22AIF4AIB&ucfs=1&arphpl=1&checkin=2024-02-25&checkout=2024-03-01&group_adults=2&req_adults=2&no_rooms=1&group_children=0&req_children=0&hpos=12&hapos=487&sr_order=popularity&srpvid=b17d79be562c0490&srepoch=1706980916&all_sr_blocks=1007761301_373514916_2_0_0&highlighted_blocks=1007761301_373514916_2_0_0&matching_block_id=1007761301_373514916_2_0_0&sr_pri_blocks=1007761301_373514916_2_0_0__121000&from=searchresults#hotelTmpl,"Chalet, villa rodeada de naturaleza con piscina cerca de la ciudad, que tiene terraza, dispone de alojamiento en Valencia con wifi gratis y vistas al jardín. Esta casa o chalet tiene piscina privada, jardín y parking privado gratis.

Esta casa o chalet tiene aire acondicionado y cuenta con 3 dormitorios, TV de pantalla plana y cocina con nevera. Hay toallas y ropa de cama en la casa o chalet.

Church of Saint Nicolás está a 12 km del alojamiento, y Basílica de la Virgen de los Desamparados está a 14 km. El aeropuerto (Aeropuerto de Valencia) está a 12 km."
"10 pax, AC, Wifi gratis, Ciudad Artes y Ciencias","a 2,1 km del centro","El Pla del Real, Valencia",€ 730,"8,5",4 de 5,13 comentarios,https://www.booking.com/hotel/es/10-pax-ac-wifi-gratis-ciudad-artes-y-ciencias.es.html?aid=304142&label=gen173nr-1FCAEoggI46AdIClgEaEaIAQGYAQq4AQfIAQ_YAQHoAQH4AQKIAgGoAgO4Aurq-a0GwAIB0gIkYjQ4ODAyOGEtYThmNy00YzdmLWI3NGUtNzk5YTY3OWE1MjE22AIF4AIB&ucfs=1&arphpl=1&checkin=2024-02-25&checkout=2024-03-01&group_adults=2&req_adults=2&no_rooms=1&group_children=0&req_children=0&hpos=13&hapos=488&sr_order=popularity&srpvid=b17d79be562c0490&srepoch=1706980916&all_sr_blocks=1046880001_376981646_6_0_0&highlighted_blocks=1046880001_376981646_6_0_0&matching_block_id=1046880001_376981646_6_0_0&sr_pri_blocks=1046880001_376981646_6_0_0__73000&from=searchresults#hotelTmpl,"10 pax, AC, Wifi gratis, Ciudad Artes y Ciencias está en el barrio de Quatre Carreres, en Valencia, a 2,3 km de Jardín del Turia, a 18 min a pie de Oceanográfico y a 2,6 km de Estación de tren del Norte. Este apartamento ofrece wifi gratis y una cocina totalmente equipada.

Este apartamento de 2 dormitorios ofrece TV de pantalla plana, aire acondicionado y sala de estar.

Jardines de Monforte está a 3 km del alojamiento, y Museo Nacional de Cerámica y Artes Santuarias González Martí está a 3,1 km. El aeropuerto (Aeropuerto de Valencia) está a 11 km."
Marina Loft & Apartments,"a 3,5 km del centro","Eixample, Valencia",€ 755,"8,1",3 de 5,385 comentarios,https://www.booking.com/hotel/es/marina-loft-amp-apartments.es.html?aid=304142&label=gen173nr-1FCAEoggI46AdIClgEaEaIAQGYAQq4AQfIAQ_YAQHoAQH4AQKIAgGoAgO4Aurq-a0GwAIB0gIkYjQ4ODAyOGEtYThmNy00YzdmLWI3NGUtNzk5YTY3OWE1MjE22AIF4AIB&ucfs=1&arphpl=1&checkin=2024-02-25&checkout=2024-03-01&group_adults=2&req_adults=2&no_rooms=1&group_children=0&req_children=0&hpos=14&hapos=489&sr_order=popularity&srpvid=b17d79be562c0490&srepoch=1706980916&all_sr_blocks=43232601_380812469_0_0_0&highlighted_blocks=43232601_380812469_0_0_0&matching_block_id=43232601_380812469_0_0_0&sr_pri_blocks=43232601_380812469_0_0_0__75500&from=searchresults#hotelTmpl,"Estos elegantes apartamentos tipo loft dúplex se encuentran a 10 minutos a pie del puerto de Valencia. Ofrecen un alojamiento moderno con aire acondicionado y WiFi gratuita, a 3,5 km del centro histórico.

Los Marina Loft & Apartments están rodeados de jardines privados, tienen una decoración moderna y cuentan con un amplio salón comedor con TV de plasma vía satélite, reproductor de DVD y caja fuerte. La cocina tiene lavavajillas, microondas, horno y cafetera. También incluyen utensilios de cocina, ropa de cama y toallas.

Los alojamientos están a menos de 10 minutos a pie de varios restaurantes, bares y tiendas y a 15 minutos también a pie de la playa de Las Arenas. El complejo de la Ciudad de las Artes y las Ciencias se encuentra a 1 km.

Los Marina Loft & Apartments están a 10 minutos a pie de la estación de metro Marítim-Serrería y la estación de autobuses al centro se encuentra a 2 minutos a pie. El establecimiento dispone de aparcamiento privado por un suplemento y está a 20 minutos en coche del aeropuerto de Valencia."
Bet Apartments - Tramontana Apartments,"a 1,1 km del centro","Poblados marítimos, Valencia",€ 791,"7,7",5 de 5,682 comentarios,https://www.booking.com/hotel/es/getme-carmen-suites.es.html?aid=304142&label=gen173nr-1FCAEoggI46AdIClgEaEaIAQGYAQq4AQfIAQ_YAQHoAQH4AQKIAgGoAgO4Aurq-a0GwAIB0gIkYjQ4ODAyOGEtYThmNy00YzdmLWI3NGUtNzk5YTY3OWE1MjE22AIF4AIB&ucfs=1&arphpl=1&checkin=2024-02-25&checkout=2024-03-01&group_adults=2&req_adults=2&no_rooms=1&group_children=0&req_children=0&hpos=15&hapos=490&sr_order=popularity&srpvid=b17d79be562c0490&srepoch=1706980916&all_sr_blocks=127721501_88510483_3_0_0&highlighted_blocks=127721501_88510483_3_0_0&matching_block_id=127721501_88510483_3_0_0&sr_pri_blocks=127721501_88510483_3_0_0__79086&from_sustainable_property_sr=1&from=searchresults#hotelTmpl,"El Bet Apartments - Tramontana Apartments se encuentra en Valencia, en el Barrio del Carmen y a 10 minutos a pie de la catedral de Valencia, y ofrece alojamientos independientes con balcón y WiFi gratuita.

Los apartamentos son luminosos, presentan acabados actuales y disponen de aire acondicionado, dormitorio y baño. Hay sala de estar con sofá cama, soporte para iPod, TV de pantalla plana y radio. También incluyen zona de cocina con horno, hervidor de agua eléctrico, cafetera Nespresso y utensilios de cocina.

En las calles de los alrededores se pueden encontrar numerosos bares y restaurantes.

El Bet Apartments - Tramontana Apartments queda a 20 minutos a pie de la estación de tren Norte, a 6 km de la playa de la Malvarrosa y a 15 minutos en coche del aeropuerto de Valencia. Además, a 5 minutos a pie del establecimiento hay aparcamiento (sujeto a disponibilidad)."
Independent duplex house beach valencia,"a 4,1 km del centro","La Saïdia, Valencia",€ 667,"8,3",3 de 5,43 comentarios,https://www.booking.com/hotel/es/independent-duplex-house-beach-valencia.es.html?aid=304142&label=gen173nr-1FCAEoggI46AdIClgEaEaIAQGYAQq4AQfIAQ_YAQHoAQH4AQKIAgGoAgO4Aurq-a0GwAIB0gIkYjQ4ODAyOGEtYThmNy00YzdmLWI3NGUtNzk5YTY3OWE1MjE22AIF4AIB&ucfs=1&arphpl=1&checkin=2024-02-25&checkout=2024-03-01&group_adults=2&req_adults=2&no_rooms=1&group_children=0&req_children=0&hpos=16&hapos=491&sr_order=popularity&srpvid=b17d79be562c0490&srepoch=1706980916&all_sr_blocks=861576901_361037285_4_0_0&highlighted_blocks=861576901_361037285_4_0_0&matching_block_id=861576901_361037285_4_0_0&sr_pri_blocks=861576901_361037285_4_0_0__66650&from=searchresults#hotelTmpl,"Independent duplex house beach valencia se encuentra en Valencia, a solo 8 min a pie de Playa de las Arenas, y ofrece alojamiento frente a la playa con terraza y wifi gratis. Este apartamento tiene acceso a un patio.

Este apartamento con aire acondicionado consta de 1 dormitorio, una sala de estar, una cocina totalmente equipada con nevera y cafetera, y 1 baño con bañera o ducha y artículos de aseo gratuitos. Hay toallas y ropa de cama en el apartamento.

Cerca del alojamiento hay puntos de interés como Playa de la Malvarrosa, Playa de Patacona y Puerto de Valencia. El aeropuerto más cercano (Aeropuerto de Valencia) está a 13 km del alojamiento."
My Loft 4 You Ruzafa Style II,"a 0,8 km del centro","Poblados marítimos, Valencia",€ 748,"6,2",3 de 5,41 comentarios,https://www.booking.com/hotel/es/my-loft-4-you-ruzafa-style-ii.es.html?aid=304142&label=gen173nr-1FCAEoggI46AdIClgEaEaIAQGYAQq4AQfIAQ_YAQHoAQH4AQKIAgGoAgO4Aurq-a0GwAIB0gIkYjQ4ODAyOGEtYThmNy00YzdmLWI3NGUtNzk5YTY3OWE1MjE22AIF4AIB&ucfs=1&arphpl=1&checkin=2024-02-25&checkout=2024-03-01&group_adults=2&req_adults=2&no_rooms=1&group_children=0&req_children=0&hpos=17&hapos=492&sr_order=popularity&srpvid=b17d79be562c0490&srepoch=1706980916&all_sr_blocks=320855201_258368471_0_0_0&highlighted_blocks=320855201_258368471_0_0_0&matching_block_id=320855201_258368471_0_0_0&sr_pri_blocks=320855201_258368471_0_0_0__74800&from=searchresults#hotelTmpl,"My Loft 4 You Ruzafa Style II es un alojamiento con wifi gratis y vistas a la ciudad que está en Valencia, a solo 7 min a pie de Estación de tren del Norte y a 1,8 km de Jardín del Turia. Este apartamento está a 3,1 km de Jardines de Monforte y a 4,4 km de Oceanográfico.

Este apartamento con aire acondicionado se compone de 2 dormitorios independientes, una sala de estar, una cocina totalmente equipada con nevera y horno, y 2 baños. Hay toallas y ropa de cama en el apartamento.

Cerca del alojamiento hay puntos de interés como Museo Nacional de Cerámica y Artes Santuarias González Martí, Basílica de la Virgen de los Desamparados y Church of Saint Nicolás. El aeropuerto más cercano (Aeropuerto de Valencia) está a 9 km del alojamiento, que ofrece servicio de traslado de pago para ir o volver del aeropuerto."
better Oh!,"a 3,5 km del centro","Poblados marítimos, Valencia",€ 1.800,"7,8",3 de 5,33 comentarios,https://www.booking.com/hotel/es/better-oh.es.html?aid=304142&label=gen173nr-1FCAEoggI46AdIClgEaEaIAQGYAQq4AQfIAQ_YAQHoAQH4AQKIAgGoAgO4Aurq-a0GwAIB0gIkYjQ4ODAyOGEtYThmNy00YzdmLWI3NGUtNzk5YTY3OWE1MjE22AIF4AIB&ucfs=1&arphpl=1&checkin=2024-02-25&checkout=2024-03-01&group_adults=2&req_adults=2&no_rooms=1&group_children=0&req_children=0&hpos=1&hapos=501&sr_order=popularity&srpvid=b17d79be562c0490&srepoch=1706980924&all_sr_blocks=484395401_207714209_0_1_0&highlighted_blocks=484395401_207714209_0_1_0&matching_block_id=484395401_207714209_0_1_0&sr_pri_blocks=484395401_207714209_0_1_0__180000&from=searchresults#hotelTmpl,"Better Oh! se encuentra en Valencia, a 15 min a pie de Playa de las Arenas, y ofrece alojamiento con salón de uso común, wifi gratis, cocina compartida y mostrador de información turística. Este alojamiento ofrece dardos.

Este apartamento con aire acondicionado consta de 1 dormitorio, una sala de estar, una cocina totalmente equipada con nevera y cafetera, y 4 baños con ducha y artículos de aseo gratuitos. Se ofrece TV de pantalla plana con canales por cable y videoconsola.

Playa de la Malvarrosa está a 18 min a pie del alojamiento, y Playa de Patacona está a 2,3 km. El aeropuerto más cercano (Aeropuerto de Valencia) está a 12 km del alojamiento."
Hotel Miramar Valencia,"a 4,6 km del centro","Poblados marítimos, Valencia",€ 788,"8,2",2 de 5,1.448 comentarios,https://www.booking.com/hotel/es/miramar-valencia.es.html?aid=304142&label=gen173nr-1FCAEoggI46AdIClgEaEaIAQGYAQq4AQfIAQ_YAQHoAQH4AQKIAgGoAgO4Aurq-a0GwAIB0gIkYjQ4ODAyOGEtYThmNy00YzdmLWI3NGUtNzk5YTY3OWE1MjE22AIF4AIB&ucfs=1&arphpl=1&checkin=2024-02-25&checkout=2024-03-01&group_adults=2&req_adults=2&no_rooms=1&group_children=0&req_children=0&hpos=2&hapos=502&sr_order=popularity&srpvid=b17d79be562c0490&srepoch=1706980924&all_sr_blocks=2333204_95147369_0_2_0&highlighted_blocks=2333204_95147369_0_2_0&matching_block_id=2333204_95147369_0_2_0&sr_pri_blocks=2333204_95147369_0_2_0__78840&from_sustainable_property_sr=1&from=searchresults#hotelTmpl,"Este pequeño hotel de estilo contemporáneo tiene vistas al Mediterráneo desde la playa de las Arenas, cerca de la Marina Real Juan Carlos I, en la ciudad de Valencia. Hay WiFi gratuita.

El restaurante del hotel está situado en la playa y ofrece cocina mediterránea y cócteles. El bar abre durante todo el día.

Las modernas habitaciones están equipadas con aire acondicionado, TV de pantalla plana y baño privado con secador de pelo.

El centro de Valencia se encuentra a unos 20 minutos en coche o 30 minutos en transporte público."
Agradable Villa junto al mar con piscina,"a 30,5 km del centro","Quatre Carreres, Valencia",€ 1.790,"9,8",4 de 5,21 comentarios,https://www.booking.com/hotel/es/villa-junto-al-mar-con-piscina.es.html?aid=304142&label=gen173nr-1FCAEoggI46AdIClgEaEaIAQGYAQq4AQfIAQ_YAQHoAQH4AQKIAgGoAgO4Aurq-a0GwAIB0gIkYjQ4ODAyOGEtYThmNy00YzdmLWI3NGUtNzk5YTY3OWE1MjE22AIF4AIB&ucfs=1&arphpl=1&checkin=2024-02-25&checkout=2024-03-01&group_adults=2&req_adults=2&no_rooms=1&group_children=0&req_children=0&hpos=3&hapos=503&sr_order=popularity&srpvid=b17d79be562c0490&srepoch=1706980924&all_sr_blocks=905774501_361662225_8_0_0&highlighted_blocks=905774501_361662225_8_0_0&matching_block_id=905774501_361662225_8_0_0&sr_pri_blocks=905774501_361662225_8_0_0__179000&from=searchresults#hotelTmpl,"Agradable Villa junto al mar con piscina, que tiene piscina privada y vistas a la piscina, está en Valencia. Este alojamiento ofrece ping pong, parking privado gratis, wifi gratis y acceso a un balcón.

La villa cuenta con terraza y vistas al mar, y tiene 4 dormitorios, una sala de estar, TV de pantalla plana, una cocina equipada con nevera y lavavajillas, y 3 baños con bidet. Hay toallas y ropa de cama en la villa.

Se puede disfrutar de un momento de relax en el jardín, ir a la piscina al aire libre, o practicar ciclismo.

Playa de la Malvarrosa de Corinto está a 1 min a pie del alojamiento, y Playa de Almardá está a menos de 1 km. El aeropuerto (Aeropuerto de Valencia) está a 43 km."
FiveStepsToSea - Beach Apartment Valencia,"a 4,9 km del centro","Camins al Grau, Valencia",€ 782,"9,3",4 de 5,44 comentarios,https://www.booking.com/hotel/es/meer-amp-stadt-ruhig-pk-a-c-wifi-balkon-meerblick.es.html?aid=304142&label=gen173nr-1FCAEoggI46AdIClgEaEaIAQGYAQq4AQfIAQ_YAQHoAQH4AQKIAgGoAgO4Aurq-a0GwAIB0gIkYjQ4ODAyOGEtYThmNy00YzdmLWI3NGUtNzk5YTY3OWE1MjE22AIF4AIB&ucfs=1&arphpl=1&checkin=2024-02-25&checkout=2024-03-01&group_adults=2&req_adults=2&no_rooms=1&group_children=0&req_children=0&hpos=4&hapos=504&sr_order=popularity&srpvid=b17d79be562c0490&srepoch=1706980924&all_sr_blocks=924419702_364229408_2_0_0&highlighted_blocks=924419702_364229408_2_0_0&matching_block_id=924419702_364229408_2_0_0&sr_pri_blocks=924419702_364229408_2_0_0__78150&from_sustainable_property_sr=1&from=searchresults#hotelTmpl,"FiveStepsToSea - Beach Apartment Valencia está a pocos pasos de Playa de Patacona y ofrece jardín, además de alojamiento con aire acondicionado, balcón y wifi gratis.

El apartamento ofrece terraza, vistas al mar, zona de estar, TV de pantalla plana, cocina totalmente equipada con nevera y lavavajillas, y baño privado con bidet y secador de pelo. También hay horno, microondas y fogones, además de cafetera y hervidor.

Playa de la Malvarrosa está a 6 min a pie del alojamiento, y Playa de las Arenas está a 1,7 km. El aeropuerto más cercano (Aeropuerto de Valencia) está a 17 km."
