Hotels,Distance,District,Price,Rating,Stars,Comments,Link,Descriptions
Casa del Patriarca,a 350 m del centro,"Ciutat Vella, Valencia",€ 693,"8,3",3 de 5,1.913 comentarios,https://www.booking.com/hotel/es/pensia3n-paras.es.html?aid=304142&label=gen173nr-1FCAEoggI46AdIClgEaEaIAQGYAQq4AQfIAQ_YAQHoAQH4AQKIAgGoAgO4Aurq-a0GwAIB0gIkYjQ4ODAyOGEtYThmNy00YzdmLWI3NGUtNzk5YTY3OWE1MjE22AIF4AIB&ucfs=1&arphpl=1&checkin=2024-02-25&checkout=2024-03-01&group_adults=2&req_adults=2&no_rooms=1&group_children=0&req_children=0&hpos=5&hapos=180&sr_order=popularity&srpvid=b17d79be562c0490&srepoch=1706980802&all_sr_blocks=36483407_117004941_0_0_0&highlighted_blocks=36483407_117004941_0_0_0&matching_block_id=36483407_117004941_0_0_0&sr_pri_blocks=36483407_117004941_0_0_0__69350&from_sustainable_property_sr=1&from=searchresults#hotelTmpl,"La Casa del Patriarca se halla en un edificio del siglo XIX del centro de Valencia. Este establecimiento se sitúa a poca distancia de lugares de interés como el barrio del Carmen, el centro histórico de Valencia y la plaza del Ayuntamiento. Está en el distrito de Ciutat Vella.

Las habitaciones cuentan con baño privado y ducha. Algunas también tienen balcón.

A poca distancia a pie hay muchos bares, restaurantes y tiendas.

La Casa del Patriarca se encuentra junto al edificio histórico de la Universidad de Valencia y el palacio del siglo XVIII del Marqués de Dos Aguas, ahora Museo Nacional de Cerámica. El precioso colegio del Corpus Christi está a solo 100 metros.

La Ciudad de las Artes y las Ciencias se sitúa a 2,3 km del hotel, mientras que el Oceanogràfic se encuentra a 3 km. El aeropuerto de Valencia, situado a 9 km, es el más cercano.

Las llegadas tardías deben ser confirmadas por la propiedad, que proporcionará un código de acceso."
Zona Garbí,"a 2,9 km del centro","Eixample, Valencia",€ 470,"8,1",4 de 5,,https://www.booking.com/hotel/es/zona-garbi.es.html?aid=304142&label=gen173nr-1FCAEoggI46AdIClgEaEaIAQGYAQq4AQfIAQ_YAQHoAQH4AQKIAgGoAgO4Aurq-a0GwAIB0gIkYjQ4ODAyOGEtYThmNy00YzdmLWI3NGUtNzk5YTY3OWE1MjE22AIF4AIB&ucfs=1&arphpl=1&checkin=2024-02-25&checkout=2024-03-01&group_adults=2&req_adults=2&no_rooms=1&group_children=0&req_children=0&hpos=6&hapos=181&sr_order=popularity&srpvid=b17d79be562c0490&srepoch=1706980802&all_sr_blocks=1147595202_387593707_2_0_0&highlighted_blocks=1147595202_387593707_2_0_0&matching_block_id=1147595202_387593707_2_0_0&sr_pri_blocks=1147595202_387593707_2_0_0__46953&from=searchresults#hotelTmpl,"Zona Garbí se encuentra en Valencia, a 2,6 km de Church of Saint Nicolás y a 3,6 km de Basílica de la Virgen de los Desamparados, y ofrece alojamiento con wifi gratis, aire acondicionado y pista de tenis. Este apartamento está a 3,6 km de Jardines de Monforte y a 3,7 km de Jardín del Turia.

El apartamento cuenta con 2 dormitorios, una cocina con nevera y horno, y 1 baño con ducha, artículos de aseo gratuitos y lavadora. Hay toallas y ropa de cama en el apartamento.

Se puede descubrir la zona practicando ciclismo en los alrededores.

Museo Nacional de Cerámica y Artes Santuarias González Martí está a 3,9 km del alojamiento, y Bioparc Valencia está a 4,7 km. El aeropuerto más cercano (Aeropuerto de Valencia) está a 11 km del alojamiento."
Buenos Aires Apartments,a 1 km del centro,"Benicalap, Valencia",€ 539,"8,6",4 de 5,8 comentarios,https://www.booking.com/hotel/es/buenos-aires-apartments.es.html?aid=304142&label=gen173nr-1FCAEoggI46AdIClgEaEaIAQGYAQq4AQfIAQ_YAQHoAQH4AQKIAgGoAgO4Aurq-a0GwAIB0gIkYjQ4ODAyOGEtYThmNy00YzdmLWI3NGUtNzk5YTY3OWE1MjE22AIF4AIB&ucfs=1&arphpl=1&checkin=2024-02-25&checkout=2024-03-01&group_adults=2&req_adults=2&no_rooms=1&group_children=0&req_children=0&hpos=7&hapos=182&sr_order=popularity&srpvid=b17d79be562c0490&srepoch=1706980802&all_sr_blocks=362764801_118870128_2_0_0&highlighted_blocks=362764801_118870128_2_0_0&matching_block_id=362764801_118870128_2_0_0&sr_pri_blocks=362764801_118870128_2_0_0__53946&from=searchresults#hotelTmpl,"Buenos Aires Apartments está en Valencia, cerca de Estación de tren del Norte, Museo Nacional de Cerámica y Artes Santuarias González Martí, y Basílica de la Virgen de los Desamparados, y ofrece wifi gratis.

Jardín del Turia está a 2,4 km del alojamiento, y Jardines de Monforte está a 3 km. El aeropuerto (Aeropuerto de Valencia) está a 10 km, y el alojamiento ofrece servicio de traslado de pago para ir o volver del aeropuerto."
WeRentVLC - Amazing Duplex Loft 2 bdrm,"a 3,1 km del centro","Camins al Grau, Valencia",€ 620,"8,9",4 de 5,11 comentarios,https://www.booking.com/hotel/es/werentvlc-amazing-duplex-loft.es.html?aid=304142&label=gen173nr-1FCAEoggI46AdIClgEaEaIAQGYAQq4AQfIAQ_YAQHoAQH4AQKIAgGoAgO4Aurq-a0GwAIB0gIkYjQ4ODAyOGEtYThmNy00YzdmLWI3NGUtNzk5YTY3OWE1MjE22AIF4AIB&ucfs=1&arphpl=1&checkin=2024-02-25&checkout=2024-03-01&group_adults=2&req_adults=2&no_rooms=1&group_children=0&req_children=0&hpos=8&hapos=183&sr_order=popularity&srpvid=b17d79be562c0490&srepoch=1706980802&all_sr_blocks=957163201_373222173_3_0_0&highlighted_blocks=957163201_373222173_3_0_0&matching_block_id=957163201_373222173_3_0_0&sr_pri_blocks=957163201_373222173_3_0_0__62000&from=searchresults#hotelTmpl,"WeRentVLC - Amazing Duplex Loft 2 bdrm está en Valencia, a 3,4 km de Church of Saint Nicolás y a 3,7 km de Basílica de la Virgen de los Desamparados, y ofrece alojamiento con equipamiento como wifi gratis y TV de pantalla plana. El alojamiento ofrece vistas al jardín y está a 3,7 km de Jardines de Monforte y a 3,7 km de Jardín del Turia.

Este apartamento con aire acondicionado consta de 2 dormitorios, una sala de estar, una cocina totalmente equipada con nevera y cafetera, y 2 baños con ducha y secador de pelo. Hay toallas y ropa de cama en el apartamento.

Museo Nacional de Cerámica y Artes Santuarias González Martí está a 4,5 km del alojamiento, y Estación de tren del Norte está a 5,4 km. El aeropuerto (Aeropuerto de Valencia) está a 11 km."
Sercotel Valencia Alameda 41,"a 2,4 km del centro","La Saïdia, Valencia",€ 980,"9,0",4 de 5,2.864 comentarios,https://www.booking.com/hotel/es/alameda-science-boutique.es.html?aid=304142&label=gen173nr-1FCAEoggI46AdIClgEaEaIAQGYAQq4AQfIAQ_YAQHoAQH4AQKIAgGoAgO4Aurq-a0GwAIB0gIkYjQ4ODAyOGEtYThmNy00YzdmLWI3NGUtNzk5YTY3OWE1MjE22AIF4AIB&ucfs=1&arphpl=1&checkin=2024-02-25&checkout=2024-03-01&group_adults=2&req_adults=2&no_rooms=1&group_children=0&req_children=0&hpos=9&hapos=184&sr_order=popularity&srpvid=b17d79be562c0490&srepoch=1706980802&all_sr_blocks=401938101_329086050_2_2_0&highlighted_blocks=401938101_329086050_2_2_0&matching_block_id=401938101_329086050_2_2_0&sr_pri_blocks=401938101_329086050_2_2_0__98000&from_sustainable_property_sr=1&from=searchresults#hotelTmpl,"El Hotel Valencia Alameda 41 se sitúa en Valencia, a 200 metros de la Ciudad de las Artes y las Ciencias. El establecimiento cuenta con recepción 24 horas y un restaurante que sirve desayunos. Las habitaciones incluyen TV de pantalla plana vía satélite.

El hotel está situado en la 1.ª planta.

Las habitaciones disponen de baño privado con ducha, escritorio y microondas.

Todos los días se sirve un desayuno a la carta e inglés / irlandés completo.

El establecimiento alberga un centro de negocios.

El Hotel Valencia Alameda está a 1,5 km del puerto de Valencia. El aeropuerto de Valencia queda a 11,1 km del alojamiento."
Neobeds - NEW ! Amazing charming Cosy 1BR Apt Valencia,"a 1,5 km del centro","Camins al Grau, Valencia",€ 630,"8,5",4 de 5,72 comentarios,https://www.booking.com/hotel/es/neobeds-new-amazing-charming-cosy-1br-apt-valencia.es.html?aid=304142&label=gen173nr-1FCAEoggI46AdIClgEaEaIAQGYAQq4AQfIAQ_YAQHoAQH4AQKIAgGoAgO4Aurq-a0GwAIB0gIkYjQ4ODAyOGEtYThmNy00YzdmLWI3NGUtNzk5YTY3OWE1MjE22AIF4AIB&ucfs=1&arphpl=1&checkin=2024-02-25&checkout=2024-03-01&group_adults=2&req_adults=2&no_rooms=1&group_children=0&req_children=0&hpos=10&hapos=185&sr_order=popularity&srpvid=b17d79be562c0490&srepoch=1706980802&all_sr_blocks=900603903_360735044_2_0_0&highlighted_blocks=900603903_360735044_2_0_0&matching_block_id=900603903_360735044_2_0_0&sr_pri_blocks=900603903_360735044_2_0_0__62950&from=searchresults#hotelTmpl,"Neobeds - NEW! Amazing charming Cosy 1BR Apt Valencia está en Valencia, a 15 min a pie de Jardines de Monforte y a 1 km de Church of Saint Nicolás, y ofrece alojamiento con wifi gratis y zona de estar.

El alojamiento tiene aire acondicionado, cocina totalmente equipada y con zona de comedor, TV de pantalla plana y baño privado con ducha y secador de pelo. También hay nevera, lavavajillas y fogones, además de cafetera.

Cerca del alojamiento hay puntos de interés como Basílica de la Virgen de los Desamparados, Jardín del Turia y Museo Nacional de Cerámica y Artes Santuarias González Martí. El aeropuerto más cercano (Aeropuerto de Valencia) está a 9 km."
LUMEN MARE by SH Hoteles,"a 3,3 km del centro","Ciutat Vella, Valencia",€ 457,"8,0",3 de 5,,https://www.booking.com/hotel/es/shf-serreria.es.html?aid=304142&label=gen173nr-1FCAEoggI46AdIClgEaEaIAQGYAQq4AQfIAQ_YAQHoAQH4AQKIAgGoAgO4Aurq-a0GwAIB0gIkYjQ4ODAyOGEtYThmNy00YzdmLWI3NGUtNzk5YTY3OWE1MjE22AIF4AIB&ucfs=1&arphpl=1&checkin=2024-02-25&checkout=2024-03-01&group_adults=2&req_adults=2&no_rooms=1&group_children=0&req_children=0&hpos=11&hapos=186&sr_order=popularity&srpvid=b17d79be562c0490&srepoch=1706980802&all_sr_blocks=1023816301_374792634_2_0_0&highlighted_blocks=1023816301_374792634_2_0_0&matching_block_id=1023816301_374792634_2_0_0&sr_pri_blocks=1023816301_374792634_2_0_0__45700&from_sustainable_property_sr=1&from=searchresults#hotelTmpl,"LUMEN MARE by SH Hoteles se encuentra en Valencia, a 1,7 km de Playa de las Arenas y a 2,3 km de Playa de la Malvarrosa, y ofrece wifi gratis y aire acondicionado. Este apartamento está a 13 min a pie de Puerto de Valencia y a 3,4 km de Oceanográfico.

Este apartamento cuenta con vistas a la ciudad y también tiene TV de pantalla plana vía satélite, una cocina bien equipada con nevera, lavavajillas y horno, y 1 baño con ducha y artículos de aseo gratuitos.

Jardines de Monforte está a 3,9 km del alojamiento, y Jardín del Turia está a 4 km. El aeropuerto más cercano (Aeropuerto de Valencia) está a 13 km del alojamiento."
SH Suite Palace,a 400 m del centro,"Quatre Carreres, Valencia",€ 998,"8,6",4 de 5,683 comentarios,https://www.booking.com/hotel/es/sh-suite-palace.es.html?aid=304142&label=gen173nr-1FCAEoggI46AdIClgEaEaIAQGYAQq4AQfIAQ_YAQHoAQH4AQKIAgGoAgO4Aurq-a0GwAIB0gIkYjQ4ODAyOGEtYThmNy00YzdmLWI3NGUtNzk5YTY3OWE1MjE22AIF4AIB&ucfs=1&arphpl=1&checkin=2024-02-25&checkout=2024-03-01&group_adults=2&req_adults=2&no_rooms=1&group_children=0&req_children=0&hpos=12&hapos=187&sr_order=popularity&srpvid=b17d79be562c0490&srepoch=1706980802&all_sr_blocks=616255307_339582597_0_0_0&highlighted_blocks=616255307_339582597_0_0_0&matching_block_id=616255307_339582597_0_0_0&sr_pri_blocks=616255307_339582597_0_0_0__99800&from_sustainable_property_sr=1&from=searchresults#hotelTmpl,"SH Suite Palace está muy bien situado en el barrio de Ciutat Vella, Valencia, a menos de 1 km de Estación de tren del Norte, a 4 min a pie de Basílica de la Virgen de los Desamparados y a 1 km de Jardín del Turia. Este hotel de 3 estrellas ofrece recepción 24 horas y wifi gratis. El alojamiento está a 200 metros del centro de la ciudad y a pocos pasos de Museo Nacional de Cerámica y Artes Santuarias González Martí.

El hotel ofrece habitaciones con aire acondicionado, escritorio, caja fuerte, TV de pantalla plana, balcón y baño privado con ducha. En SH Suite Palace, las habitaciones están equipadas con ropa de cama y toallas.

Cerca del alojamiento hay puntos de interés como Jardines de Monforte, Church of Saint Nicolás y Plaza del Ayuntamiento. El aeropuerto más cercano (Aeropuerto de Valencia) está a 9 km."
NH Valencia Las Artes,"a 2,3 km del centro","Ciutat Vella, Valencia",€ 725,"8,8",4 de 5,4.247 comentarios,https://www.booking.com/hotel/es/nhlasartes.es.html?aid=304142&label=gen173nr-1FCAEoggI46AdIClgEaEaIAQGYAQq4AQfIAQ_YAQHoAQH4AQKIAgGoAgO4Aurq-a0GwAIB0gIkYjQ4ODAyOGEtYThmNy00YzdmLWI3NGUtNzk5YTY3OWE1MjE22AIF4AIB&ucfs=1&arphpl=1&checkin=2024-02-25&checkout=2024-03-01&group_adults=2&req_adults=2&no_rooms=1&group_children=0&req_children=0&hpos=13&hapos=188&sr_order=popularity&srpvid=b17d79be562c0490&srepoch=1706980802&all_sr_blocks=9073102_93708982_0_42_0&highlighted_blocks=9073102_93708982_0_42_0&matching_block_id=9073102_93708982_0_42_0&sr_pri_blocks=9073102_93708982_0_42_0__72455&from_sustainable_property_sr=1&from=searchresults#hotelTmpl,"Este hotel de diseño está situado a solo 5 minutos a pie de la Ciudad de las Artes y las Ciencias de Valencia. Cuenta con gimnasio, sauna, piscina cubierta y habitaciones con aire acondicionado, TV de plasma, WiFi gratuita y carta de almohadas.

El NH Valencia Las Artes se encuentra frente al centro comercial El Saler y a 5 km de la playa de la Malvarrosa. El establecimiento está cerca de la autopista A7 y bien comunicado en autobús con el centro de la ciudad.

El elegante restaurante del hotel sirve comida tradicional valenciana con un toque moderno. Hay un menú especial para niños.

El NH Las Artes cuenta con otras instalaciones para niños, como una sala de juegos. La recepción está abierta las 24 horas y ofrece servicios de cambio de divisa y alquiler de bicicletas."
Voghe Premium Flats,a 300 m del centro,"Poblados marítimos, Valencia",€ 765,"6,6",4 de 5,723 comentarios,https://www.booking.com/hotel/es/voghe-premium-flats.es.html?aid=304142&label=gen173nr-1FCAEoggI46AdIClgEaEaIAQGYAQq4AQfIAQ_YAQHoAQH4AQKIAgGoAgO4Aurq-a0GwAIB0gIkYjQ4ODAyOGEtYThmNy00YzdmLWI3NGUtNzk5YTY3OWE1MjE22AIF4AIB&ucfs=1&arphpl=1&checkin=2024-02-25&checkout=2024-03-01&group_adults=2&req_adults=2&no_rooms=1&group_children=0&req_children=0&hpos=14&hapos=189&sr_order=popularity&srpvid=b17d79be562c0490&srepoch=1706980802&all_sr_blocks=553865501_204479337_2_0_0&highlighted_blocks=553865501_204479337_2_0_0&matching_block_id=553865501_204479337_2_0_0&sr_pri_blocks=553865501_204479337_2_0_0__76500&from=searchresults#hotelTmpl,"Voghe Premium Flats se encuentra en Valencia, a menos de 1 km de Church of Saint Nicolás y a 600 metros del centro, y ofrece alojamiento con aire acondicionado, wifi gratis y terraza.

Cada unidad cuenta con cocina totalmente equipada con mesa de comedor, TV de pantalla plana con canales vía satélite y baño privado con ducha, artículos de aseo gratuitos y secador de pelo. También se ofrece nevera, microondas y fogones, además de cafetera y hervidor.

Cerca del alojamiento hay puntos de interés como Estación de tren del Norte, Jardín del Turia y Museo Nacional de Cerámica y Artes Santuarias González Martí. El aeropuerto (Aeropuerto de Valencia) está a 7 km, y el alojamiento ofrece servicio de traslado de pago para ir o volver del aeropuerto."
piso a 2 minutos de la playa,"a 4,1 km del centro","La Saïdia, Valencia",€ 459,"9,0",3 de 5,82 comentarios,https://www.booking.com/hotel/es/piso-cabanal.es.html?aid=304142&label=gen173nr-1FCAEoggI46AdIClgEaEaIAQGYAQq4AQfIAQ_YAQHoAQH4AQKIAgGoAgO4Aurq-a0GwAIB0gIkYjQ4ODAyOGEtYThmNy00YzdmLWI3NGUtNzk5YTY3OWE1MjE22AIF4AIB&ucfs=1&arphpl=1&checkin=2024-02-25&checkout=2024-03-01&group_adults=2&req_adults=2&no_rooms=1&group_children=0&req_children=0&hpos=15&hapos=190&sr_order=popularity&srpvid=b17d79be562c0490&srepoch=1706980802&all_sr_blocks=757288101_332680355_2_0_0&highlighted_blocks=757288101_332680355_2_0_0&matching_block_id=757288101_332680355_2_0_0&sr_pri_blocks=757288101_332680355_2_0_0__45900&from=searchresults#hotelTmpl,"Piso a 2 minutos de la playa se encuentra en el barrio de Poblados marítimos, en Valencia, y tiene aire acondicionado, balcón y vistas al mar. Este apartamento ofrece alojamiento con patio.

El apartamento cuenta con terraza y vistas a la ciudad, y dispone de 1 dormitorio, una sala de estar, TV de pantalla plana, una cocina equipada con nevera y horno, y 1 baño con ducha. Hay toallas y ropa de cama en el apartamento.

Cerca del alojamiento hay puntos de interés como Playa de las Arenas, Playa de la Malvarrosa y Puerto de Valencia. El aeropuerto más cercano (Aeropuerto de Valencia) está a 14 km."
Suites by Eric Olsan (Peset),"a 2,3 km del centro","Ciutat Vella, Valencia",€ 348,"8,4",4 de 5,88 comentarios,https://www.booking.com/hotel/es/estupendo-apartamento-wifi-free-1.es.html?aid=304142&label=gen173nr-1FCAEoggI46AdIClgEaEaIAQGYAQq4AQfIAQ_YAQHoAQH4AQKIAgGoAgO4Aurq-a0GwAIB0gIkYjQ4ODAyOGEtYThmNy00YzdmLWI3NGUtNzk5YTY3OWE1MjE22AIF4AIB&ucfs=1&arphpl=1&checkin=2024-02-25&checkout=2024-03-01&group_adults=2&req_adults=2&no_rooms=1&group_children=0&req_children=0&hpos=16&hapos=191&sr_order=popularity&srpvid=b17d79be562c0490&srepoch=1706980802&all_sr_blocks=472629602_329635190_0_0_0&highlighted_blocks=472629602_329635190_0_0_0&matching_block_id=472629602_329635190_0_0_0&sr_pri_blocks=472629602_329635190_0_0_0__34775&from=searchresults#hotelTmpl,"Suites by Eric Olsan (Peset) ofrece alojamiento bien equipado y con wifi gratis en Valencia, a 2,6 km de Church of Saint Nicolás y a 2,8 km de Basílica de la Virgen de los Desamparados.

Todas las unidades tienen aire acondicionado y disponen de baño privado, TV de pantalla plana y cocina totalmente equipada.

Jardín del Turia está a 2,9 km del alojamiento, y Jardines de Monforte está a 3 km. El aeropuerto más cercano (Aeropuerto de Valencia) está a 12 km."
Apartamentos Wallace,a 100 m del centro,"Extramurs, Valencia",€ 972,"8,8",4 de 5,1.323 comentarios,https://www.booking.com/hotel/es/apartamentos-waldorf.es.html?aid=304142&label=gen173nr-1FCAEoggI46AdIClgEaEaIAQGYAQq4AQfIAQ_YAQHoAQH4AQKIAgGoAgO4Aurq-a0GwAIB0gIkYjQ4ODAyOGEtYThmNy00YzdmLWI3NGUtNzk5YTY3OWE1MjE22AIF4AIB&ucfs=1&arphpl=1&checkin=2024-02-25&checkout=2024-03-01&group_adults=2&req_adults=2&no_rooms=1&group_children=0&req_children=0&hpos=17&hapos=192&sr_order=popularity&srpvid=b17d79be562c0490&srepoch=1706980802&all_sr_blocks=169835501_368949842_2_0_0&highlighted_blocks=169835501_368949842_2_0_0&matching_block_id=169835501_368949842_2_0_0&sr_pri_blocks=169835501_368949842_2_0_0__97200&from_sustainable_property_sr=1&from=searchresults#hotelTmpl,"El establecimiento Apartamentos Wallace ofrece aire acondicionado y WiFi gratuita y se encuentra en Valencia, a 700 metros del barrio de El Carmen. La Ciudad de las Artes y las Ciencias queda a 2,4 km.

Los alojamientos cuentan con zona de estar, cocina con microondas y nevera, y baño privado con ducha. Se ofrecen toallas y ropa de cama. El servicio de limpieza conlleva un suplemento.

El parque zoológico Bioparc Valencia se encuentra a 3,1 km del Apartamentos Wallace, y el aeropuerto de Valencia queda a 9 km."
Marvellous Apt with a Large Private Terrace,"a 1,5 km del centro","Extramurs, Valencia",€ 687,"7,6",4 de 5,31 comentarios,https://www.booking.com/hotel/es/marvellous-apt-with-a-large-private-terrace.es.html?aid=304142&label=gen173nr-1FCAEoggI46AdIClgEaEaIAQGYAQq4AQfIAQ_YAQHoAQH4AQKIAgGoAgO4Aurq-a0GwAIB0gIkYjQ4ODAyOGEtYThmNy00YzdmLWI3NGUtNzk5YTY3OWE1MjE22AIF4AIB&ucfs=1&arphpl=1&checkin=2024-02-25&checkout=2024-03-01&group_adults=2&req_adults=2&no_rooms=1&group_children=0&req_children=0&hpos=18&hapos=193&sr_order=popularity&srpvid=b17d79be562c0490&srepoch=1706980802&all_sr_blocks=831211902_348290617_2_0_0&highlighted_blocks=831211902_348290617_2_0_0&matching_block_id=831211902_348290617_2_0_0&sr_pri_blocks=831211902_348290617_2_0_0__68725&from=searchresults#hotelTmpl,"Marvellous Apt with a Large Private Terrace está en Valencia, cerca de Church of Saint Nicolás, Estación de tren del Norte, y Basílica de la Virgen de los Desamparados, y ofrece wifi gratis.

Las unidades están equipadas con terraza y ofrecen aire acondicionado, TV y baño privado con ducha y secador de pelo. También hay nevera, lavavajillas y microondas en la cocina, además de cafetera.

Jardines de Monforte está a 3,3 km del alojamiento, y Jardín del Turia está a 3,4 km. El aeropuerto más cercano (Aeropuerto de Valencia) está a 8 km."
"Chic & Comfortable Apartment, Private Terrace","a 1,5 km del centro","Ciutat Vella, Valencia",€ 725,"7,9",3 de 5,44 comentarios,https://www.booking.com/hotel/es/chic-comfortable-apartment-private-terrace.es.html?aid=304142&label=gen173nr-1FCAEoggI46AdIClgEaEaIAQGYAQq4AQfIAQ_YAQHoAQH4AQKIAgGoAgO4Aurq-a0GwAIB0gIkYjQ4ODAyOGEtYThmNy00YzdmLWI3NGUtNzk5YTY3OWE1MjE22AIF4AIB&ucfs=1&arphpl=1&checkin=2024-02-25&checkout=2024-03-01&group_adults=2&req_adults=2&no_rooms=1&group_children=0&req_children=0&hpos=19&hapos=194&sr_order=popularity&srpvid=b17d79be562c0490&srepoch=1706980802&all_sr_blocks=831208402_348290359_2_0_0&highlighted_blocks=831208402_348290359_2_0_0&matching_block_id=831208402_348290359_2_0_0&sr_pri_blocks=831208402_348290359_2_0_0__72505&from=searchresults#hotelTmpl,"Chic & Comfortable Apartment, Private Terrace está en Valencia, a 17 min a pie de Church of Saint Nicolás, y ofrece alojamiento con aire acondicionado y wifi gratis, además de acceso a la terraza.

Todas las unidades tienen cocina totalmente equipada con cafetera, sala de estar con TV y baño privado con secador de pelo y ducha. También hay nevera, lavavajillas y microondas, además de hervidor.

Cerca del alojamiento hay puntos de interés como Estación de tren del Norte, Basílica de la Virgen de los Desamparados y Museo Nacional de Cerámica y Artes Santuarias González Martí. El aeropuerto (Aeropuerto de Valencia) está a 8 km."
APARTMENT IN OLD CITY / 1TH FLOOR / TERRACE 4 TH FLOOR / PLAZA LA REINA,"a 0,6 km del centro","Poblados marítimos, Valencia",€ 518,"8,8",4 de 5,58 comentarios,https://www.booking.com/hotel/es/apartment-in-old-city-1th-floor-terrace-4-th-floor-plaza-la-reina.es.html?aid=304142&label=gen173nr-1FCAEoggI46AdIClgEaEaIAQGYAQq4AQfIAQ_YAQHoAQH4AQKIAgGoAgO4Aurq-a0GwAIB0gIkYjQ4ODAyOGEtYThmNy00YzdmLWI3NGUtNzk5YTY3OWE1MjE22AIF4AIB&ucfs=1&arphpl=1&checkin=2024-02-25&checkout=2024-03-01&group_adults=2&req_adults=2&no_rooms=1&group_children=0&req_children=0&hpos=20&hapos=195&sr_order=popularity&srpvid=b17d79be562c0490&srepoch=1706980802&all_sr_blocks=831941001_348393545_2_0_0&highlighted_blocks=831941001_348393545_2_0_0&matching_block_id=831941001_348393545_2_0_0&sr_pri_blocks=831941001_348393545_2_0_0__51750&from=searchresults#hotelTmpl,"APARTMENT IN OLD CITY / 1TH FLOOR / TERRACE 4 TH FLOOR / PLAZA LA REINA ofrece alojamiento con una ubicación ideal en el centro de Valencia y tiene terraza. Este apartamento ofrece alojamiento con balcón.

Este apartamento con aire acondicionado consta de 1 dormitorio independiente, una sala de estar, una cocina totalmente equipada y 1 baño. Hay TV de pantalla plana.

Cerca del alojamiento hay puntos de interés como Estación de tren del Norte, Church of Saint Nicolás y Jardín del Turia. El aeropuerto (Aeropuerto de Valencia) está a 8 km."
Flatsforyou Marina Playa,"a 3,5 km del centro","Camins al Grau, Valencia",€ 550,"8,3",4 de 5,962 comentarios,https://www.booking.com/hotel/es/flats-bed-and-bike.es.html?aid=304142&label=gen173nr-1FCAEoggI46AdIClgEaEaIAQGYAQq4AQfIAQ_YAQHoAQH4AQKIAgGoAgO4Aurq-a0GwAIB0gIkYjQ4ODAyOGEtYThmNy00YzdmLWI3NGUtNzk5YTY3OWE1MjE22AIF4AIB&ucfs=1&arphpl=1&checkin=2024-02-25&checkout=2024-03-01&group_adults=2&req_adults=2&no_rooms=1&group_children=0&req_children=0&hpos=21&hapos=196&sr_order=popularity&srpvid=b17d79be562c0490&srepoch=1706980802&all_sr_blocks=179301205_329724677_0_0_0&highlighted_blocks=179301205_329724677_0_0_0&matching_block_id=179301205_329724677_0_0_0&sr_pri_blocks=179301205_329724677_0_0_0__55000&from=searchresults#hotelTmpl,"El Flatsforyou Bed and Bike Marina dispone de WiFi gratuita en todas las zonas y se encuentra en Valencia. El puerto de Valencia está a 500 metros del establecimiento.

El alojamiento incluye zona de estar y de comedor, y hay tostadora, nevera, fogones, cafetera y hervidor de agua. Todos los alojamientos tienen cocina con horno y microondas, y baño privado con secador de pelo. Se proporcionan toallas y ropa de cama.

El Flatsforyou Bed and Bike Marina se halla a 1,2 km de l'Oceanogràfic y a 1,4 km de la Ciudad de las Artes y las Ciencias. El aeropuerto de Valencia es el más cercano y está a 12 km del Flatsforyou Bed and Bike Marina."
Travel Habitat Alameda Suites.,"a 1,8 km del centro","Extramurs, Valencia",€ 666,"5,3",4 de 5,183 comentarios,https://www.booking.com/hotel/es/travel-habitat-alameda-suites.es.html?aid=304142&label=gen173nr-1FCAEoggI46AdIClgEaEaIAQGYAQq4AQfIAQ_YAQHoAQH4AQKIAgGoAgO4Aurq-a0GwAIB0gIkYjQ4ODAyOGEtYThmNy00YzdmLWI3NGUtNzk5YTY3OWE1MjE22AIF4AIB&ucfs=1&arphpl=1&checkin=2024-02-25&checkout=2024-03-01&group_adults=2&req_adults=2&no_rooms=1&group_children=0&req_children=0&hpos=22&hapos=197&sr_order=popularity&srpvid=b17d79be562c0490&srepoch=1706980802&all_sr_blocks=885188307_357972187_2_0_0&highlighted_blocks=885188307_357972187_2_0_0&matching_block_id=885188307_357972187_2_0_0&sr_pri_blocks=885188307_357972187_2_0_0__66569&from_sustainable_property_sr=1&from=searchresults#hotelTmpl,"Travel Habitat Alameda Suites. Se encuentra en Valencia, cerca de Jardín del Turia, Jardines de Monforte, y Oceanográfico, y ofrece wifi gratis.

El alojamiento está equipado con TV de pantalla plana y baño privado con ducha y secador de pelo. La cocina dispone de nevera, lavavajillas y horno. Todas las unidades tienen aire acondicionado e incluyen zona de estar y/o de comedor.

El apartamento ofrece servicio de alquiler de bicicletas.

Estación de tren del Norte está a 2,6 km del alojamiento, y Puerto de Valencia está a 3 km. El aeropuerto más cercano (Aeropuerto de Valencia) está a 11 km del alojamiento, que ofrece servicio de traslado de pago para ir o volver del aeropuerto."
