Hotels,Distance,District,Price,Rating,Stars,Comments,Link,Descriptions
Valencia Luxury - Sea Port II,"a 2,4 km del centro","Camins al Grau, Valencia",€ 796,"7,8",3 de 5,686 comentarios,https://www.booking.com/hotel/es/sea-port-ii.es.html?aid=304142&label=gen173nr-1FCAEoggI46AdIClgEaEaIAQGYAQq4AQfIAQ_YAQHoAQH4AQKIAgGoAgO4Aurq-a0GwAIB0gIkYjQ4ODAyOGEtYThmNy00YzdmLWI3NGUtNzk5YTY3OWE1MjE22AIF4AIB&ucfs=1&arphpl=1&checkin=2024-02-25&checkout=2024-03-01&group_adults=2&req_adults=2&no_rooms=1&group_children=0&req_children=0&hpos=1&hapos=1&sr_order=popularity&srpvid=b17d79be562c0490&srepoch=1706980735&all_sr_blocks=755953201_332431840_2_0_0&highlighted_blocks=755953201_332431840_2_0_0&matching_block_id=755953201_332431840_2_0_0&sr_pri_blocks=755953201_332431840_2_0_0__79647&from=searchresults#hotelTmpl,"Valencia Luxury - Sea Port II se encuentra en el barrio de Camins al Grau, en Valencia, a 2,8 km de Playa de las Arenas, a 1,7 km de Puerto de Valencia y a 1,8 km de Jardín del Turia. Dispone de terraza, vistas a la ciudad y wifi gratis en todo el alojamiento.

Este apartamento con aire acondicionado consta de 1 dormitorio, una sala de estar, una cocina totalmente equipada con nevera y cafetera, y 1 baño con ducha y artículos de aseo gratuitos. Se ofrece TV de pantalla plana.

El apartamento ofrece servicio de alquiler de bicicletas.

Jardines de Monforte está a 2,7 km del alojamiento, y Oceanográfico está a 2 km. El aeropuerto más cercano (Aeropuerto de Valencia) está a 12 km del alojamiento, que ofrece servicio de traslado de pago para ir o volver del aeropuerto."
Melia Valencia,"a 3,5 km del centro","Benicalap, Valencia",€ 1.409,"8,5",4 de 5,3.437 comentarios,https://www.booking.com/hotel/es/melia-valencia.es.html?aid=304142&label=gen173nr-1FCAEoggI46AdIClgEaEaIAQGYAQq4AQfIAQ_YAQHoAQH4AQKIAgGoAgO4Aurq-a0GwAIB0gIkYjQ4ODAyOGEtYThmNy00YzdmLWI3NGUtNzk5YTY3OWE1MjE22AIF4AIB&ucfs=1&arphpl=1&checkin=2024-02-25&checkout=2024-03-01&group_adults=2&req_adults=2&no_rooms=1&group_children=0&req_children=0&hpos=2&hapos=2&sr_order=popularity&srpvid=b17d79be562c0490&srepoch=1706980735&all_sr_blocks=29049324_91989386_2_33_0&highlighted_blocks=29049324_91989386_2_33_0&matching_block_id=29049324_91989386_2_33_0&sr_pri_blocks=29049324_91989386_2_33_0__140900&nad_id=7d349af0-4ea8-4824-a9ac-c3ce0c47fd2e_0&nad_cpc=0.5&nad_track=eyJyYW5rIjoxLCJrb2RkaVRyYWNraW5nSW5mbyI6IlB5UlVqV1o1YjJKVy9iU0pEa0U0TGh3SkJvWWYvTlNGL2JGN0owckZKaER1VGZyTExTNXk0N1gwUjdlbGFqNytMOXl0RStBdU9TK3psNGgzcXl2Y01jVnQvbFZRVXZ6dFRTVndxbkpHSnVEZ0p5R2Y0cHVKb2tzSE1hd1FDR21nU09kaFJpQU9SUDRJWGxKR3E1eUN2S2RWKzIwakJuSnBzeHVuc2dJY2hBY25obkluZlFQOWEzQnhZcmt4RWRGNUJkajhaSVBWSWd2aUNQUjF6eTczMEZVNS82SlA5elRtL0tDeS9wQkx5WmN2QUlOV0RGVm9tN2ZDcWZ0R3RacHBiRS8waVJTblJLMEs2MEI0TWM5ZWdMMzhSTnZibWgrNC9pYkZnNy9xQVYxTEVQQjRzdjJxRkFmbFZXaVJJVGEyMElUT050MFdNd1JuUnI2YXFGZkFRNGh4RzJ5amVja011a25nWHU1cEl0aVZLYUhYTzE0Vk1QWEhySDlSWHRCSFlGU2JUSXlVaVBqWUwrTUZtcTNrOFlsY0lkeXdhMXpYdTd3VU95eFo5bitSWnkzd2lkbWMrWUNoUSt1Zk5JajBmRlNyN1JrRURJSXk0ekd4ZjNuVUpMc0o4NG9KaXIxby9SZ1l0bWNwR3lJOEs4U2FhZnc5eHI1bVppUm1OME8yWXhrRTd4OW1BWU9IdzhLWlRFemhYanZkMHE3eDNIWnNhODIyclpqOUFZYmMvZmZhVU1paUhJeGRNb0JpZzhaZVovSG9LeiswZ1pIcDlJanNOTGhHRGx0UE5Md3crcTF2dmNmS0ZObEhGVnpjOWVPUWIxREQvQk4yQStxaElYTHNYcU1MczlKMGkzelVuQVo1cnU1SERHNjVEdnN5ZWk5dVV4V1JHSDdQVG5JY2tGUXZKYnZRNm5rRThmR3Z6WFAwaDBzeFIzeUQzM2ZseXJmK2szSGdOZEoxeEtCQ1pHYmdTNHp1b1FlNlI3MmVEMUJYeXVKRzhZVVpoM2UxMnprNUd0MXgxRENJNEpNZTVVTHdBM3I1LzNHeU5BRmpnbllXTHd6bDY4N1hvU2YxWjBZSkdVUUZoQSswU2hneEtkT1FtNXViWVRKZXBZck9oNXRPSHUrMkxKdFQ3WU8zOVkrSjNqVkUvYVgrQXV0TUZzVmtYVmMyRHAyOFZZZUNQbEgybWpZU1kwZXBNYzdZSUg0Wm44aWYwZ1hzQTBBeFNQR00xem1FL2NLZHhVKzhiaElsVmpLMExNVnNSSDN0aUdKWDFCOVc1Vjl2V1VkZGRBcjc4d0VINkFiRmFnTUxob25sMy9MRkpGZk5wTGdwVi94R0w4c1o3endVc2tXMERJQlErbjFUYlFkb0VDZlBNejVDRDFKNU1kZEhTTDcrU2xvVEQwaFdEdVFnWVhvZUNpdy9kWCthOWtERzQ2YmZidTVxa05DUUorQWplTHNQQURXSTlIWUg2eDZON0hNNUhkVm9IbWtzQTdLak90c1pQN3dhK1QzekVZOFhjSUpheWRRR1lYQUZRVEpnekp2QjFRTHkzbG5Fa1krb2wwelV3Yk5rUnAyYVp5dUMyN2c1bmwzNWIzYmo5M1pwSTY5dUgxSmhhbEs3VDE3QlZyZ1ZzNUZSRG44RWZQVFJja2NqQ1ZIY0l6NDJHT2NvRVJrcFJIeHR4RERpNWZvd3B1blAzNmZIUnZmT3E1RWR6V3RqK1FmbE9KWlpzY014SWRRcEVFYld6NFFOMnNpZTh2Uk4wdHJSWHpONjVMVDUzSUpReEZOQ2d1clQ0N2RkKzVvdjJ5UlgzTFAwVXhHaVZYeGlCOHN5ZEpyb012NENLeE05YWV3NEhtdFNWSm9Qd2xqc1pSditqSmlWVk9xRWxXSDRKeTNwc3ZKem5VZEhGUGgyWHZnOE9aYzNrbzNWMWlRVE5qS05RdTRjS0FrdmlvUlJta3U0VTY5N1RWdlNiREJQdTRPTTJITmtVU2ZJNldOQ0wveElEcWJDaXBzZURqVmxlS3ZzRVVRMzl2bWNwdlQ3SzA3ZFI4K0pESzNEdmN0d0RqaGtWK0w1NmZDV1hGZnB1eDVvb2g1VzIvV3F4TTcxd01WbUt0a2RTTHV3U1EvOFp6dG5rTnYwb3V3S01Vam80R3hVd1pKaHlzaFQyU3AvNjNnVEh6Y0FYYXBIRkRyaHFCV0JFWWlFVWpDdysvd2o1c2hYakxqT2FHUDVuZzBOOUJQUXVobUFnMmFaRzd6RmNjMEtIZ3lDaXk2Q1Fjc3hFQWtON3dKNFlyMWRwQzhHd25GUDE5RmtXbHBudkJnc0hTWVA5YXliQm5EWk1nTGpzS1lnZU5KaW50UmFKK3FERGhNTjlSa25QNFRpNEJvVGJOWkhqMFNyT0FrNVQzc1dkNVZnNWwzK0crWGVVOU9HRThwaFlQamtndDZNSTBqcTZHSHE0ZkFGMHFIdmE0cXRUemRuajRmZDZRQ0RGMm0vei9aNnZoOHVhNDZ1STFQZkQxTWxuU253dzhFeWk0QkZ6TFZhY29xODAreUljcW56TzJhNUswYlBZMHJLZ0RlMnNRcHdFYzRJeHVXaDFaVk4vMG45YlJYVTdRdDQvRmQ4UnhNMjEzS3NYQ2hGV3FXT283NmxtMWVGL0hFRXM5bmpyREVVejdJT3V4SE41dFBHUWhGK3hLbmRPRTVLUUloMHNOYW8yZVdyZVliNHhFUkdpVHVGeUE3TTVFT2lTblZPeXpBaGJRdXh1RDRnUXBUVDRvNXZHREJwaWhHbHNnRGhwdmZFYmZnM01rYWpGUDhDWldad0RNTHVFVDBaYyt6aVNiNVpvQXZxRTZFS1cxd2hUQng2a2VnMS8vOWEzZjJQMEJjcXBpNDErK1E3TFQyUGsxYmFGQ3ZsSmJ0aTFvY3UrSHlkRk1mRXIyejN4akZWeXFHZGZxcXdaMDJiWlNHUTErT1lpRlZ5ZmYvOElnMEJZaWxIT0VOc3ZZMnNZblBUbTQ3TFRjdnJWeSs3cFlkWGV2MmsyQnBYY08zUms5OEFSTTFOT2ViTmw4Y2VaaUpDN2VZOTI4UnFUSllBakFIckJEOG1MWlJmNjArVTVjdUtMa015UEw0TGxvOFpXTmk4NGtRNUdla09iOC81L1cvbEtiYWhtSEEzc2JNVWl3Y1dKbnNJQXpWWFp5WjV0ajVYNEttSHJTWVFqbUw4NVFaeDRNcllyeGt2U29tOVRWWlFTZmRPVHY2aEFZTk5uU0NzY0R3b09TR0IybnJQdGJHLyJ9&from_sustainable_property_sr=1&from=searchresults#hotelTmpl,"Este Meliá es un hotel moderno situado junto al Palacio de Congresos de Valencia, a 5 km de la estación de tren del AVE. La estación de metro de Beniferri se encuentra a solo 400 metros.

Las habitaciones son amplias y presentan un diseño moderno. Ofrecen unas vistas espectaculares y tienen TV de pantalla plana de 49 pulgadas con canales vía satélite. Todas disponen de aire acondicionado, WiFi gratuita y baño moderno.

El hotel cuenta con una zona de juegos infantiles. Hay salas de reuniones disponibles. Algunas zonas del hotel albergan habitaciones The Level y servicios exclusivos, como una zona privada para hacer el registro de entrada y de salida, desayuno buffet exclusivo, aperitivos y bebidas a diario en la zona privada y servicio de conserjería y organización de actividades en el hotel y la ciudad.

El aeropuerto internacional de Manises está a solo 15 minutos en coche del Meliá Valencia.

El hotel alberga el restaurante Socarrat, especializado en paellas valencianas y en cocina mediterránea e internacional. El bar Oval ofrece una pequeña carta de aperitivos y bebidas durante todo el día."
Hermoso apartamento,"a 3,4 km del centro","Quatre Carreres, Valencia",€ 518,"8,6",3 de 5,35 comentarios,https://www.booking.com/hotel/es/hermoso-apartamento-valencia1.es.html?aid=304142&label=gen173nr-1FCAEoggI46AdIClgEaEaIAQGYAQq4AQfIAQ_YAQHoAQH4AQKIAgGoAgO4Aurq-a0GwAIB0gIkYjQ4ODAyOGEtYThmNy00YzdmLWI3NGUtNzk5YTY3OWE1MjE22AIF4AIB&ucfs=1&arphpl=1&checkin=2024-02-25&checkout=2024-03-01&group_adults=2&req_adults=2&no_rooms=1&group_children=0&req_children=0&hpos=3&hapos=3&sr_order=popularity&srpvid=b17d79be562c0490&srepoch=1706980735&all_sr_blocks=1037762901_376290876_2_0_0&highlighted_blocks=1037762901_376290876_2_0_0&matching_block_id=1037762901_376290876_2_0_0&sr_pri_blocks=1037762901_376290876_2_0_0__51840&from=searchresults#hotelTmpl,"Hermoso apartamento se encuentra en Valencia, a 4,2 km de Estación de tren del Norte y a 4,7 km de Oceanográfico, y ofrece alojamiento con wifi gratis, aire acondicionado y jardín. Este apartamento también tiene piscina privada.

El apartamento dispone de terraza, 2 dormitorios, sala de estar y cocina bien equipada con nevera. Se ofrece TV de pantalla plana.

Museo Nacional de Cerámica y Artes Santuarias González Martí está a 5,4 km del alojamiento, y Basílica de la Virgen de los Desamparados está a 5,5 km. El aeropuerto más cercano (Aeropuerto de Valencia) está a 10 km del alojamiento."
Hi Sweet room,a 3 km del centro,"Rascanya, Valencia",€ 252,"8,4",3 de 5,382 comentarios,https://www.booking.com/hotel/es/aladin-piso.es.html?aid=304142&label=gen173nr-1FCAEoggI46AdIClgEaEaIAQGYAQq4AQfIAQ_YAQHoAQH4AQKIAgGoAgO4Aurq-a0GwAIB0gIkYjQ4ODAyOGEtYThmNy00YzdmLWI3NGUtNzk5YTY3OWE1MjE22AIF4AIB&ucfs=1&arphpl=1&checkin=2024-02-25&checkout=2024-03-01&group_adults=2&req_adults=2&no_rooms=1&group_children=0&req_children=0&hpos=4&hapos=4&sr_order=popularity&srpvid=b17d79be562c0490&srepoch=1706980735&all_sr_blocks=582399302_329666566_2_0_0&highlighted_blocks=582399302_329666566_2_0_0&matching_block_id=582399302_329666566_2_0_0&sr_pri_blocks=582399302_329666566_2_0_0__25245&from_sustainable_property_sr=1&from=searchresults#hotelTmpl,"Hi Sweet room se encuentra en Valencia, a 3,4 km de Jardines de Monforte y a 3,6 km de Church of Saint Nicolás, y ofrece alojamiento con wifi gratis, aire acondicionado, salón de uso común y terraza.

Para mayor comodidad, el alojamiento puede ofrecer toallas y ropa de cama por un suplemento.

Basílica de la Virgen de los Desamparados está a 3,9 km del alojamiento, y Jardín del Turia está a 3,9 km. El aeropuerto más cercano (Aeropuerto de Valencia) está a 12 km del alojamiento."
Zerka Centro,a 250 m del centro,"Ciutat Vella, Valencia",€ 329,"7,7",3 de 5,1.977 comentarios,https://www.booking.com/hotel/es/rumbau-center-2-valencia.es.html?aid=304142&label=gen173nr-1FCAEoggI46AdIClgEaEaIAQGYAQq4AQfIAQ_YAQHoAQH4AQKIAgGoAgO4Aurq-a0GwAIB0gIkYjQ4ODAyOGEtYThmNy00YzdmLWI3NGUtNzk5YTY3OWE1MjE22AIF4AIB&ucfs=1&arphpl=1&checkin=2024-02-25&checkout=2024-03-01&group_adults=2&req_adults=2&no_rooms=1&group_children=0&req_children=0&hpos=5&hapos=5&sr_order=popularity&srpvid=b17d79be562c0490&srepoch=1706980735&all_sr_blocks=442597502_132379667_2_0_0&highlighted_blocks=442597502_132379667_2_0_0&matching_block_id=442597502_132379667_2_0_0&sr_pri_blocks=442597502_132379667_2_0_0__32900&from=searchresults#hotelTmpl,"Zerka Centro ofrece alojamiento con aire acondicionado en el centro de Valencia, a 8 min a pie de Estación de tren del Norte, a 700 metros de Church of Saint Nicolás y a 17 min a pie de Jardín del Turia. Hay wifi gratis.

El alojamiento dispone de cocina totalmente equipada con nevera y cafetera, TV de pantalla plana y baño privado con ducha.

Cerca del alojamiento hay puntos de interés como Museo Nacional de Cerámica y Artes Santuarias González Martí, Basílica de la Virgen de los Desamparados y Jardines de Monforte. El aeropuerto (Aeropuerto de Valencia) está a 8 km."
B&B El Mercat,a 500 m del centro,"Ciutat Vella, Valencia",€ 210,"6,2",2 de 5,632 comentarios,https://www.booking.com/hotel/es/b-amp-b-el-mercat.es.html?aid=304142&label=gen173nr-1FCAEoggI46AdIClgEaEaIAQGYAQq4AQfIAQ_YAQHoAQH4AQKIAgGoAgO4Aurq-a0GwAIB0gIkYjQ4ODAyOGEtYThmNy00YzdmLWI3NGUtNzk5YTY3OWE1MjE22AIF4AIB&ucfs=1&arphpl=1&checkin=2024-02-25&checkout=2024-03-01&group_adults=2&req_adults=2&no_rooms=1&group_children=0&req_children=0&hpos=6&hapos=6&sr_order=popularity&srpvid=b17d79be562c0490&srepoch=1706980735&all_sr_blocks=220353001_265010488_2_0_0&highlighted_blocks=220353001_265010488_2_0_0&matching_block_id=220353001_265010488_2_0_0&sr_pri_blocks=220353001_265010488_2_0_0__21000&from=searchresults#hotelTmpl,"El B&B El Mercat se encuentra en el distrito Ciudad Vieja de Valencia, a 600 metros del barrio de El Carmen y a 2,7 km de Bioparc Valencia.

Hay 3 baños compartidos a disposición de los huéspedes, y artículos de aseo gratuitos y secador de pelo. El B&B El Mercat proporciona WiFi gratuita en todo el establecimiento.

Las instalaciones incluyen consigna de equipaje.

El B&B El Mercat se halla a 2,9 km de la Ciudad de las Artes y las Ciencias, a 3,6 km de l'Oceanogràfic y a 8 km del aeropuerto de Valencia."
Rotaret,a 150 m del centro,"Ciutat Vella, Valencia",€ 245,"7,8",3 de 5,2.340 comentarios,https://www.booking.com/hotel/es/rotaret.es.html?aid=304142&label=gen173nr-1FCAEoggI46AdIClgEaEaIAQGYAQq4AQfIAQ_YAQHoAQH4AQKIAgGoAgO4Aurq-a0GwAIB0gIkYjQ4ODAyOGEtYThmNy00YzdmLWI3NGUtNzk5YTY3OWE1MjE22AIF4AIB&ucfs=1&arphpl=1&checkin=2024-02-25&checkout=2024-03-01&group_adults=2&req_adults=2&no_rooms=1&group_children=0&req_children=0&hpos=7&hapos=7&sr_order=popularity&srpvid=b17d79be562c0490&srepoch=1706980735&all_sr_blocks=688855808_310566868_0_0_0&highlighted_blocks=688855808_310566868_0_0_0&matching_block_id=688855808_310566868_0_0_0&sr_pri_blocks=688855808_310566868_0_0_0__24500&from=searchresults#hotelTmpl,"Rotaret está muy bien situado en el barrio de Ciutat Vella, Valencia, a 16 min a pie de Jardín del Turia, a 600 metros de Museo Nacional de Cerámica y Artes Santuarias González Martí y a 12 min a pie de Basílica de la Virgen de los Desamparados. Este alojamiento se encuentra muy cerca de lugares de interés como Jardines de Monforte, Church of Saint Nicolás y Plaza del Ayuntamiento. El alojamiento está a 700 metros del centro de la ciudad y a 3 min a pie de Estación de tren del Norte.

Las habitaciones del alojamiento tienen baño compartido con ducha y artículos de aseo gratuitos. También ofrecen wifi gratis, y algunas de las habitaciones están equipadas con vistas a la ciudad. En el hostal o pensión, cada habitación está equipada con zona de estar.

Oceanográfico está a 4,4 km del alojamiento, y Puerto de Valencia está a 4,6 km. El aeropuerto más cercano (Aeropuerto de Valencia) está a 8 km del alojamiento."
City Center Guest house,"a 1,6 km del centro","La Saïdia, Valencia",€ 273,"6,7",3 de 5,700 comentarios,https://www.booking.com/hotel/es/the-towers-of-serrano-home.es.html?aid=304142&label=gen173nr-1FCAEoggI46AdIClgEaEaIAQGYAQq4AQfIAQ_YAQHoAQH4AQKIAgGoAgO4Aurq-a0GwAIB0gIkYjQ4ODAyOGEtYThmNy00YzdmLWI3NGUtNzk5YTY3OWE1MjE22AIF4AIB&ucfs=1&arphpl=1&checkin=2024-02-25&checkout=2024-03-01&group_adults=2&req_adults=2&no_rooms=1&group_children=0&req_children=0&hpos=8&hapos=8&sr_order=popularity&srpvid=b17d79be562c0490&srepoch=1706980735&all_sr_blocks=780373001_337599695_2_0_0&highlighted_blocks=780373001_337599695_2_0_0&matching_block_id=780373001_337599695_2_0_0&sr_pri_blocks=780373001_337599695_2_0_0__27250&from=searchresults#hotelTmpl,"City Center Guest house se encuentra en Valencia, a 13 min a pie de Church of Saint Nicolás y a menos de 1 km de Basílica de la Virgen de los Desamparados, y ofrece alojamiento con wifi gratis. Cerca hay lugares de interés populares como Jardín del Turia, Museo Nacional de Cerámica y Artes Santuarias González Martí y Torres de Serranos. Este alojamiento libre de humo está a 16 min a pie de Jardines de Monforte.

En el hostal o pensión, las habitaciones tienen baño privado.

Estación de tren del Norte está a 4,3 km del alojamiento, y Bioparc Valencia está a 5 km. El aeropuerto (Aeropuerto de Valencia) está a 9 km."
Balcón Al Mar,"a 3,8 km del centro","Poblados marítimos, Valencia",€ 384,"8,3",4 de 5,686 comentarios,https://www.booking.com/hotel/es/balcon-al-mar.es.html?aid=304142&label=gen173nr-1FCAEoggI46AdIClgEaEaIAQGYAQq4AQfIAQ_YAQHoAQH4AQKIAgGoAgO4Aurq-a0GwAIB0gIkYjQ4ODAyOGEtYThmNy00YzdmLWI3NGUtNzk5YTY3OWE1MjE22AIF4AIB&ucfs=1&arphpl=1&checkin=2024-02-25&checkout=2024-03-01&group_adults=2&req_adults=2&no_rooms=1&group_children=0&req_children=0&hpos=9&hapos=9&sr_order=popularity&srpvid=b17d79be562c0490&srepoch=1706980735&all_sr_blocks=29510902_385527473_0_0_0&highlighted_blocks=29510902_385527473_0_0_0&matching_block_id=29510902_385527473_0_0_0&sr_pri_blocks=29510902_385527473_0_0_0__38350&from=searchresults#hotelTmpl,"El Balcón al Mar está situado junto al puerto de Valencia. Ofrece habitaciones con aire acondicionado y conexión Wi-Fi gratuita. La mayoría de las habitaciones ofrecen vistas al puerto deportivo real de Valencia.

El personal del establecimiento puede proporcionar información turística sobre Valencia. A 5 minutos a pie del Balcón al Mar hay una gran variedad de restaurantes y bares.

El Balcón al Mar se encuentra a 15 minutos a pie de la playa de las Arenas y a 20 minutos a pie de la Ciudad de las Artes y las Ciencias. A 5 minutos a pie del establecimiento hay varias paradas de autobús y tranvía que ofrecen conexiones con el centro de Valencia."
Malvarrosa Beach Rooms,"a 4,6 km del centro","Poblados marítimos, Valencia",€ 286,"5,4",4 de 5,1.665 comentarios,https://www.booking.com/hotel/es/chicote.es.html?aid=304142&label=gen173nr-1FCAEoggI46AdIClgEaEaIAQGYAQq4AQfIAQ_YAQHoAQH4AQKIAgGoAgO4Aurq-a0GwAIB0gIkYjQ4ODAyOGEtYThmNy00YzdmLWI3NGUtNzk5YTY3OWE1MjE22AIF4AIB&ucfs=1&arphpl=1&checkin=2024-02-25&checkout=2024-03-01&group_adults=2&req_adults=2&no_rooms=1&group_children=0&req_children=0&hpos=10&hapos=10&sr_order=popularity&srpvid=b17d79be562c0490&srepoch=1706980735&all_sr_blocks=31404805_350847176_2_0_0&highlighted_blocks=31404805_350847176_2_0_0&matching_block_id=31404805_350847176_2_0_0&sr_pri_blocks=31404805_350847176_2_0_0__28620&from=searchresults#hotelTmpl,"El Malvarrosa Beach Rooms se encuentra a solo 50 metros de la playa de Les Arenes de Valencia. Ofrece recepción las 24 horas y habitaciones con vistas al mar, WiFi gratuita y TV de pantalla plana.

Las habitaciones del Malvarrosa Beach Rooms presentan suelo de baldosa y una decoración sencilla. Todas tienen ventilador y baño privado, así como vistas frontales o laterales al mar.

El desayuno gratuito incluye café, zumo de naranja y tostadas o bollería.

El Malvarrosa Beach Rooms alberga un restaurante de comida mediterránea. En el puerto de la Copa América, ubicado a 5 minutos a pie, hay varios restaurantes.

La estación de metro Les Arenes está a solo 3 minutos a pie y conecta con el resto de la ciudad. La Ciudad de las Artes y las Ciencias se halla a 5 minutos en coche."
Jardín Botánico Rooms,"a 1,1 km del centro","Extramurs, Valencia",€ 245,"6,4",4 de 5,637 comentarios,https://www.booking.com/hotel/es/jardin-botanico-rooms.es.html?aid=304142&label=gen173nr-1FCAEoggI46AdIClgEaEaIAQGYAQq4AQfIAQ_YAQHoAQH4AQKIAgGoAgO4Aurq-a0GwAIB0gIkYjQ4ODAyOGEtYThmNy00YzdmLWI3NGUtNzk5YTY3OWE1MjE22AIF4AIB&ucfs=1&arphpl=1&checkin=2024-02-25&checkout=2024-03-01&group_adults=2&req_adults=2&no_rooms=1&group_children=0&req_children=0&hpos=11&hapos=11&sr_order=popularity&srpvid=b17d79be562c0490&srepoch=1706980735&all_sr_blocks=623933603_329682040_2_0_0&highlighted_blocks=623933603_329682040_2_0_0&matching_block_id=623933603_329682040_2_0_0&sr_pri_blocks=623933603_329682040_2_0_0__24500&from=searchresults#hotelTmpl,"Jardín Botánico Rooms está muy bien situado en el barrio de Extramurs, Valencia, a 17 min a pie de Estación de tren del Norte, a 1,4 km de Basílica de la Virgen de los Desamparados y a 3 km de Jardines de Monforte. Este alojamiento ofrece cocina compartida y salón de uso común, además de wifi gratis en todo el alojamiento. Este alojamiento libre de humo se encuentra a 12 min a pie de Church of Saint Nicolás.

En el hostal o pensión, cada habitación tiene escritorio. En Jardín Botánico Rooms, las habitaciones cuentan con TV de pantalla plana y algunas también ofrecen vistas a la ciudad. En el alojamiento, todas las habitaciones disponen de ropa de cama y toallas.

Jardín del Turia está a 3,1 km del alojamiento, y Museo Nacional de Cerámica y Artes Santuarias González Martí está a 16 min a pie. El aeropuerto más cercano (Aeropuerto de Valencia) está a 7 km."
Hospederia del Pilar,"a 0,6 km del centro","Ciutat Vella, Valencia",€ 279,"7,4",2 de 5,3.390 comentarios,https://www.booking.com/hotel/es/hospederia-del-pilar.es.html?aid=304142&label=gen173nr-1FCAEoggI46AdIClgEaEaIAQGYAQq4AQfIAQ_YAQHoAQH4AQKIAgGoAgO4Aurq-a0GwAIB0gIkYjQ4ODAyOGEtYThmNy00YzdmLWI3NGUtNzk5YTY3OWE1MjE22AIF4AIB&ucfs=1&arphpl=1&checkin=2024-02-25&checkout=2024-03-01&group_adults=2&req_adults=2&no_rooms=1&group_children=0&req_children=0&hpos=12&hapos=12&sr_order=popularity&srpvid=b17d79be562c0490&srepoch=1706980735&all_sr_blocks=32776603_88207381_2_0_0&highlighted_blocks=32776603_88207381_2_0_0&matching_block_id=32776603_88207381_2_0_0&sr_pri_blocks=32776603_88207381_2_0_0__27900&from=searchresults#hotelTmpl,"La céntrica Hospedería del Pilar fue fundada en 1886 y ofrece recepción abierta las 24 horas y zona de conexión Wi-Fi gratuita. Se encuentra a 10 minutos a pie de la estación de tren de Valencia y a 50 metros del Mercado Central y la Lonja de la Seda.

Las habitaciones presentan suelo de baldosa y mobiliario de madera clara. Cuentan con aire acondicionado, TV, escritorio, calefacción y baño privado con ducha.

La céntrica pensión Pilar está situada a 5 minutos a pie de múltiples tiendas, bares y restaurantes.

El establecimiento ofrece mostrador de información turística. Se halla a solo 500 metros de la catedral de Valencia y a 10 minutos a pie de la plaza central, de donde sale un autobús hacia la playa."
Apartamentos Abastos,"a 1,1 km del centro","Extramurs, Valencia",€ 325,"7,1",1 de 5,227 comentarios,https://www.booking.com/hotel/es/apartamentos-abastos.es.html?aid=304142&label=gen173nr-1FCAEoggI46AdIClgEaEaIAQGYAQq4AQfIAQ_YAQHoAQH4AQKIAgGoAgO4Aurq-a0GwAIB0gIkYjQ4ODAyOGEtYThmNy00YzdmLWI3NGUtNzk5YTY3OWE1MjE22AIF4AIB&ucfs=1&arphpl=1&checkin=2024-02-25&checkout=2024-03-01&group_adults=2&req_adults=2&no_rooms=1&group_children=0&req_children=0&hpos=13&hapos=13&sr_order=popularity&srpvid=b17d79be562c0490&srepoch=1706980735&all_sr_blocks=104442601_374696399_2_0_0&highlighted_blocks=104442601_374696399_2_0_0&matching_block_id=104442601_374696399_2_0_0&sr_pri_blocks=104442601_374696399_2_0_0__32500&from=searchresults#hotelTmpl,"El Apartamentos Abastos es un alojamiento independiente situado en Valencia, a 5 minutos a pie de la estación de metro Ángel Guimerá y a 1,4 km de la catedral.

El apartamento goza de vistas a la ciudad e incluye zona de estar con TV de pantalla plana, mesa de comedor, así como zona de cocina con microondas, fogones y nevera. También hay baño privado con secador de pelo.

Se proporcionan ropa de cama, utensilios de cocina y toallas. El apartamento dispone de ascensor y lavadora.

Hay una amplia gama de tiendas, restaurantes y bares en las inmediaciones. La Ciudad de las Artes y las Ciencias y la playa de la Malvarrosa están a 15 minutos en coche. El aeropuerto de Valencia se halla a 9,6 km."
Welcomer Apartments Valencia,"a 0,9 km del centro","Ciutat Vella, Valencia",€ 514,"8,1",2 de 5,1.625 comentarios,https://www.booking.com/hotel/es/blue-moon-apartments.es.html?aid=304142&label=gen173nr-1FCAEoggI46AdIClgEaEaIAQGYAQq4AQfIAQ_YAQHoAQH4AQKIAgGoAgO4Aurq-a0GwAIB0gIkYjQ4ODAyOGEtYThmNy00YzdmLWI3NGUtNzk5YTY3OWE1MjE22AIF4AIB&ucfs=1&arphpl=1&checkin=2024-02-25&checkout=2024-03-01&group_adults=2&req_adults=2&no_rooms=1&group_children=0&req_children=0&hpos=14&hapos=14&sr_order=popularity&srpvid=b17d79be562c0490&srepoch=1706980735&all_sr_blocks=1936312_353876844_2_0_0&highlighted_blocks=1936312_353876844_2_0_0&matching_block_id=1936312_353876844_2_0_0&sr_pri_blocks=1936312_353876844_2_0_0__51400&from=searchresults#hotelTmpl,"El Welcomer Apartments Valencia ofrece apartamentos elegantes en el barrio del Carmen de Valencia, a 350 metros de la catedral de la ciudad. El establecimiento ocupa una casa unifamiliar tradicional con WiFi gratuita y aire acondicionado.

Todos los apartamentos, estudios y lofts del Welcomer Apartments Valencia cuentan con TV de pantalla plana y zona de cocina bien equipada con microondas, nevera y lavadora. Los apartamentos también incluyen toallas y ropa de cama. Hay secadores de pelo y utensilios de planchado disponibles bajo petición y de forma gratuita.

El Welcomer Apartments Valencia se encuentra en el centro histórico de la ciudad de Valencia, que alberga una amplia variedad de tiendas, bares y restaurantes.

El establecimiento queda a 10 minutos a pie del Museo de Arte Moderno y a 15 minutos en autobús (línea 95) de la famosa Ciudad de las Artes y las Ciencias."
Bet Apartments - Reig,"a 1,9 km del centro","El Pla del Real, Valencia",€ 680,"8,5",3 de 5,278 comentarios,https://www.booking.com/hotel/es/city-suites-universidades.es.html?aid=304142&label=gen173nr-1FCAEoggI46AdIClgEaEaIAQGYAQq4AQfIAQ_YAQHoAQH4AQKIAgGoAgO4Aurq-a0GwAIB0gIkYjQ4ODAyOGEtYThmNy00YzdmLWI3NGUtNzk5YTY3OWE1MjE22AIF4AIB&ucfs=1&arphpl=1&checkin=2024-02-25&checkout=2024-03-01&group_adults=2&req_adults=2&no_rooms=1&group_children=0&req_children=0&hpos=15&hapos=15&sr_order=popularity&srpvid=b17d79be562c0490&srepoch=1706980735&all_sr_blocks=607682105_238084091_2_0_0&highlighted_blocks=607682105_238084091_2_0_0&matching_block_id=607682105_238084091_2_0_0&sr_pri_blocks=607682105_238084091_2_0_0__67972&from_sustainable_property_sr=1&from=searchresults#hotelTmpl,"Bet Apartments - Reig cuenta con vistas a la ciudad y wifi gratis. Ofrece alojamiento muy bien situado en Valencia, a poca distancia de Jardines de Monforte, Jardín del Turia y Basílica de la Virgen de los Desamparados.

El alojamiento tiene aire acondicionado, cocina totalmente equipada, TV y baño privado con ducha y secador de pelo. También se ofrece nevera, microondas y tostadora, además de cafetera y hervidor.

Museo Nacional de Cerámica y Artes Santuarias González Martí está a 2,9 km del alojamiento, y Estación de tren del Norte está a 3,4 km. El aeropuerto más cercano (Aeropuerto de Valencia) está a 11 km del alojamiento."
