Hotels,Ratings,Distance,District,Price,Link,Star,Descriptions
The Art Boutique Colon,"7,2",a 450 m del centro,,€ 1.226,https://www.booking.com/hotel/es/the-art-boutique-apartments.es.html?label=gen173nr-1FCAEoggI46AdIClgEaEaIAQGYAQq4ARfIAQ_YAQHoAQH4AQKIAgGoAgO4AvWhzq0GwAIB0gIkYTQ3OGY1ZmUtNzVlOS00NmIxLTg5MjQtOWUzNDhhNDhhZWFi2AIF4AIB&aid=304142&ucfs=1&arphpl=1&checkin=2024-02-25&checkout=2024-03-01&dest_id=-406131&dest_type=city&group_adults=2&req_adults=2&no_rooms=1&group_children=0&req_children=0&hpos=1&hapos=226&sr_order=popularity&srpvid=20ce4d8e43b40332&srepoch=1706267002&all_sr_blocks=257088107_104392692_4_0_0&highlighted_blocks=257088107_104392692_4_0_0&matching_block_id=257088107_104392692_4_0_0&sr_pri_blocks=257088107_104392692_4_0_0__122640&from=searchresults#hotelTmpl,3 de 5,"The Art Boutique Colon está en Valencia, cerca de Estación de tren del Norte, Jardín del Turia, y Museo Nacional de Cerámica y Artes Santuarias González Martí. Dispone de wifi gratis, salón de uso común y terraza.

Cada unidad dispone de balcón con vistas a la ciudad, TV de pantalla plana vía satélite, zona de estar, cocina bien equipada y baño privado con bidet, artículos de aseo gratuitos y secador de pelo. Para mayor comodidad, el alojamiento puede ofrecer toallas y ropa de cama por un suplemento.

El apartamento ofrece servicio de alquiler de bicicletas.

Cerca del alojamiento hay puntos de interés como Basílica de la Virgen de los Desamparados, Jardines de Monforte y Church of Saint Nicolás. El aeropuerto más cercano (Aeropuerto de Valencia) está a 8 km del alojamiento, que ofrece servicio de traslado de pago para ir o volver del aeropuerto."
Mosen Sorell Apartments,"8,0","a 0,9 km del centro",,€ 839,https://www.booking.com/hotel/es/apartamentos-mosen-sorell.es.html?label=gen173nr-1FCAEoggI46AdIClgEaEaIAQGYAQq4ARfIAQ_YAQHoAQH4AQKIAgGoAgO4AvWhzq0GwAIB0gIkYTQ3OGY1ZmUtNzVlOS00NmIxLTg5MjQtOWUzNDhhNDhhZWFi2AIF4AIB&aid=304142&ucfs=1&arphpl=1&checkin=2024-02-25&checkout=2024-03-01&dest_id=-406131&dest_type=city&group_adults=2&req_adults=2&no_rooms=1&group_children=0&req_children=0&hpos=2&hapos=227&sr_order=popularity&srpvid=20ce4d8e43b40332&srepoch=1706267002&all_sr_blocks=68326502_88503855_3_0_0&highlighted_blocks=68326502_88503855_3_0_0&matching_block_id=68326502_88503855_3_0_0&sr_pri_blocks=68326502_88503855_3_0_0__83918&from=searchresults#hotelTmpl,4 de 5,"Los Apartamentos Mosén Sorell están situados en el centro histórico de Valencia, a solo 500 metros de la plaza de la Virgen. Presentan una decoración moderna e incluyen aire acondicionado, conexión Wi-Fi gratuita y TV de pantalla plana.

Los elegantes apartamentos Mosén Sorell disponen de cocina con lavavajillas, horno, microondas y cafetera. Algunos tienen balcón o terraza privados con vistas a la plaza Mosén Sorell.

La catedral de Valencia y la animada plaza de la Reina están a unos 650 metros, mientras que la Ciudad de las Artes y las Ciencias queda a 3 km. La antigua Lonja de la Seda, declarada Patrimonio de la Humanidad por la UNESCO, se halla a 450 metros. Se ofrecen enlaces regulares de autobús con el resto de la ciudad."
Casual Civilizaciones Valencia,"7,7","a 2,5 km del centro",,€ 335,https://www.booking.com/hotel/es/casual-hostel-valencia.es.html?label=gen173nr-1FCAEoggI46AdIClgEaEaIAQGYAQq4ARfIAQ_YAQHoAQH4AQKIAgGoAgO4AvWhzq0GwAIB0gIkYTQ3OGY1ZmUtNzVlOS00NmIxLTg5MjQtOWUzNDhhNDhhZWFi2AIF4AIB&aid=304142&ucfs=1&arphpl=1&checkin=2024-02-25&checkout=2024-03-01&dest_id=-406131&dest_type=city&group_adults=2&req_adults=2&no_rooms=1&group_children=0&req_children=0&hpos=3&hapos=228&sr_order=popularity&srpvid=20ce4d8e43b40332&srepoch=1706267002&all_sr_blocks=44977701_88500591_0_0_0&highlighted_blocks=44977701_88500591_0_0_0&matching_block_id=44977701_88500591_0_0_0&sr_pri_blocks=44977701_88500591_0_0_0__33548&from=searchresults#hotelTmpl,4 de 5,"El Casual Valencia de las Civilizaciones ofrece habitaciones con una decoración exclusiva, aire acondicionado y WiFi gratuita. Se halla a 25 minutos en autobús de la catedral y del centro de Valencia. Hay consigna de equipaje de uso gratuito.

Las habitaciones presentan una decoración inspirada en las civilizaciones del mundo. Además, disponen de calefacción central y TV de pantalla plana con canales vía satélite. Algunas tienen baño compartido. El baño privado incluye artículos de aseo gratuitos. Las camas tienen edredones hipoalergénicos.

Hay varias tiendas y restaurantes en los alrededores. Cuenta con máquinas expendedoras de aperitivos y bebidas.

El Casual Valencia de las Civilizaciones se encuentra a 16 minutos en coche del aeropuerto de Valencia (se tarda 1 hora en transporte público). El barrio de El Carmen queda a menos de 30 minutos a pie. La playa de la Malvarrosa está a 40 minutos en tranvía."
Reinapart Patacona Beach 46,"9,5","a 4,9 km del centro",,€ 825,https://www.booking.com/hotel/es/reinapart-patacona-beach.es.html?label=gen173nr-1FCAEoggI46AdIClgEaEaIAQGYAQq4ARfIAQ_YAQHoAQH4AQKIAgGoAgO4AvWhzq0GwAIB0gIkYTQ3OGY1ZmUtNzVlOS00NmIxLTg5MjQtOWUzNDhhNDhhZWFi2AIF4AIB&aid=304142&ucfs=1&arphpl=1&checkin=2024-02-25&checkout=2024-03-01&dest_id=-406131&dest_type=city&group_adults=2&req_adults=2&no_rooms=1&group_children=0&req_children=0&hpos=4&hapos=229&sr_order=popularity&srpvid=20ce4d8e43b40332&srepoch=1706267002&all_sr_blocks=861433702_371049951_3_0_0&highlighted_blocks=861433702_371049951_3_0_0&matching_block_id=861433702_371049951_3_0_0&sr_pri_blocks=861433702_371049951_3_0_0__82530&from=searchresults#hotelTmpl,4 de 5,"Reinapart Patacona Beach 46 ofrece piscina cubierta y sala de fitness, además de alojamiento con aire acondicionado y wifi gratis, en Valencia, a pocos pasos de Playa de Patacona. Hay parking privado en el propio alojamiento.

El alojamiento está equipado con TV de pantalla plana y baño privado con bidet, duchay secador de pelo. La cocina dispone de nevera, horno y microondas. También hay fogones, tostadora y cafetera.

El apartamento ofrece terraza.

Playa de la Malvarrosa está a 9 min a pie del alojamiento, y Playa de Port Saplaya está a 1,9 km. El aeropuerto más cercano (Aeropuerto de Valencia) está a 17 km del alojamiento."
Apartamento Cardenal,"8,6","a 1,8 km del centro",,€ 495,https://www.booking.com/hotel/es/apartamento-cardenal.es.html?label=gen173nr-1FCAEoggI46AdIClgEaEaIAQGYAQq4ARfIAQ_YAQHoAQH4AQKIAgGoAgO4AvWhzq0GwAIB0gIkYTQ3OGY1ZmUtNzVlOS00NmIxLTg5MjQtOWUzNDhhNDhhZWFi2AIF4AIB&aid=304142&ucfs=1&arphpl=1&checkin=2024-02-25&checkout=2024-03-01&dest_id=-406131&dest_type=city&group_adults=2&req_adults=2&no_rooms=1&group_children=0&req_children=0&hpos=5&hapos=230&sr_order=popularity&srpvid=20ce4d8e43b40332&srepoch=1706267002&all_sr_blocks=206320201_288752877_2_0_0&highlighted_blocks=206320201_288752877_2_0_0&matching_block_id=206320201_288752877_2_0_0&sr_pri_blocks=206320201_288752877_2_0_0__49500&from=searchresults#hotelTmpl,2 de 5,"Apartamento Cardenal se encuentra en Valencia, a 14 min a pie de Jardín del Turia y a 1,7 km de Jardines de Monforte, y ofrece wifi gratis y aire acondicionado. Este apartamento está a 2,5 km de Estación de tren del Norte y a 2,9 km de Puerto de Valencia.

El apartamento cuenta con 3 dormitorios, una cocina con nevera y horno, y 1 baño con ducha, secador de pelo y lavadora. Hay toallas y ropa de cama en el apartamento.

Museo Nacional de Cerámica y Artes Santuarias González Martí está a 2,9 km del alojamiento, y Basílica de la Virgen de los Desamparados está a 3 km. El aeropuerto más cercano (Aeropuerto de Valencia) está a 11 km del alojamiento."
Hotel Miramar Valencia,"8,2","a 4,6 km del centro",,€ 710,https://www.booking.com/hotel/es/miramar-valencia.es.html?label=gen173nr-1FCAEoggI46AdIClgEaEaIAQGYAQq4ARfIAQ_YAQHoAQH4AQKIAgGoAgO4AvWhzq0GwAIB0gIkYTQ3OGY1ZmUtNzVlOS00NmIxLTg5MjQtOWUzNDhhNDhhZWFi2AIF4AIB&aid=304142&ucfs=1&arphpl=1&checkin=2024-02-25&checkout=2024-03-01&dest_id=-406131&dest_type=city&group_adults=2&req_adults=2&no_rooms=1&group_children=0&req_children=0&hpos=6&hapos=231&sr_order=popularity&srpvid=20ce4d8e43b40332&srepoch=1706267002&all_sr_blocks=2333204_95147369_0_2_0&highlighted_blocks=2333204_95147369_0_2_0&matching_block_id=2333204_95147369_0_2_0&sr_pri_blocks=2333204_95147369_0_2_0__70956&from_sustainable_property_sr=1&from=searchresults#hotelTmpl,4 de 5,"Este pequeño hotel de estilo contemporáneo tiene vistas al Mediterráneo desde la playa de las Arenas, cerca de la Marina Real Juan Carlos I, en la ciudad de Valencia. Hay WiFi gratuita.

El restaurante del hotel está situado en la playa y ofrece cocina mediterránea y cócteles. El bar abre durante todo el día.

Las modernas habitaciones están equipadas con aire acondicionado, TV de pantalla plana y baño privado con secador de pelo.

El centro de Valencia se encuentra a unos 20 minutos en coche o 30 minutos en transporte público."
Luminoso Apartamento * La Marina de Valencia,"8,9","a 3,9 km del centro",,€ 524,https://www.booking.com/hotel/es/lumnoso-piso-junto-a-la-marina-de-valencia.es.html?label=gen173nr-1FCAEoggI46AdIClgEaEaIAQGYAQq4ARfIAQ_YAQHoAQH4AQKIAgGoAgO4AvWhzq0GwAIB0gIkYTQ3OGY1ZmUtNzVlOS00NmIxLTg5MjQtOWUzNDhhNDhhZWFi2AIF4AIB&aid=304142&ucfs=1&arphpl=1&checkin=2024-02-25&checkout=2024-03-01&dest_id=-406131&dest_type=city&group_adults=2&req_adults=2&no_rooms=1&group_children=0&req_children=0&hpos=7&hapos=232&sr_order=popularity&srpvid=20ce4d8e43b40332&srepoch=1706267002&all_sr_blocks=378768501_335618306_2_0_0&highlighted_blocks=378768501_335618306_2_0_0&matching_block_id=378768501_335618306_2_0_0&sr_pri_blocks=378768501_335618306_2_0_0__52400&from=searchresults#hotelTmpl,4 de 5,"Luminoso Apartamento * La Marina de Valencia es un alojamiento con wifi gratis y vistas a la ciudad que está en Valencia, a solo menos de 1 km de Playa de las Arenas y a 1,9 km de Playa de la Malvarrosa. El apartamento, que tiene balcón, está en una zona en la que se pueden practicar actividades como pesca y ciclismo.

Este apartamento con aire acondicionado consta de 3 dormitorios, una sala de estar, una cocina totalmente equipada con nevera y cafetera, y 1 baño con bidet y ducha. Hay toallas y ropa de cama en el apartamento.

Playa de Patacona está a 2,8 km del alojamiento, y Puerto de Valencia está a 7 min a pie. El aeropuerto (Aeropuerto de Valencia) está a 13 km."
Total Valencia Old City Luxury,"8,1","a 1,3 km del centro",,€ 408,https://www.booking.com/hotel/es/old-city-luxury.es.html?label=gen173nr-1FCAEoggI46AdIClgEaEaIAQGYAQq4ARfIAQ_YAQHoAQH4AQKIAgGoAgO4AvWhzq0GwAIB0gIkYTQ3OGY1ZmUtNzVlOS00NmIxLTg5MjQtOWUzNDhhNDhhZWFi2AIF4AIB&aid=304142&ucfs=1&arphpl=1&checkin=2024-02-25&checkout=2024-03-01&dest_id=-406131&dest_type=city&group_adults=2&req_adults=2&no_rooms=1&group_children=0&req_children=0&hpos=8&hapos=233&sr_order=popularity&srpvid=20ce4d8e43b40332&srepoch=1706267002&all_sr_blocks=164462301_91960917_2_0_0&highlighted_blocks=164462301_91960917_2_0_0&matching_block_id=164462301_91960917_2_0_0&sr_pri_blocks=164462301_91960917_2_0_0__40809&from=searchresults#hotelTmpl,4 de 5,"Total Valencia Old City Luxury está en una zona céntrica de Valencia y ofrece vistas al jardín desde el balcón. Este apartamento ofrece wifi gratis y se encuentra a 7 min a pie de Church of Saint Nicolás y a menos de 1 km de Basílica de la Virgen de los Desamparados.

Este apartamento consta de 1 dormitorio independiente, 1 baño con secador de pelo y una sala de estar. Hay toallas y ropa de cama en el apartamento.

Cerca del alojamiento hay puntos de interés como Jardines de Monforte, Jardín del Turia y Museo Nacional de Cerámica y Artes Santuarias González Martí. El aeropuerto (Aeropuerto de Valencia) está a 8 km, y el alojamiento ofrece servicio de traslado de pago para ir o volver del aeropuerto."
Belchite,"8,5","a 1,9 km del centro",,€ 800,https://www.booking.com/hotel/es/belchite.es.html?label=gen173nr-1FCAEoggI46AdIClgEaEaIAQGYAQq4ARfIAQ_YAQHoAQH4AQKIAgGoAgO4AvWhzq0GwAIB0gIkYTQ3OGY1ZmUtNzVlOS00NmIxLTg5MjQtOWUzNDhhNDhhZWFi2AIF4AIB&aid=304142&ucfs=1&arphpl=1&checkin=2024-02-25&checkout=2024-03-01&dest_id=-406131&dest_type=city&group_adults=2&req_adults=2&no_rooms=1&group_children=0&req_children=0&hpos=9&hapos=234&sr_order=popularity&srpvid=20ce4d8e43b40332&srepoch=1706267002&all_sr_blocks=323289801_114570866_6_0_0&highlighted_blocks=323289801_114570866_6_0_0&matching_block_id=323289801_114570866_6_0_0&sr_pri_blocks=323289801_114570866_6_0_0__80050&from=searchresults#hotelTmpl,4 de 5,"Belchite se encuentra en Valencia, a 19 min a pie de Church of Saint Nicolás, y ofrece alojamiento con terraza, wifi gratis y recepción 24 horas. Este apartamento ofrece alojamiento con balcón.

Este apartamento con aire acondicionado consta de 3 dormitorios, una sala de estar, una cocina totalmente equipada con nevera y cafetera, y 1 baño con bidet y ducha. Hay toallas y ropa de cama en el apartamento.

El apartamento ofrece servicio de alquiler de bicicletas.

Basílica de la Virgen de los Desamparados está a 19 min a pie del alojamiento, y Jardines de Monforte está a 2,3 km. El aeropuerto (Aeropuerto de Valencia) está a 12 km."
BUBUFLATS Ayuntamiento,"8,8",a 250 m del centro,,€ 697,https://www.booking.com/hotel/es/bubu-3.es.html?label=gen173nr-1FCAEoggI46AdIClgEaEaIAQGYAQq4ARfIAQ_YAQHoAQH4AQKIAgGoAgO4AvWhzq0GwAIB0gIkYTQ3OGY1ZmUtNzVlOS00NmIxLTg5MjQtOWUzNDhhNDhhZWFi2AIF4AIB&aid=304142&ucfs=1&arphpl=1&checkin=2024-02-25&checkout=2024-03-01&dest_id=-406131&dest_type=city&group_adults=2&req_adults=2&no_rooms=1&group_children=0&req_children=0&hpos=10&hapos=235&sr_order=popularity&srpvid=20ce4d8e43b40332&srepoch=1706267002&all_sr_blocks=101433402_88506838_2_0_0&highlighted_blocks=101433402_88506838_2_0_0&matching_block_id=101433402_88506838_2_0_0&sr_pri_blocks=101433402_88506838_2_0_0__69750&from=searchresults#hotelTmpl,4 de 5,"El BUBUFLATS Ayuntamiento está situado en el centro de Valencia y ofrece alojamiento independiente con aire acondicionado, conexión Wi-Fi gratuita y balcón con vistas a la ciudad. La estación de metro Colón está a 700 metros.

El establecimiento cuenta con 2 apartamentos y 1 suite. Algunos alojamientos disponen de TV de pantalla plana con reproductor de DVD, baño privado con albornoces y cocina con lavavajillas. La suite tiene vistas a la ciudad y está equipada con aire acondicionado, TV, nevera, microondas, cafetera Nespresso y hervidor de agua.

Se sirven desayunos por un suplemento.

El BUBUFLATS Ayuntamiento proporciona servicio de alquiler de bicicletas y servicio de enlace con el aeropuerto por un suplemento.

La Ciudad de las Artes y las Ciencias está a 4 km del apartamento y la playa de la Malvarrosa, a 6 km. El aeropuerto de Valencia está a 15 minutos en coche."
Valenciaflats Ciudad de las Ciencias,"9,0","a 2,2 km del centro",,€ 952,https://www.booking.com/hotel/es/40-flats.es.html?label=gen173nr-1FCAEoggI46AdIClgEaEaIAQGYAQq4ARfIAQ_YAQHoAQH4AQKIAgGoAgO4AvWhzq0GwAIB0gIkYTQ3OGY1ZmUtNzVlOS00NmIxLTg5MjQtOWUzNDhhNDhhZWFi2AIF4AIB&aid=304142&ucfs=1&arphpl=1&checkin=2024-02-25&checkout=2024-03-01&dest_id=-406131&dest_type=city&group_adults=2&req_adults=2&no_rooms=1&group_children=0&req_children=0&hpos=11&hapos=236&sr_order=popularity&srpvid=20ce4d8e43b40332&srepoch=1706267002&all_sr_blocks=9367609_368949603_0_2_0&highlighted_blocks=9367609_368949603_0_2_0&matching_block_id=9367609_368949603_0_2_0&sr_pri_blocks=9367609_368949603_0_2_0__95200&from_sustainable_property_sr=1&from=searchresults#hotelTmpl,3 de 5,"Estos apartamentos vacacionales se encuentran a 100 metros de la Ciudad de las Artes y las Ciencias. El Aparthotel Valenciaflats Ciudad de las Ciencias ofrece 40 apartamentos vacacionales de 3 tipos diferentes con capacidad para entre 2 y 6 personas.

Los apartamentos vacacionales son amplios, presentan una decoración moderna y están totalmente equipados con TV HD LED de 32 pulgadas con canales internacionales y WiFi gratuita. Se proporciona servicio de limpieza por un suplemento.

El Aparthotel Valenciaflats Ciudad de las Ciencias dispone de recepción abierta las 24 horas con atención personalizada. El establecimiento alberga un bar restaurante que sirve desayuno, almuerzos y cenas buffet de 08:00 a 23:30, en horario continuo.

Los apartamentos están situados a poca distancia a pie de varios restaurantes y bares. Asimismo, el establecimiento se halla a unos 20 minutos a pie del centro de Valencia y a menos de 3 km de algunos lugares turísticos, como la catedral de Valencia y la plaza de toros. El alojamiento está ubicado a 10 minutos en autobús de la playa más cercana."
MD Vila Barbera Apartment Center,"7,8","a 0,9 km del centro",,€ 1.424,https://www.booking.com/hotel/es/apartment-vila-barbera-center.es.html?label=gen173nr-1FCAEoggI46AdIClgEaEaIAQGYAQq4ARfIAQ_YAQHoAQH4AQKIAgGoAgO4AvWhzq0GwAIB0gIkYTQ3OGY1ZmUtNzVlOS00NmIxLTg5MjQtOWUzNDhhNDhhZWFi2AIF4AIB&aid=304142&ucfs=1&arphpl=1&checkin=2024-02-25&checkout=2024-03-01&dest_id=-406131&dest_type=city&group_adults=2&req_adults=2&no_rooms=1&group_children=0&req_children=0&hpos=12&hapos=237&sr_order=popularity&srpvid=20ce4d8e43b40332&srepoch=1706267002&all_sr_blocks=195725301_120643757_0_0_0&highlighted_blocks=195725301_120643757_0_0_0&matching_block_id=195725301_120643757_0_0_0&sr_pri_blocks=195725301_120643757_0_0_0__142400&from_sustainable_property_sr=1&from=searchresults#hotelTmpl,4 de 5,"MD Vila Barbera Apartment Center está en Valencia, a 8 min a pie de Estación de tren del Norte, y dispone de alojamiento con terraza, wifi gratis, recepción 24 horas y mostrador de información turística. Este alojamiento con vistas a la ciudad ofrece balcón.

Este apartamento con aire acondicionado consta de 5 dormitorios, una sala de estar, una cocina totalmente equipada con nevera y cafetera, y 2 baños con bidet y ducha. Hay toallas y ropa de cama en el apartamento.

Cerca del alojamiento hay puntos de interés como Church of Saint Nicolás, Museo Nacional de Cerámica y Artes Santuarias González Martí y Basílica de la Virgen de los Desamparados. El aeropuerto más cercano (Aeropuerto de Valencia) está a 8 km."
Malvarrosa Apartamento,"8,7","a 4,4 km del centro",,€ 448,https://www.booking.com/hotel/es/malvarrosa-apartamento.es.html?label=gen173nr-1FCAEoggI46AdIClgEaEaIAQGYAQq4ARfIAQ_YAQHoAQH4AQKIAgGoAgO4AvWhzq0GwAIB0gIkYTQ3OGY1ZmUtNzVlOS00NmIxLTg5MjQtOWUzNDhhNDhhZWFi2AIF4AIB&aid=304142&ucfs=1&arphpl=1&checkin=2024-02-25&checkout=2024-03-01&dest_id=-406131&dest_type=city&group_adults=2&req_adults=2&no_rooms=1&group_children=0&req_children=0&hpos=13&hapos=238&sr_order=popularity&srpvid=20ce4d8e43b40332&srepoch=1706267002&all_sr_blocks=748333401_331022942_4_0_0&highlighted_blocks=748333401_331022942_4_0_0&matching_block_id=748333401_331022942_4_0_0&sr_pri_blocks=748333401_331022942_4_0_0__44800&from=searchresults#hotelTmpl,4 de 5,"Malvarrosa Apartamento se encuentra en Valencia, a 6 min a pie de Playa de Patacona y a 700 metros de Playa de la Malvarrosa, y ofrece wifi gratis y aire acondicionado. Este apartamento está a 17 min a pie de Playa de las Arenas y a 3,6 km de Puerto de Valencia.

El apartamento cuenta con 3 dormitorios, 1 baño, ropa de cama, toallas, TV de pantalla plana con canales por cable, zona de comedor, cocina totalmente equipada y balcón con vistas a la ciudad.

Jardines de Monforte está a 5,4 km del alojamiento, y Jardín del Turia está a 5,7 km. El aeropuerto más cercano (Aeropuerto de Valencia) está a 14 km del alojamiento, que ofrece servicio de traslado de pago para ir o volver del aeropuerto."
Artistic Digital Retreat-Great Location Near Metro,"8,6","a 1,8 km del centro",,€ 483,https://www.booking.com/hotel/es/artistic-digital-retreat-great-location-near-metro.es.html?label=gen173nr-1FCAEoggI46AdIClgEaEaIAQGYAQq4ARfIAQ_YAQHoAQH4AQKIAgGoAgO4AvWhzq0GwAIB0gIkYTQ3OGY1ZmUtNzVlOS00NmIxLTg5MjQtOWUzNDhhNDhhZWFi2AIF4AIB&aid=304142&ucfs=1&arphpl=1&checkin=2024-02-25&checkout=2024-03-01&dest_id=-406131&dest_type=city&group_adults=2&req_adults=2&no_rooms=1&group_children=0&req_children=0&hpos=14&hapos=239&sr_order=popularity&srpvid=20ce4d8e43b40332&srepoch=1706267002&all_sr_blocks=928860301_368450287_2_0_0&highlighted_blocks=928860301_368450287_2_0_0&matching_block_id=928860301_368450287_2_0_0&sr_pri_blocks=928860301_368450287_2_0_0__48300&from_sustainable_property_sr=1&from=searchresults#hotelTmpl,4 de 5,"Artistic Digital Retreat-Great Location Near Metro se encuentra en Valencia, a 12 min a pie de Jardín del Turia y a 1,6 km de Jardines de Monforte, y ofrece wifi gratis y aire acondicionado. El apartamento, que se encuentra en un edificio de 2022, está a 2,8 km de Estación de tren del Norte y a 2 km de Museo Nacional de Cerámica y Artes Santuarias González Martí.

Este apartamento cuenta con 1 dormitorio, cocina con nevera y microondas, TV de pantalla plana, zona de estar y 1 baño con ducha. Hay toallas y ropa de cama en el apartamento.

Basílica de la Virgen de los Desamparados está a 3,3 km del alojamiento, y Puerto de Valencia está a 3,3 km. El aeropuerto más cercano (Aeropuerto de Valencia) está a 10 km del alojamiento."
NEW Charming Spanish Beach Flat,"9,5",a 4 km del centro,,€ 600,https://www.booking.com/hotel/es/new-charming-spanish-beach-flat.es.html?label=gen173nr-1FCAEoggI46AdIClgEaEaIAQGYAQq4ARfIAQ_YAQHoAQH4AQKIAgGoAgO4AvWhzq0GwAIB0gIkYTQ3OGY1ZmUtNzVlOS00NmIxLTg5MjQtOWUzNDhhNDhhZWFi2AIF4AIB&aid=304142&ucfs=1&arphpl=1&checkin=2024-02-25&checkout=2024-03-01&dest_id=-406131&dest_type=city&group_adults=2&req_adults=2&no_rooms=1&group_children=0&req_children=0&hpos=15&hapos=240&sr_order=popularity&srpvid=20ce4d8e43b40332&srepoch=1706267002&all_sr_blocks=846032901_383195669_2_0_0&highlighted_blocks=846032901_383195669_2_0_0&matching_block_id=846032901_383195669_2_0_0&sr_pri_blocks=846032901_383195669_2_0_0__60000&from=searchresults#hotelTmpl,3 de 5,"NEW Charming Spanish Beach Flat se encuentra en Valencia, a 6 min a pie de Playa de las Arenas y a 1,1 km de Playa de la Malvarrosa, y ofrece alojamiento con wifi gratis, aire acondicionado y terraza. Este apartamento está a 2 km de Playa de Patacona y a 15 min a pie de Puerto de Valencia.

El apartamento cuenta con 1 dormitorio, una cocina con nevera y lavavajillas, y 1 baño con ducha, artículos de aseo gratuitos y lavadora. Hay toallas y ropa de cama en el apartamento.

Jardín del Turia está a 4,3 km del alojamiento, y Oceanográfico está a 4,5 km. El aeropuerto más cercano (Aeropuerto de Valencia) está a 13 km del alojamiento."
Hostal Happystay,"5,0","a 1,2 km del centro",,€ 321,https://www.booking.com/hotel/es/hostal-happystay-valencia.es.html?label=gen173nr-1FCAEoggI46AdIClgEaEaIAQGYAQq4ARfIAQ_YAQHoAQH4AQKIAgGoAgO4AvWhzq0GwAIB0gIkYTQ3OGY1ZmUtNzVlOS00NmIxLTg5MjQtOWUzNDhhNDhhZWFi2AIF4AIB&aid=304142&ucfs=1&arphpl=1&checkin=2024-02-25&checkout=2024-03-01&dest_id=-406131&dest_type=city&group_adults=2&req_adults=2&no_rooms=1&group_children=0&req_children=0&hpos=16&hapos=241&sr_order=popularity&srpvid=20ce4d8e43b40332&srepoch=1706267002&all_sr_blocks=1087240408_385515432_2_0_0&highlighted_blocks=1087240408_385515432_2_0_0&matching_block_id=1087240408_385515432_2_0_0&sr_pri_blocks=1087240408_385515432_2_0_0__32130&from=searchresults#hotelTmpl,3 de 5,"Hostal Happystay está en Valencia, a 15 min a pie de Estación de tren del Norte y a 1,9 km de Church of Saint Nicolás, y ofrece alojamiento con wifi gratis en todo el alojamiento. El alojamiento está a unos 3,7 km de Jardín del Turia, a 1,9 km de Museo Nacional de Cerámica y Artes Santuarias González Martí y a 3,9 km de Basílica de la Virgen de los Desamparados. El hostal o pensión tiene habitaciones familiares.

En el hostal o pensión, cada habitación está equipada con armario. En Hostal Happystay, las habitaciones están equipadas con aire acondicionado y TV de pantalla plana, y algunas también ofrecen vistas a la ciudad. En el alojamiento, todas las habitaciones disponen de ropa de cama y toallas.

Bioparc Valencia está a 4,3 km del alojamiento, y Jardines de Monforte está a 5 km. El aeropuerto más cercano (Aeropuerto de Valencia) está a 8 km."
NWT Central Station Apartments,"7,1","a 0,6 km del centro",,€ 720,https://www.booking.com/hotel/es/nwt-central-station-apartments.es.html?label=gen173nr-1FCAEoggI46AdIClgEaEaIAQGYAQq4ARfIAQ_YAQHoAQH4AQKIAgGoAgO4AvWhzq0GwAIB0gIkYTQ3OGY1ZmUtNzVlOS00NmIxLTg5MjQtOWUzNDhhNDhhZWFi2AIF4AIB&aid=304142&ucfs=1&arphpl=1&checkin=2024-02-25&checkout=2024-03-01&dest_id=-406131&dest_type=city&group_adults=2&req_adults=2&no_rooms=1&group_children=0&req_children=0&hpos=17&hapos=242&sr_order=popularity&srpvid=20ce4d8e43b40332&srepoch=1706267002&all_sr_blocks=396409301_123061908_0_0_0&highlighted_blocks=396409301_123061908_0_0_0&matching_block_id=396409301_123061908_0_0_0&sr_pri_blocks=396409301_123061908_0_0_0__72000&from=searchresults#hotelTmpl,4 de 5,"NWT Central Station Apartments está en Valencia, cerca de Estación de tren del Norte, Church of Saint Nicolás, y Jardín del Turia, y ofrece wifi gratis.

El apartamento ofrece balcón, zona de estar, TV de pantalla plana, cocina totalmente equipada con nevera y microondas, y baño privado con ducha y secador de pelo. También hay fogones y cafetera.

Cerca del alojamiento hay puntos de interés como Museo Nacional de Cerámica y Artes Santuarias González Martí, Basílica de la Virgen de los Desamparados y Plaza del Ayuntamiento. El aeropuerto (Aeropuerto de Valencia) está a 8 km."
