Hotels,Ratings,Distance,District,Price,Link,Star,Descriptions
ApartUP Opera Loft Love,"9,1","a 1,8 km del centro",,€ 820,https://www.booking.com/hotel/es/apartup-opera-loft-love.es.html?label=gen173nr-1FCAEoggI46AdIClgEaEaIAQGYAQq4ARfIAQ_YAQHoAQH4AQKIAgGoAgO4AvWhzq0GwAIB0gIkYTQ3OGY1ZmUtNzVlOS00NmIxLTg5MjQtOWUzNDhhNDhhZWFi2AIF4AIB&aid=304142&ucfs=1&arphpl=1&checkin=2024-02-25&checkout=2024-03-01&dest_id=-406131&dest_type=city&group_adults=2&req_adults=2&no_rooms=1&group_children=0&req_children=0&hpos=9&hapos=334&sr_order=popularity&srpvid=20ce4d8e43b40332&srepoch=1706267036&all_sr_blocks=901268001_369178365_0_0_0&highlighted_blocks=901268001_369178365_0_0_0&matching_block_id=901268001_369178365_0_0_0&sr_pri_blocks=901268001_369178365_0_0_0__82000&from=searchresults#hotelTmpl,4 de 5,"ApartUP Opera Loft Love se encuentra en Valencia, a 16 min a pie de Jardín del Turia y a 2,2 km de Jardines de Monforte, y ofrece alojamiento con equipamiento como wifi gratis y TV de pantalla plana. Este apartamento está a 2,8 km de Estación de tren del Norte y a 1,9 km de Oceanográfico.

Este apartamento con aire acondicionado se compone de 1 dormitorio independiente, una sala de estar, una cocina totalmente equipada con nevera y lavavajillas, y 2 baños. Hay toallas y ropa de cama en el apartamento.

El apartamento ofrece servicio de alquiler de bicicletas.

Puerto de Valencia está a 3 km del alojamiento, y Museo Nacional de Cerámica y Artes Santuarias González Martí está a 3,2 km. El aeropuerto más cercano (Aeropuerto de Valencia) está a 11 km del alojamiento."
Lore Loft Valencia,"9,5","a 2,8 km del centro",,€ 394,https://www.booking.com/hotel/es/lore-loft-valencia.es.html?label=gen173nr-1FCAEoggI46AdIClgEaEaIAQGYAQq4ARfIAQ_YAQHoAQH4AQKIAgGoAgO4AvWhzq0GwAIB0gIkYTQ3OGY1ZmUtNzVlOS00NmIxLTg5MjQtOWUzNDhhNDhhZWFi2AIF4AIB&aid=304142&ucfs=1&arphpl=1&checkin=2024-02-25&checkout=2024-03-01&dest_id=-406131&dest_type=city&group_adults=2&req_adults=2&no_rooms=1&group_children=0&req_children=0&hpos=10&hapos=335&sr_order=popularity&srpvid=20ce4d8e43b40332&srepoch=1706267036&all_sr_blocks=1141097801_386962669_2_0_0&highlighted_blocks=1141097801_386962669_2_0_0&matching_block_id=1141097801_386962669_2_0_0&sr_pri_blocks=1141097801_386962669_2_0_0__39366&from=searchresults#hotelTmpl,4 de 5,"Lore Loft Valencia está en Valencia, a 2,4 km de Playa de las Arenas y a 3 km de Playa de la Malvarrosa, y ofrece wifi gratis y aire acondicionado. Este apartamento está a 16 min a pie de Puerto de Valencia y a 3,1 km de Jardín del Turia.

Este apartamento se encuentra en la planta baja y dispone de 1 dormitorio, cocina bien equipada con nevera y microondas, una sala de estar y TV de pantalla plana. Hay toallas y ropa de cama en el apartamento.

Jardines de Monforte está a 3,4 km del alojamiento, y Oceanográfico está a 1,9 km. El aeropuerto (Aeropuerto de Valencia) está a 13 km."
Anderson City Flats,"8,9","a 0,5 km del centro",,€ 972,https://www.booking.com/hotel/es/4-flats-mercado-central.es.html?label=gen173nr-1FCAEoggI46AdIClgEaEaIAQGYAQq4ARfIAQ_YAQHoAQH4AQKIAgGoAgO4AvWhzq0GwAIB0gIkYTQ3OGY1ZmUtNzVlOS00NmIxLTg5MjQtOWUzNDhhNDhhZWFi2AIF4AIB&aid=304142&ucfs=1&arphpl=1&checkin=2024-02-25&checkout=2024-03-01&dest_id=-406131&dest_type=city&group_adults=2&req_adults=2&no_rooms=1&group_children=0&req_children=0&hpos=11&hapos=336&sr_order=popularity&srpvid=20ce4d8e43b40332&srepoch=1706267036&all_sr_blocks=30767703_368949878_2_2_0&highlighted_blocks=30767703_368949878_2_2_0&matching_block_id=30767703_368949878_2_2_0&sr_pri_blocks=30767703_368949878_2_2_0__97200&from_sustainable_property_sr=1&from=searchresults#hotelTmpl,4 de 5,"El Anderson City Flats está situado en el casco antiguo de Valencia y ofrece apartamentos elegantes y bien equipados. Este complejo ofrece alojamiento con aire acondicionado y TV de pantalla plana.

Todos los apartamentos del Anderson City Flats tienen zona de estar y zona de cocina con horno, microondas y nevera. Se proporcionan toallas y ropa de cama.

El personal del Anderson City Flats ofrece información sobre la ciudad de Valencia y servicio de alquiler de bicicletas. El servicio de limpieza comporta un suplemento.

A 10 minutos a pie del Anderson City Flats hay una gran selección de bares y restaurantes. También hay supermercados cerca.

La catedral de Valencia está a solo 300 metros de los apartamentos. La famosa Ciudad de las Artes y las Ciencias está a 20 minutos en autobús o metro."
Majestic Flats,"8,3","a 1,3 km del centro",,€ 1.000,https://www.booking.com/hotel/es/valencia-flats.es.html?label=gen173nr-1FCAEoggI46AdIClgEaEaIAQGYAQq4ARfIAQ_YAQHoAQH4AQKIAgGoAgO4AvWhzq0GwAIB0gIkYTQ3OGY1ZmUtNzVlOS00NmIxLTg5MjQtOWUzNDhhNDhhZWFi2AIF4AIB&aid=304142&ucfs=1&arphpl=1&checkin=2024-02-25&checkout=2024-03-01&dest_id=-406131&dest_type=city&group_adults=2&req_adults=2&no_rooms=1&group_children=0&req_children=0&hpos=12&hapos=337&sr_order=popularity&srpvid=20ce4d8e43b40332&srepoch=1706267036&all_sr_blocks=877623901_361569637_4_0_0&highlighted_blocks=877623901_361569637_4_0_0&matching_block_id=877623901_361569637_4_0_0&sr_pri_blocks=877623901_361569637_4_0_0__100000&from_sustainable_property_sr=1&from=searchresults#hotelTmpl,4 de 5,"Majestic Flats está en una zona céntrica de Valencia y ofrece vistas al río desde el balcón. Hay wifi gratis en todo el alojamiento y parking privado en el propio alojamiento.

Este apartamento con aire acondicionado consta de 2 dormitorios, una sala de estar, una cocina totalmente equipada con nevera y cafetera, y 2 baños con bidet y ducha. Hay toallas y ropa de cama en el apartamento.

El apartamento ofrece servicio de alquiler de bicicletas.

Cerca del alojamiento hay puntos de interés como Church of Saint Nicolás, Basílica de la Virgen de los Desamparados y Jardines de Monforte. El aeropuerto más cercano (Aeropuerto de Valencia) está a 8 km del alojamiento, que ofrece servicio de traslado de pago para ir o volver del aeropuerto."
Marittimo Apartments,"9,1",a 4 km del centro,,€ 395,https://www.booking.com/hotel/es/marittimo-apartments.es.html?label=gen173nr-1FCAEoggI46AdIClgEaEaIAQGYAQq4ARfIAQ_YAQHoAQH4AQKIAgGoAgO4AvWhzq0GwAIB0gIkYTQ3OGY1ZmUtNzVlOS00NmIxLTg5MjQtOWUzNDhhNDhhZWFi2AIF4AIB&aid=304142&ucfs=1&arphpl=1&checkin=2024-02-25&checkout=2024-03-01&dest_id=-406131&dest_type=city&group_adults=2&req_adults=2&no_rooms=1&group_children=0&req_children=0&hpos=13&hapos=338&sr_order=popularity&srpvid=20ce4d8e43b40332&srepoch=1706267036&all_sr_blocks=754473502_332146049_2_0_0&highlighted_blocks=754473502_332146049_2_0_0&matching_block_id=754473502_332146049_2_0_0&sr_pri_blocks=754473502_332146049_2_0_0__39500&from_sustainable_property_sr=1&from=searchresults#hotelTmpl,3 de 5,"Marittimo Apartments, en Valencia, está a menos de 1 km de Playa de las Arenas y ofrece alojamiento con aire acondicionado y wifi gratis, además de acceso a la terraza.

El alojamiento está equipado con TV de pantalla plana y baño privado con ducha y secador de pelo. La cocina tiene nevera, horno y microondas.

Playa de la Malvarrosa está a 15 min a pie del alojamiento, y Playa de Patacona está a 2,2 km. El aeropuerto más cercano (Aeropuerto de Valencia) está a 14 km."
Gorgeous Apt with a Large Private Terrace,"7,4","a 1,5 km del centro",,€ 687,https://www.booking.com/hotel/es/gorgeous-apt-with-a-large-private-terrace.es.html?label=gen173nr-1FCAEoggI46AdIClgEaEaIAQGYAQq4ARfIAQ_YAQHoAQH4AQKIAgGoAgO4AvWhzq0GwAIB0gIkYTQ3OGY1ZmUtNzVlOS00NmIxLTg5MjQtOWUzNDhhNDhhZWFi2AIF4AIB&aid=304142&ucfs=1&arphpl=1&checkin=2024-02-25&checkout=2024-03-01&dest_id=-406131&dest_type=city&group_adults=2&req_adults=2&no_rooms=1&group_children=0&req_children=0&hpos=14&hapos=339&sr_order=popularity&srpvid=20ce4d8e43b40332&srepoch=1706267036&all_sr_blocks=835663502_348993982_2_0_0&highlighted_blocks=835663502_348993982_2_0_0&matching_block_id=835663502_348993982_2_0_0&sr_pri_blocks=835663502_348993982_2_0_0__68725&from=searchresults#hotelTmpl,4 de 5,"Gorgeous Apt with a Large Private Terrace se encuentra en Valencia, cerca de Church of Saint Nicolás, Estación de tren del Norte, y Basílica de la Virgen de los Desamparados, y ofrece wifi gratis.

Las unidades están equipadas con terraza y ofrecen aire acondicionado, TV y baño privado con ducha y secador de pelo. También se ofrece nevera, lavavajillas y microondas en la cocina, además de cafetera.

Jardines de Monforte está a 3,3 km del alojamiento, y Jardín del Turia está a 3,4 km. El aeropuerto más cercano (Aeropuerto de Valencia) está a 8 km del alojamiento."
Apartamento valencia centro,"9,3","a 1,3 km del centro",,€ 865,https://www.booking.com/hotel/es/centrico-y-cogedor-apartamento.es.html?label=gen173nr-1FCAEoggI46AdIClgEaEaIAQGYAQq4ARfIAQ_YAQHoAQH4AQKIAgGoAgO4AvWhzq0GwAIB0gIkYTQ3OGY1ZmUtNzVlOS00NmIxLTg5MjQtOWUzNDhhNDhhZWFi2AIF4AIB&aid=304142&ucfs=1&arphpl=1&checkin=2024-02-25&checkout=2024-03-01&dest_id=-406131&dest_type=city&group_adults=2&req_adults=2&no_rooms=1&group_children=0&req_children=0&hpos=15&hapos=340&sr_order=popularity&srpvid=20ce4d8e43b40332&srepoch=1706267036&all_sr_blocks=892865101_369102871_0_0_0&highlighted_blocks=892865101_369102871_0_0_0&matching_block_id=892865101_369102871_0_0_0&sr_pri_blocks=892865101_369102871_0_0_0__86450&from=searchresults#hotelTmpl,4 de 5,"Apartamento valencia centro, que cuenta con vistas a la ciudad, ofrece alojamiento con terraza y balcón a unos 16 min a pie de Estación de tren del Norte. El apartamento cuenta con parking privado y está a 19 min a pie de Jardín del Turia.

Este apartamento con aire acondicionado consta de 2 dormitorios, una sala de estar, una cocina totalmente equipada con nevera y cafetera, y 2 baños con bidet y ducha. Hay toallas y ropa de cama en el apartamento.

En recepción se habla inglés, español, francés y italiano, y el personal está siempre dispuesto a echar una mano.

Museo Nacional de Cerámica y Artes Santuarias González Martí está a 18 min a pie del alojamiento, y Jardines de Monforte está a 2,7 km. El aeropuerto más cercano (Aeropuerto de Valencia) está a 10 km del alojamiento."
ApartUP Central Market I,"7,6","a 0,7 km del centro",,€ 743,https://www.booking.com/hotel/es/apartup-central-market-i.es.html?label=gen173nr-1FCAEoggI46AdIClgEaEaIAQGYAQq4ARfIAQ_YAQHoAQH4AQKIAgGoAgO4AvWhzq0GwAIB0gIkYTQ3OGY1ZmUtNzVlOS00NmIxLTg5MjQtOWUzNDhhNDhhZWFi2AIF4AIB&aid=304142&ucfs=1&arphpl=1&checkin=2024-02-25&checkout=2024-03-01&dest_id=-406131&dest_type=city&group_adults=2&req_adults=2&no_rooms=1&group_children=0&req_children=0&hpos=16&hapos=341&sr_order=popularity&srpvid=20ce4d8e43b40332&srepoch=1706267036&all_sr_blocks=537424201_326365196_4_0_0&highlighted_blocks=537424201_326365196_4_0_0&matching_block_id=537424201_326365196_4_0_0&sr_pri_blocks=537424201_326365196_4_0_0__74250&from=searchresults#hotelTmpl,4 de 5,"ApartUP Central Market I ofrece wifi gratis y está en el centro de Valencia, a pocos pasos de Church of Saint Nicolás y a 5 min a pie de Basílica de la Virgen de los Desamparados. Este apartamento está a 13 min a pie de Estación de tren del Norte y a 4,9 km de Bioparc Valencia.

El apartamento de 1 dormitorio tiene sala de estar con TV, cocina totalmente equipada con nevera y microondas, y 1 baño con bañera o ducha. Hay toallas y ropa de cama en el apartamento.

Cerca del alojamiento hay puntos de interés como Jardines de Monforte, Jardín del Turia y Museo Nacional de Cerámica y Artes Santuarias González Martí. El aeropuerto más cercano (Aeropuerto de Valencia) está a 8 km."
Apartamento dos habitaciones primera línea de playa,"8,4",a 5 km del centro,,€ 855,https://www.booking.com/hotel/es/apartamento-primero-linea-de-playa.es.html?label=gen173nr-1FCAEoggI46AdIClgEaEaIAQGYAQq4ARfIAQ_YAQHoAQH4AQKIAgGoAgO4AvWhzq0GwAIB0gIkYTQ3OGY1ZmUtNzVlOS00NmIxLTg5MjQtOWUzNDhhNDhhZWFi2AIF4AIB&aid=304142&ucfs=1&arphpl=1&checkin=2024-02-25&checkout=2024-03-01&dest_id=-406131&dest_type=city&group_adults=2&req_adults=2&no_rooms=1&group_children=0&req_children=0&hpos=17&hapos=342&sr_order=popularity&srpvid=20ce4d8e43b40332&srepoch=1706267036&all_sr_blocks=965411801_370107738_0_0_0&highlighted_blocks=965411801_370107738_0_0_0&matching_block_id=965411801_370107738_0_0_0&sr_pri_blocks=965411801_370107738_0_0_0__85500&from=searchresults#hotelTmpl,3 de 5,"Apartamento dos habitaciones primera línea de playa se encuentra en Valencia, a pocos pasos de Playa de Patacona y a menos de 1 km de Playa de la Malvarrosa, y ofrece alojamiento con wifi gratis, aire acondicionado y piscina de temporada al aire libre. Este alojamiento frente a la playa ofrece acceso a un patio.

El apartamento tiene 2 dormitorios, 1 baño, ropa de cama, toallas, TV de pantalla plana, zona de comedor, cocina totalmente equipada y terraza con vistas a la piscina. Para mayor comodidad, el alojamiento puede ofrecer toallas y ropa de cama por un suplemento.

Playa de Port Saplaya está a 1,7 km del alojamiento, y Puerto de Valencia está a 4,5 km. El aeropuerto más cercano (Aeropuerto de Valencia) está a 17 km."
Habitaciones con baño y cocina privada,"8,6","a 3,5 km del centro",,€ 435,https://www.booking.com/hotel/es/bonito-estudio-familiar.es.html?label=gen173nr-1FCAEoggI46AdIClgEaEaIAQGYAQq4ARfIAQ_YAQHoAQH4AQKIAgGoAgO4AvWhzq0GwAIB0gIkYTQ3OGY1ZmUtNzVlOS00NmIxLTg5MjQtOWUzNDhhNDhhZWFi2AIF4AIB&aid=304142&ucfs=1&arphpl=1&checkin=2024-02-25&checkout=2024-03-01&dest_id=-406131&dest_type=city&group_adults=2&req_adults=2&no_rooms=1&group_children=0&req_children=0&hpos=18&hapos=343&sr_order=popularity&srpvid=20ce4d8e43b40332&srepoch=1706267036&all_sr_blocks=978647701_370846421_2_0_0&highlighted_blocks=978647701_370846421_2_0_0&matching_block_id=978647701_370846421_2_0_0&sr_pri_blocks=978647701_370846421_2_0_0__43500&from=searchresults#hotelTmpl,3 de 5,"Habitaciones con baño y cocina privada está en el barrio de Poblados marítimos, en Valencia, a 15 min a pie de Playa de la Malvarrosa y a 1,3 km de Playa de las Arenas. Hay wifi gratis en todo el alojamiento.

Todas las unidades disponen de baño privado, TV de pantalla plana y cocina totalmente equipada.

Playa de Patacona está a 2,1 km del alojamiento, y Puerto de Valencia está a 2,4 km. El aeropuerto (Aeropuerto de Valencia) está a 12 km, y el alojamiento ofrece servicio de traslado de pago para ir o volver del aeropuerto."
FLORIT FLATS - The Green Apartments,"6,7","a 1,8 km del centro",,€ 433,https://www.booking.com/hotel/es/florit-flats-the-green-apartments.es.html?label=gen173nr-1FCAEoggI46AdIClgEaEaIAQGYAQq4ARfIAQ_YAQHoAQH4AQKIAgGoAgO4AvWhzq0GwAIB0gIkYTQ3OGY1ZmUtNzVlOS00NmIxLTg5MjQtOWUzNDhhNDhhZWFi2AIF4AIB&aid=304142&ucfs=1&arphpl=1&checkin=2024-02-25&checkout=2024-03-01&dest_id=-406131&dest_type=city&group_adults=2&req_adults=2&no_rooms=1&group_children=0&req_children=0&hpos=19&hapos=344&sr_order=popularity&srpvid=20ce4d8e43b40332&srepoch=1706267036&all_sr_blocks=997165104_373646650_4_0_0&highlighted_blocks=997165104_373646650_4_0_0&matching_block_id=997165104_373646650_4_0_0&sr_pri_blocks=997165104_373646650_4_0_0__43311&from_sustainable_property_sr=1&from=searchresults#hotelTmpl,4 de 5,"FLORIT FLATS - The Green Apartments está a 2 km de Church of Saint Nicolás, en Valencia, y ofrece alojamiento con aire acondicionado y wifi gratis.

El alojamiento está equipado con TV de pantalla plana y baño privado con ducha y secador de pelo. La zona de cocina tiene nevera, lavavajillas y horno. También hay microondas, fogones y tostadora, además de cafetera y hervidor.

El apartamento ofrece servicio de alquiler de bicicletas.

Bioparc Valencia está a 1,9 km del alojamiento, y Estación de tren del Norte está a 3,4 km. El aeropuerto (Aeropuerto de Valencia) está a 6 km, y el alojamiento ofrece servicio de traslado de pago para ir o volver del aeropuerto."
FLORIT FLATS - The Canovas Apartment,"7,7","a 1,1 km del centro",,€ 733,https://www.booking.com/hotel/es/the-canovas-apartment.es.html?label=gen173nr-1FCAEoggI46AdIClgEaEaIAQGYAQq4ARfIAQ_YAQHoAQH4AQKIAgGoAgO4AvWhzq0GwAIB0gIkYTQ3OGY1ZmUtNzVlOS00NmIxLTg5MjQtOWUzNDhhNDhhZWFi2AIF4AIB&aid=304142&ucfs=1&arphpl=1&checkin=2024-02-25&checkout=2024-03-01&dest_id=-406131&dest_type=city&group_adults=2&req_adults=2&no_rooms=1&group_children=0&req_children=0&hpos=20&hapos=345&sr_order=popularity&srpvid=20ce4d8e43b40332&srepoch=1706267036&all_sr_blocks=895723701_360132105_4_0_0&highlighted_blocks=895723701_360132105_4_0_0&matching_block_id=895723701_360132105_4_0_0&sr_pri_blocks=895723701_360132105_4_0_0__73325&from=searchresults#hotelTmpl,4 de 5,"FLORIT FLATS - The Canovas Apartment se encuentra en Valencia, a 8 min a pie de Jardín del Turia y a 1,3 km de Museo Nacional de Cerámica y Artes Santuarias González Martí, y ofrece alojamiento con equipamiento como wifi gratis y TV de pantalla plana. Este apartamento está a 3,3 km de Oceanográfico y a 1,9 km de Church of Saint Nicolás.

Este apartamento con aire acondicionado consta de 2 dormitorios, una sala de estar, una zona de cocina totalmente equipada con nevera y cafetera, y 2 baños con ducha y secador de pelo. Hay toallas y ropa de cama en el apartamento.

Cerca del alojamiento hay puntos de interés como Estación de tren del Norte, Basílica de la Virgen de los Desamparados y Jardines de Monforte. El aeropuerto más cercano (Aeropuerto de Valencia) está a 9 km del alojamiento, que ofrece servicio de traslado de pago para ir o volver del aeropuerto."
Mi Rinconcito en Valencia,"9,6",a 500 m del centro,,€ 665,https://www.booking.com/hotel/es/mi-rinconcito-en-valencia-valencia.es.html?label=gen173nr-1FCAEoggI46AdIClgEaEaIAQGYAQq4ARfIAQ_YAQHoAQH4AQKIAgGoAgO4AvWhzq0GwAIB0gIkYTQ3OGY1ZmUtNzVlOS00NmIxLTg5MjQtOWUzNDhhNDhhZWFi2AIF4AIB&aid=304142&ucfs=1&arphpl=1&checkin=2024-02-25&checkout=2024-03-01&dest_id=-406131&dest_type=city&group_adults=2&req_adults=2&no_rooms=1&group_children=0&req_children=0&hpos=21&hapos=346&sr_order=popularity&srpvid=20ce4d8e43b40332&srepoch=1706267036&all_sr_blocks=1058808202_378809877_2_0_0&highlighted_blocks=1058808202_378809877_2_0_0&matching_block_id=1058808202_378809877_2_0_0&sr_pri_blocks=1058808202_378809877_2_0_0__66464&from=searchresults#hotelTmpl,3 de 5,"Mi Rinconcito en Valencia está en el centro de Valencia, a menos de 1 km de Estación de tren del Norte y a 4 min a pie de Church of Saint Nicolás, y ofrece wifi gratis. El apartamento está en una zona en la que se pueden practicar actividades como senderismo y ciclismo.

El apartamento dispone de 1 dormitorio, 1 baño, ropa de cama, toallas, TV, cocina totalmente equipada y terraza con vistas a la ciudad.

Cerca del alojamiento hay puntos de interés como Jardín del Turia, Museo Nacional de Cerámica y Artes Santuarias González Martí y Basílica de la Virgen de los Desamparados. El aeropuerto (Aeropuerto de Valencia) está a 8 km."
Marvellous Apt with a Large Private Terrace,"8,4","a 1,5 km del centro",,€ 687,https://www.booking.com/hotel/es/marvellous-apt-with-a-large-private-terrace.es.html?label=gen173nr-1FCAEoggI46AdIClgEaEaIAQGYAQq4ARfIAQ_YAQHoAQH4AQKIAgGoAgO4AvWhzq0GwAIB0gIkYTQ3OGY1ZmUtNzVlOS00NmIxLTg5MjQtOWUzNDhhNDhhZWFi2AIF4AIB&aid=304142&ucfs=1&arphpl=1&checkin=2024-02-25&checkout=2024-03-01&dest_id=-406131&dest_type=city&group_adults=2&req_adults=2&no_rooms=1&group_children=0&req_children=0&hpos=1&hapos=351&sr_order=popularity&srpvid=20ce4d8e43b40332&srepoch=1706267043&all_sr_blocks=831211902_348290617_2_0_0&highlighted_blocks=831211902_348290617_2_0_0&matching_block_id=831211902_348290617_2_0_0&sr_pri_blocks=831211902_348290617_2_0_0__68725&from=searchresults#hotelTmpl,4 de 5,"Marvellous Apt with a Large Private Terrace está en Valencia, cerca de Church of Saint Nicolás, Estación de tren del Norte, y Basílica de la Virgen de los Desamparados, y ofrece wifi gratis.

Las unidades están equipadas con terraza y ofrecen aire acondicionado, TV y baño privado con ducha y secador de pelo. También hay nevera, lavavajillas y microondas en la cocina, además de cafetera.

Jardines de Monforte está a 3,3 km del alojamiento, y Jardín del Turia está a 3,4 km. El aeropuerto más cercano (Aeropuerto de Valencia) está a 8 km."
Blanq Comedias,"8,7",a 450 m del centro,,€ 823,https://www.booking.com/hotel/es/blanq-comedias.es.html?label=gen173nr-1FCAEoggI46AdIClgEaEaIAQGYAQq4ARfIAQ_YAQHoAQH4AQKIAgGoAgO4AvWhzq0GwAIB0gIkYTQ3OGY1ZmUtNzVlOS00NmIxLTg5MjQtOWUzNDhhNDhhZWFi2AIF4AIB&aid=304142&ucfs=1&arphpl=1&checkin=2024-02-25&checkout=2024-03-01&dest_id=-406131&dest_type=city&group_adults=2&req_adults=2&no_rooms=1&group_children=0&req_children=0&hpos=2&hapos=352&sr_order=popularity&srpvid=20ce4d8e43b40332&srepoch=1706267043&all_sr_blocks=492200201_285721758_0_0_0&highlighted_blocks=492200201_285721758_0_0_0&matching_block_id=492200201_285721758_0_0_0&sr_pri_blocks=492200201_285721758_0_0_0__82320&from=searchresults#hotelTmpl,4 de 5,"Blanq Comedias ofrece wifi gratis en todo el alojamiento y vistas a la ciudad en Valencia. Cerca hay lugares de interés populares como Basílica de la Virgen de los Desamparados, Jardín del Turia y Estación de tren del Norte. El alojamiento está a 500 metros del centro de la ciudad y a 2 min a pie de Museo Nacional de Cerámica y Artes Santuarias González Martí.

El hostal o pensión ofrece habitaciones con aire acondicionado, armario, cafetera, caja fuerte, TV de pantalla plana y baño privado con ducha. En Blanq Comedias, todas las habitaciones tienen ropa de cama y toallas.

En la recepción 24 horas se hablan varios idiomas, como inglés, español y francés.

Cerca del alojamiento hay puntos de interés como Jardines de Monforte, Church of Saint Nicolás y Plaza del Ayuntamiento. El aeropuerto (Aeropuerto de Valencia) está a 9 km, y el alojamiento ofrece servicio de traslado de pago para ir o volver del aeropuerto."
FLORIT FLATS - Traditional House in El Cabanyal,"7,9",a 4 km del centro,,€ 552,https://www.booking.com/hotel/es/traditional-house-in-el-cabanyal.es.html?label=gen173nr-1FCAEoggI46AdIClgEaEaIAQGYAQq4ARfIAQ_YAQHoAQH4AQKIAgGoAgO4AvWhzq0GwAIB0gIkYTQ3OGY1ZmUtNzVlOS00NmIxLTg5MjQtOWUzNDhhNDhhZWFi2AIF4AIB&aid=304142&ucfs=1&arphpl=1&checkin=2024-02-25&checkout=2024-03-01&dest_id=-406131&dest_type=city&group_adults=2&req_adults=2&no_rooms=1&group_children=0&req_children=0&hpos=3&hapos=353&sr_order=popularity&srpvid=20ce4d8e43b40332&srepoch=1706267043&all_sr_blocks=902871001_361084286_4_0_0&highlighted_blocks=902871001_361084286_4_0_0&matching_block_id=902871001_361084286_4_0_0&sr_pri_blocks=902871001_361084286_4_0_0__55208&from=searchresults#hotelTmpl,3 de 5,"FLORIT FLATS - Traditional House in El Cabanyal se encuentra en el barrio de Poblados marítimos, en Valencia, cerca de Playa de las Arenas. Tiene terraza, wifi gratis y lavadora. Este apartamento está a 18 min a pie de Playa de la Malvarrosa y a 2,4 km de Playa de Patacona.

Este apartamento consta de 2 dormitorios, una sala de estar, una zona de cocina totalmente equipada con nevera y cafetera, y 1 baño con bañera y secador de pelo. Hay toallas y ropa de cama en el apartamento.

Puerto de Valencia está a menos de 1 km del alojamiento, y Oceanográfico está a 3,9 km. El aeropuerto más cercano (Aeropuerto de Valencia) está a 14 km del alojamiento, que ofrece servicio de traslado de pago para ir o volver del aeropuerto."
Beautiful Japandi Style Loft Apartment N1,"9,3","a 1,5 km del centro",,€ 556,https://www.booking.com/hotel/es/beautiful-japandi-style-loft-apartment-n1.es.html?label=gen173nr-1FCAEoggI46AdIClgEaEaIAQGYAQq4ARfIAQ_YAQHoAQH4AQKIAgGoAgO4AvWhzq0GwAIB0gIkYTQ3OGY1ZmUtNzVlOS00NmIxLTg5MjQtOWUzNDhhNDhhZWFi2AIF4AIB&aid=304142&ucfs=1&arphpl=1&checkin=2024-02-25&checkout=2024-03-01&dest_id=-406131&dest_type=city&group_adults=2&req_adults=2&no_rooms=1&group_children=0&req_children=0&hpos=4&hapos=354&sr_order=popularity&srpvid=20ce4d8e43b40332&srepoch=1706267043&all_sr_blocks=992173202_372185847_2_0_0&highlighted_blocks=992173202_372185847_2_0_0&matching_block_id=992173202_372185847_2_0_0&sr_pri_blocks=992173202_372185847_2_0_0__55625&from=searchresults#hotelTmpl,4 de 5,"Beautiful Japandi Style Loft Apartment N1 es un alojamiento con vistas a la ciudad que se encuentra en Valencia, a 18 min a pie de Estación de tren del Norte y a 3,6 km de Church of Saint Nicolás. Este apartamento está a 4,2 km de Jardín del Turia y a 4,3 km de Museo Nacional de Cerámica y Artes Santuarias González Martí.

Este apartamento de 1 dormitorio ofrece wifi gratis, TV y cocina con nevera y microondas. Hay toallas y ropa de cama en el apartamento.

Basílica de la Virgen de los Desamparados está a 4,4 km del alojamiento, y Bioparc Valencia está a 4,5 km. El aeropuerto más cercano (Aeropuerto de Valencia) está a 8 km del alojamiento."
