Hotels,Ratings,Distance,District,Price,Link,Star,Descriptions
Loft independiente de Lujo.,"8,5","a 0,7 km del centro",,€ 677,https://www.booking.com/hotel/es/loft-independiente-de-lujo.es.html?label=gen173nr-1FCAEoggI46AdIClgEaEaIAQGYAQq4ARfIAQ_YAQHoAQH4AQKIAgGoAgO4AvWhzq0GwAIB0gIkYTQ3OGY1ZmUtNzVlOS00NmIxLTg5MjQtOWUzNDhhNDhhZWFi2AIF4AIB&aid=304142&ucfs=1&arphpl=1&checkin=2024-02-25&checkout=2024-03-01&dest_id=-406131&dest_type=city&group_adults=2&req_adults=2&no_rooms=1&group_children=0&req_children=0&hpos=1&hapos=1&sr_order=popularity&srpvid=20ce4d8e43b40332&srepoch=1706266911&all_sr_blocks=1137214301_386338914_2_0_0&highlighted_blocks=1137214301_386338914_2_0_0&matching_block_id=1137214301_386338914_2_0_0&sr_pri_blocks=1137214301_386338914_2_0_0__67700&from=searchresults#hotelTmpl,4 de 5,"Loft independiente de Lujo. Está en Valencia, a solo menos de 1 km de Estación de tren del Norte, y dispone de alojamiento con jardín, terraza y wifi gratis. Este apartamento está a 1,7 km de Jardines de Monforte y a 19 min a pie de Church of Saint Nicolás.

Este apartamento tiene aire acondicionado y cuenta con 1 dormitorio, TV de pantalla plana y cocina con nevera y lavavajillas. Hay toallas y ropa de cama en el apartamento.

Cerca del alojamiento hay puntos de interés como Jardín del Turia, Museo Nacional de Cerámica y Artes Santuarias González Martí y Basílica de la Virgen de los Desamparados. El aeropuerto más cercano (Aeropuerto de Valencia) está a 9 km."
Melia Valencia,"7,8","a 3,5 km del centro",,€ 1.562,https://www.booking.com/hotel/es/melia-valencia.es.html?label=gen173nr-1FCAEoggI46AdIClgEaEaIAQGYAQq4ARfIAQ_YAQHoAQH4AQKIAgGoAgO4AvWhzq0GwAIB0gIkYTQ3OGY1ZmUtNzVlOS00NmIxLTg5MjQtOWUzNDhhNDhhZWFi2AIF4AIB&aid=304142&ucfs=1&arphpl=1&checkin=2024-02-25&checkout=2024-03-01&dest_id=-406131&dest_type=city&group_adults=2&req_adults=2&no_rooms=1&group_children=0&req_children=0&hpos=2&hapos=2&sr_order=popularity&srpvid=20ce4d8e43b40332&srepoch=1706266911&all_sr_blocks=29049343_91989386_2_33_0&highlighted_blocks=29049343_91989386_2_33_0&matching_block_id=29049343_91989386_2_33_0&sr_pri_blocks=29049343_91989386_2_33_0__156200&nad_id=c935dd89-70f6-4b1c-ab9b-34173baab544_0&nad_cpc=0.59&nad_track=eyJyYW5rIjoxLCJrb2RkaVRyYWNraW5nSW5mbyI6Iit1Q2xWTWg2SHdYQTF6cVR5dlhNQWkrZTdrTVkxZ3FSenhtazNScGlMZTNacGdQSDl1cCthUE13TkFiRzFaQ01iQWNUTHJvRnBnZWF5NkxRMHhiakNZdjZCd1lqbWhCdkJOeUdxWmhUVFdNOXFtTENZaEFid3VIVC9vWFBWTGhCdkc0ZFFaNVpFNTUrb1BuazM3Zmw0ZGJDVTJZeUxuYldaTG9XcVlCK3RUTi9ZN1Vlcm5jbTZFY1RXWCtOeEQ1Z05PMG9WcndMdEp5U3lXcGFmNVpjRStxdWxva0FvOHBuVkFNRy9EblBERHd6bG41c2lPT0NRU3BoY210ZmVxdmNnMlM3RVJwV1cwY1pibGRzSGtERUFSOStJWkRXczdMNWNJOFhwN013cnZTZmNwWkdKM0xQVmdaeU5aMlFBUlhYRDJDTVNOR0d3cDFmaG9nRkJLbFczb1lsdjRWd2FxMkpaVHVWcldDZ3VKeFZpSG9RR1pSNnBvVzVKcVN1eWRDWFpMT0pqS3JTNXJIckllSCtjZmt0T1FrbUNlS0VFWGFnRjhoWXBwOWN4RkM0UGRXb2tkcWh2ZkRweXlZWG5JUmVTbSt5WUpyQTVGUUFsTG5qd0JqN0ZZM2pmQWJHQkRSbnBxKzRiUExEMkJpUzBwMG9sY0prQjlGWTZzdEJWYkRaTFEvRS9RK0pLa0FaWXVBaFMzL0JEREVmWXM1Ri9id1Z5bUZSdUhYVXhCUG9XdnJxU2lZOTlzb0VPMUY2ZUhqUGFSb2V4anFLTm95VEJranZoakxSRWxpcE9EcTVQa3BLVmpTV2wyQ2kxR0xMa0pJc0RacUg0YU9TZERCamNUeGY0dlUvdlpjTDBXc2w3bmd5d0lIeUZXb1FreWFkTnI2Q09ndUIrbFdWV01HYUlGWDdrUDdKUm9LL1RBS1BNemFQVWxzQzY5M01aM2hQajZkRE4rL3Uwei9lRTZROGg4VHNCY0pVaGhqSDRiODBRcW1JWXNjTlRRb3JhTXJLbk4xeWc5QzJzRzIxcDgvWFovN3dkY2o3aTh3TmhhQ2x1U2V6anNGcjI1MnRTYW5hWEdHdUpTejEyMkw1THg5eUdIdUJzbFJhUTllMHF4NVBYek9uQW9CbmZHeHRNSXBsb3dSZlk3cExORUlDVDhXRVl4ZFFKWVptM0lkL2Y4SHRtMm5iOGtOUkZMaWxGOGd0UGhyaDNsd3pXZUgzelVRMHV1a1E4YmNRNDdlRUVTVjZaM2ppZTcweVBPU2tsWjJ5VHhLb2x6VGd1U2VVYlpVQTZ1dEsrTnl0YmVVVnFyWjJLWmlMV0IzVnhzaUxkVS9RVWQ0bzQ1RTNVVndkcGxyU0llbE94MjhOWGdSdjh0RzVINllNek5DV3lBdFlsblRNYUdSMkJ2QkxaQWhmdkZkaWJ5em4zKzNkQzV2bDhvYTVZd00rMjMvYW84VS9GTUt0NlQ1UVgrazVMWVhFMjBZdUJVeTBHZXJTcEZjZTFuYlZ3NWgwSkJRL0RIL040MGVjNnNjSUd3YzU4S1FuZXE5TEVLK3BUbVFRVTRLeldqVGdpOThKTzYyODVBOWxjYXJPQmpXWVZSWlRlR0tyMFNpNjlDeFl6RHJxU0ZITEU4RWtDaXFqS1NUVVdUajl1UUFKYURYSzV0ZVlqQ3Qrd2RnQUgzcGtLTm9QNXFZcVBuZnRPNHhEVzBLM3VBeVVoc08xUDFkOVJtVElUZHhOQkN1alR3Q29kSGxxZFI0bXRvOWJSVWNET1R3YWhKWjhnQklMZ1JDRFUvc2ZPQXlodit5bmgyMmt5Q29UY3UwSjEwS3pFSG15VWdvakxMb21ZeU9HbnlCZEs2NWM3ZGw1dmJVdDBBeWNuMU5YdllZcGhsMVFjMERIbERRZllMUnV4Um9oemhRdDR3cGZEaDlOTC8rRWF2Slo3LzFwVFkxZjkwVlBoZVhJb3FhQVFMQnlvajAvQlNSbUZBTlVrdUZnay9ENUVRRlpSc1BSZ1VwU3FwSmpTU3pFQ0V1cW00YkZwSUsyakpVekwrSWhvV0VIK3A0U3IyUFByKzdEVTNweWwrbFBxMWtScldEeU9pKzl5bTBXZmdvY0I0MEZoU1VjRnQ3QzFOMUhUN0VjM1FMdlpOajQrRnFlQVREWWpETmlTRGZrRFQwOFM3Rnl2Z3d0U0FscHFnTXlLMjYrTnhFUGhrUllGWmpoZzJUa2tTTXdpWE9FQ0JNazUyU2VSNzVWZmJjUmNISWJ5L3VEdmRCYUIvUlNueGxiSnNPODgwRTFYR3FyZ0JVbUl2clBqMGgwdnZpbERPeU82RWhOeHJ0UXdFNm1pak9ZUnp2Lzc1S25KWVFNdGN4dEFzQlhKekpTK2JmYktabzdmSFloc0d0cUpVclJtdXh3YkR4dzFJU04zSWNRVzZtVTdWbU1ReUxJTXlJVFdnTjZseElGYnVmOWxvNWhtSHFpRDVTTXFLRkVJRVlFU3RFanB4aXpRVU0yVWNwRVZZVFVVZENieUVqNTFDMDM4ZjV3bXZuckxEMjIwTlh2WE9nZFUzRFpCczdJL1ZjWC8zTHZKRy9ZZ0gvcGVvWWhCOUs5TzhGUkk2MG02YXlKZ00vRjRUSzBtV1pGSkVOZ0p1SDhLejA0ano3dFVUNTRJRndxeTFPaTJuYldNSy9Ha29acTJhSmgwOU1jRFlaaXM4a1YrWFdsNU53ZUFwZFFubVNjVml0czBIQWdZSVg0RlpRVUZuYURaYUVaeDUzRDROTjhOdnVVS3lSbEhrL0EyWjJ0SHdmQUNqMGxMQ0pnQm5LbWY1VG5pNnFBZnFDdzAvdUlPK2VFMGJIdXVVdDNsZnRLQnRRSi9aUktuOTZRaDAxQjgyY0dqOUVjUkdqTUhjb3JFUjYrTERMYjdwM29lUnYzY0pFR3pnMDVSMkl0R2dKZjV0dEFOdllMdGFKRDluRzJ6cDZTT0tkais0eXRWdks3VDNYaEdzZDNOYXhDSGVXNU1jYzlqT05NSUx5S29IbENyQzJkTlRTS0VpZ2pNKzhPbjNScThXYUczZnZ1V2FSd0VtNytEaEJLLzdpODBkODRMUEEzajg4K2d1YTE3by9JWm5GZ2hQd3Z4aG9XeEVUR2NQajZRdWxhZFdTamVLUm0vUW1MUjl2Zm1TMmhGZ3BDK2h3a0wrS1FFYk53SGdxalQ4b0E5NFpxQkxjZFVidTc0d0VQUUNuWVRqYXVyQ1krb2dqZmhNbkZad0Z3cGQwQW1WYjhVOFk9In0%3D&from_sustainable_property_sr=1&from=searchresults#hotelTmpl,1 de 5,"Este Meliá es un hotel moderno situado junto al Palacio de Congresos de Valencia, a 5 km de la estación de tren del AVE. La estación de metro de Beniferri se encuentra a solo 400 metros.

Las habitaciones son amplias y presentan un diseño moderno. Ofrecen unas vistas espectaculares y tienen TV de pantalla plana de 49 pulgadas con canales vía satélite. Todas disponen de aire acondicionado, WiFi gratuita y baño moderno.

El hotel cuenta con una zona de juegos infantiles. Hay salas de reuniones disponibles. Algunas zonas del hotel albergan habitaciones The Level y servicios exclusivos, como una zona privada para hacer el registro de entrada y de salida, desayuno buffet exclusivo, aperitivos y bebidas a diario en la zona privada y servicio de conserjería y organización de actividades en el hotel y la ciudad.

El aeropuerto internacional de Manises está a solo 15 minutos en coche del Meliá Valencia.

El hotel alberga el restaurante Socarrat, especializado en paellas valencianas y en cocina mediterránea e internacional. El bar Oval ofrece una pequeña carta de aperitivos y bebidas durante todo el día."
Hotel Alkazar,"7,4",a 200 m del centro,,€ 602,https://www.booking.com/hotel/es/alkazar.es.html?label=gen173nr-1FCAEoggI46AdIClgEaEaIAQGYAQq4ARfIAQ_YAQHoAQH4AQKIAgGoAgO4AvWhzq0GwAIB0gIkYTQ3OGY1ZmUtNzVlOS00NmIxLTg5MjQtOWUzNDhhNDhhZWFi2AIF4AIB&aid=304142&ucfs=1&arphpl=1&checkin=2024-02-25&checkout=2024-03-01&dest_id=-406131&dest_type=city&group_adults=2&req_adults=2&no_rooms=1&group_children=0&req_children=0&hpos=3&hapos=3&sr_order=popularity&srpvid=20ce4d8e43b40332&srepoch=1706266911&all_sr_blocks=40851101_152851286_2_0_0&highlighted_blocks=40851101_152851286_2_0_0&matching_block_id=40851101_152851286_2_0_0&sr_pri_blocks=40851101_152851286_2_0_0__60188&from=searchresults#hotelTmpl,3 de 5,"This attractive hotel is set on a pedestrianised street, 300 metres from Estació del Nord Train Station. It offers a terrace, an elegant restaurant and cosy, air-conditioned rooms with free Wi-Fi.

Rooms at Hotel Alkazar feature smart. All include a plasma TV and private bathroom and some also have a balcony.

The hotel’s Taberna Alkázar Restaurante specialises in seafood and fish dishes and there is also a bar. Many tapas bars, restaurants and shops are within 5 minutes’ walk.

The hotel offers tourist information and is within 10 minutes’ walk of Valencia Cathedral, the Central Market and La Lonja de Seda. Buses to the beach take 30 minutes, more less than 300 meters you have a subway station.

The Alkazar is 300 metres from Xàtiva Metro Station and the bullring. The Ciutat de les Arts i les Ciències is 2.5 km away. The hotel is close to Santo Crial and The church of Saint Nicolas."
Hospederia del Pilar,"8,9","a 0,6 km del centro",,€ 270,https://www.booking.com/hotel/es/hospederia-del-pilar.es.html?label=gen173nr-1FCAEoggI46AdIClgEaEaIAQGYAQq4ARfIAQ_YAQHoAQH4AQKIAgGoAgO4AvWhzq0GwAIB0gIkYTQ3OGY1ZmUtNzVlOS00NmIxLTg5MjQtOWUzNDhhNDhhZWFi2AIF4AIB&aid=304142&ucfs=1&arphpl=1&checkin=2024-02-25&checkout=2024-03-01&dest_id=-406131&dest_type=city&group_adults=2&req_adults=2&no_rooms=1&group_children=0&req_children=0&hpos=4&hapos=4&sr_order=popularity&srpvid=20ce4d8e43b40332&srepoch=1706266911&all_sr_blocks=32776603_88207381_2_0_0&highlighted_blocks=32776603_88207381_2_0_0&matching_block_id=32776603_88207381_2_0_0&sr_pri_blocks=32776603_88207381_2_0_0__27000&from=searchresults#hotelTmpl,4 de 5,"La céntrica Hospedería del Pilar fue fundada en 1886 y ofrece recepción abierta las 24 horas y zona de conexión Wi-Fi gratuita. Se encuentra a 10 minutos a pie de la estación de tren de Valencia y a 50 metros del Mercado Central y la Lonja de la Seda.

Las habitaciones presentan suelo de baldosa y mobiliario de madera clara. Cuentan con aire acondicionado, TV, escritorio, calefacción y baño privado con ducha.

La céntrica pensión Pilar está situada a 5 minutos a pie de múltiples tiendas, bares y restaurantes.

El establecimiento ofrece mostrador de información turística. Se halla a solo 500 metros de la catedral de Valencia y a 10 minutos a pie de la plaza central, de donde sale un autobús hacia la playa."
Soho Boutique Turia,"9,0","a 0,8 km del centro",,€ 1.225,https://www.booking.com/hotel/es/soho-boutique-turia-valencia.es.html?label=gen173nr-1FCAEoggI46AdIClgEaEaIAQGYAQq4ARfIAQ_YAQHoAQH4AQKIAgGoAgO4AvWhzq0GwAIB0gIkYTQ3OGY1ZmUtNzVlOS00NmIxLTg5MjQtOWUzNDhhNDhhZWFi2AIF4AIB&aid=304142&ucfs=1&arphpl=1&checkin=2024-02-25&checkout=2024-03-01&dest_id=-406131&dest_type=city&group_adults=2&req_adults=2&no_rooms=1&group_children=0&req_children=0&hpos=5&hapos=5&sr_order=popularity&srpvid=20ce4d8e43b40332&srepoch=1706266911&all_sr_blocks=838012801_350211560_2_2_0&highlighted_blocks=838012801_350211560_2_2_0&matching_block_id=838012801_350211560_2_2_0&sr_pri_blocks=838012801_350211560_2_2_0__122500&from_sustainable_property_sr=1&from=searchresults#hotelTmpl,4 de 5,"Soho Boutique Turia se encuentra en Valencia, a 5 min a pie de Jardín del Turia y a menos de 1 km de Museo Nacional de Cerámica y Artes Santuarias González Martí, y ofrece alojamiento con bar. Este hotel de 4 estrellas tiene wifi gratis, recepción 24 horas y servicio de conserjería. Este alojamiento libre de humo está a 14 min a pie de Jardines de Monforte.

El hotel ofrece habitaciones con aire acondicionado, escritorio, cafetera, minibar, caja fuerte, TV de pantalla plana y baño privado con ducha. En Soho Boutique Turia, cada habitación tiene ropa de cama y toallas.

Cerca del alojamiento hay puntos de interés como Basílica de la Virgen de los Desamparados, Estación de tren del Norte y Church of Saint Nicolás. El aeropuerto más cercano (Aeropuerto de Valencia) está a 9 km del alojamiento."
Palau Apartments Valencia,"8,5","a 1,6 km del centro",,€ 643,https://www.booking.com/hotel/es/palau-apartments-valencia-valencia.es.html?label=gen173nr-1FCAEoggI46AdIClgEaEaIAQGYAQq4ARfIAQ_YAQHoAQH4AQKIAgGoAgO4AvWhzq0GwAIB0gIkYTQ3OGY1ZmUtNzVlOS00NmIxLTg5MjQtOWUzNDhhNDhhZWFi2AIF4AIB&aid=304142&ucfs=1&arphpl=1&checkin=2024-02-25&checkout=2024-03-01&dest_id=-406131&dest_type=city&group_adults=2&req_adults=2&no_rooms=1&group_children=0&req_children=0&hpos=6&hapos=6&sr_order=popularity&srpvid=20ce4d8e43b40332&srepoch=1706266911&all_sr_blocks=631527907_344771667_0_2_0&highlighted_blocks=631527907_344771667_0_2_0&matching_block_id=631527907_344771667_0_2_0&sr_pri_blocks=631527907_344771667_0_2_0__64337&from_sustainable_property_sr=1&from=searchresults#hotelTmpl,4 de 5,"Palau Apartments Valencia cuenta con vistas a la ciudad y se encuentra en el barrio de El Pla del Real, en Valencia, a menos de 1 km de Jardín del Turia y a 1,7 km de Jardines de Monforte. Se ofrece wifi gratis en todo el alojamiento y parking privado en el propio alojamiento.

El alojamiento tiene aire acondicionado, cocina totalmente equipada y con zona de comedor, TV de pantalla plana y baño privado con ducha, artículos de aseo gratuitos y secador de pelo. También hay nevera, microondas y fogones, además de cafetera y hervidor.

El apartahotel ofrece servicio de alquiler de bicicletas.

Estación de tren del Norte está a 2,1 km del alojamiento, y Museo Nacional de Cerámica y Artes Santuarias González Martí está a 1,8 km. El aeropuerto más cercano (Aeropuerto de Valencia) está a 10 km del alojamiento."
CAPSULE INN VALENCIA,"9,1","a 0,9 km del centro",,€ 272,https://www.booking.com/hotel/es/capsule-inn-valencia.es.html?label=gen173nr-1FCAEoggI46AdIClgEaEaIAQGYAQq4ARfIAQ_YAQHoAQH4AQKIAgGoAgO4AvWhzq0GwAIB0gIkYTQ3OGY1ZmUtNzVlOS00NmIxLTg5MjQtOWUzNDhhNDhhZWFi2AIF4AIB&aid=304142&ucfs=1&arphpl=1&checkin=2024-02-25&checkout=2024-03-01&dest_id=-406131&dest_type=city&group_adults=2&req_adults=2&no_rooms=1&group_children=0&req_children=0&hpos=7&hapos=7&sr_order=popularity&srpvid=20ce4d8e43b40332&srepoch=1706266911&all_sr_blocks=1065293701_384543851_2_0_0&highlighted_blocks=1065293701_384543851_2_0_0&matching_block_id=1065293701_384543851_2_0_0&sr_pri_blocks=1065293701_384543851_2_0_0__27234&from=searchresults#hotelTmpl,4 de 5,"CAPSULE INN VALENCIA está muy bien situado en el barrio de Extramurs, Valencia, a 1,7 km de Church of Saint Nicolás, a 2,8 km de Jardín del Turia y a 17 min a pie de Museo Nacional de Cerámica y Artes Santuarias González Martí. Este alojamiento ofrece cocina compartida y salón de uso común, además de wifi gratis en todo el alojamiento. Este alojamiento libre de humo se encuentra a menos de 1 km de Estación de tren del Norte.

Las habitaciones incluyen aire acondicionado, lavavajillas, microondas, cafetera, ducha, artículos de aseo gratuitos y escritorio. Todas las habitaciones incluyen baño compartido, secador de pelo y ropa de cama.

Basílica de la Virgen de los Desamparados está a 1,8 km del alojamiento, y Jardines de Monforte está a 3,4 km. El aeropuerto más cercano (Aeropuerto de Valencia) está a 8 km del alojamiento."
Macflats Valencia Puerto,"7,9","a 3,8 km del centro",,€ 535,https://www.booking.com/hotel/es/atarazanas-valencia.es.html?label=gen173nr-1FCAEoggI46AdIClgEaEaIAQGYAQq4ARfIAQ_YAQHoAQH4AQKIAgGoAgO4AvWhzq0GwAIB0gIkYTQ3OGY1ZmUtNzVlOS00NmIxLTg5MjQtOWUzNDhhNDhhZWFi2AIF4AIB&aid=304142&ucfs=1&arphpl=1&checkin=2024-02-25&checkout=2024-03-01&dest_id=-406131&dest_type=city&group_adults=2&req_adults=2&no_rooms=1&group_children=0&req_children=0&hpos=8&hapos=8&sr_order=popularity&srpvid=20ce4d8e43b40332&srepoch=1706266911&all_sr_blocks=18934301_380271990_2_0_0&highlighted_blocks=18934301_380271990_2_0_0&matching_block_id=18934301_380271990_2_0_0&sr_pri_blocks=18934301_380271990_2_0_0__53467&from_sustainable_property_sr=1&from=searchresults#hotelTmpl,3 de 5,"Estos apartamentos elegantes y bien equipados están situados a poca distancia a pie de la zona del puerto de Valencia y a 10 minutos a pie de la playa de las Arenas.

Los apartamentos del Puerto Valencia disponen de cocina bien equipada y funcional con zona de comedor para toda la familia.

Los huéspedes pueden pasear por la zona del puerto y respirar el aire puro del mar. Durante los meses de verano, los huéspedes también pueden ir a la playa cercana (a poca distancia a pie) para relajarse y tomar el sol."
Eurostars Rey Don Jaime,"8,1","a 1,8 km del centro",,€ 845,https://www.booking.com/hotel/es/eurostars-rey-don-jaime.es.html?label=gen173nr-1FCAEoggI46AdIClgEaEaIAQGYAQq4ARfIAQ_YAQHoAQH4AQKIAgGoAgO4AvWhzq0GwAIB0gIkYTQ3OGY1ZmUtNzVlOS00NmIxLTg5MjQtOWUzNDhhNDhhZWFi2AIF4AIB&aid=304142&ucfs=1&arphpl=1&checkin=2024-02-25&checkout=2024-03-01&dest_id=-406131&dest_type=city&group_adults=2&req_adults=2&no_rooms=1&group_children=0&req_children=0&hpos=9&hapos=9&sr_order=popularity&srpvid=20ce4d8e43b40332&srepoch=1706266911&all_sr_blocks=9152023_0_2_0_0&highlighted_blocks=9152023_0_2_0_0&matching_block_id=9152023_0_2_0_0&sr_pri_blocks=9152023_0_2_0_0__84494&from_sustainable_property_sr=1&from=searchresults#hotelTmpl,4 de 5,"El Eurostars Rey Don Jaime se encuentra frente al Jardín del Turia y el Palau de la Música de Valencia. El establecimiento dispone de terraza en la azotea con piscina. Además, hay WiFi gratuita en todas las instalaciones.

El Rey Don Jaime alberga una torre impresionante de 14 plantas y ofrece habitaciones con aire acondicionado, calefacción y TV vía satélite (por un suplemento). También incluyen armario grande.

El hotel está situado a unos 15 minutos a pie de la Ciudad de las Artes y las Ciencias. Asimismo, el establecimiento se halla a 3,6 km del paseo marítimo de Valencia y de la playa más cercana. En la esquina del Eurostars Rey Don Jaime hay una parada de autobús local (línea 19) que proporciona conexiones con la playa y con el centro de la ciudad."
Best Valencia Beach Flat Historic Area next to the Beach,"8,1",a 4 km del centro,,€ 566,https://www.booking.com/hotel/es/best-valencia-beach-flat-historic-area-next-to-the-beach.es.html?label=gen173nr-1FCAEoggI46AdIClgEaEaIAQGYAQq4ARfIAQ_YAQHoAQH4AQKIAgGoAgO4AvWhzq0GwAIB0gIkYTQ3OGY1ZmUtNzVlOS00NmIxLTg5MjQtOWUzNDhhNDhhZWFi2AIF4AIB&aid=304142&ucfs=1&arphpl=1&checkin=2024-02-25&checkout=2024-03-01&dest_id=-406131&dest_type=city&group_adults=2&req_adults=2&no_rooms=1&group_children=0&req_children=0&hpos=10&hapos=10&sr_order=popularity&srpvid=20ce4d8e43b40332&srepoch=1706266911&all_sr_blocks=845470402_351514851_2_0_0&highlighted_blocks=845470402_351514851_2_0_0&matching_block_id=845470402_351514851_2_0_0&sr_pri_blocks=845470402_351514851_2_0_0__56550&from_sustainable_property_sr=1&from=searchresults#hotelTmpl,4 de 5,"Best Valencia Beach Flat Historic Area next to the Beach está en Valencia, cerca de Playa de las Arenas, Playa de la Malvarrosa, y Playa de Patacona. Dispone de wifi gratis y terraza.

El alojamiento tiene aire acondicionado, cocina totalmente equipada y con zona de comedor, TV de pantalla plana y baño privado con ducha y secador de pelo. También hay nevera, microondas y fogones, además de cafetera y hervidor.

El apartamento ofrece servicio de alquiler de coches.

Puerto de Valencia está a 17 min a pie del alojamiento, y Jardín del Turia está a 4,2 km. El aeropuerto más cercano (Aeropuerto de Valencia) está a 13 km."
Ilunion Aqua 4,"8,2",a 3 km del centro,,€ 659,https://www.booking.com/hotel/es/confprtel-aqua-4.es.html?label=gen173nr-1FCAEoggI46AdIClgEaEaIAQGYAQq4ARfIAQ_YAQHoAQH4AQKIAgGoAgO4AvWhzq0GwAIB0gIkYTQ3OGY1ZmUtNzVlOS00NmIxLTg5MjQtOWUzNDhhNDhhZWFi2AIF4AIB&aid=304142&ucfs=1&arphpl=1&checkin=2024-02-25&checkout=2024-03-01&dest_id=-406131&dest_type=city&group_adults=2&req_adults=2&no_rooms=1&group_children=0&req_children=0&hpos=11&hapos=11&sr_order=popularity&srpvid=20ce4d8e43b40332&srepoch=1706266911&all_sr_blocks=9277701_117386364_0_2_0&highlighted_blocks=9277701_117386364_0_2_0&matching_block_id=9277701_117386364_0_2_0&sr_pri_blocks=9277701_117386364_0_2_0__65920&from_sustainable_property_sr=1&from=searchresults#hotelTmpl,1 de 5,"Este hotel de diseño está bien ubicado en Valencia, frente al Oceanogràfic y a la impresionante Ciudad de las Artes y las Ciencias. Hay wifi gratuita en todas las zonas.

Las habitaciones del Ilunion Aqua 4 presentan una decoración elegante en estilo moderno con colores cálidos y constan de suelo de madera y aire acondicionado. Incluyen escritorio grande, caja fuerte, minibar y TV de pantalla plana con canales vía satélite. Algunas habitaciones disfrutan de vistas panorámicas a la Ciudad de las Artes y las Ciencias. El baño presenta acabados de mármol y cuenta con secador de pelo y artículos de aseo gratuitos.

Por las mañanas se ofrece un desayuno variado. El establecimiento también sirve menús del día y a la carta para el almuerzo y la cena. Además, cuenta con productos especiales para celíacos y otras intolerancias alimentarias. El servicio de habitaciones está disponible en horario limitado.

Por su parte, el centro comercial Aqua Multiespacio alberga numerosas tiendas, un spa y un centro de fitness.

El Ilunion Aqua 4 está situado a 2 km del centro de Valencia y a 1 km del puerto. A 50 metros hay una parada de autobús que ofrece conexiones con el centro de la ciudad. Asimismo, el hotel se encuentra a pocos minutos en coche de las playas de la Malvarrosa y Las Arenas. El establecimiento también se halla a 20 minutos en coche del aeropuerto de Manises. Los huéspedes disfrutan de descuentos en el aparcamiento del centro comercial Aqua Multiespacio.

Este hotel está adaptado para personas con movilidad reducida y cuenta con la certificación oficial. Las habitaciones accesibles están disponibles bajo petición (también para personas con discapacidad auditiva o visual)."
Silken Puerta Valencia,"9,2","a 1,8 km del centro",,€ 839,https://www.booking.com/hotel/es/puertavalencia.es.html?label=gen173nr-1FCAEoggI46AdIClgEaEaIAQGYAQq4ARfIAQ_YAQHoAQH4AQKIAgGoAgO4AvWhzq0GwAIB0gIkYTQ3OGY1ZmUtNzVlOS00NmIxLTg5MjQtOWUzNDhhNDhhZWFi2AIF4AIB&aid=304142&ucfs=1&arphpl=1&checkin=2024-02-25&checkout=2024-03-01&dest_id=-406131&dest_type=city&group_adults=2&req_adults=2&no_rooms=1&group_children=0&req_children=0&hpos=12&hapos=12&sr_order=popularity&srpvid=20ce4d8e43b40332&srepoch=1706266911&all_sr_blocks=9118202_361373467_0_34_0&highlighted_blocks=9118202_361373467_0_34_0&matching_block_id=9118202_361373467_0_34_0&sr_pri_blocks=9118202_361373467_0_34_0__83900&from_sustainable_property_sr=1&from=searchresults#hotelTmpl,4 de 5,"El Silken Puerta Valencia se encuentra a 5 minutos a pie del estadio de Mestalla y a 15 minutos a pie de la Ciudad de las Artes y las Ciencias. Cuenta con conexión Wi-Fi gratuita y alberga un restaurante a la carta.

El Puerta Valencia, diseñado por Javier Mariscal, presenta un estilo elegante y contemporáneo. Las habitaciones son amplias y tienen aire acondicionado, suelo de parqué, TV vía satélite y escritorio.

El restaurante Puerta Valencia sirve una amplia variedad de platos mediterráneos y está especializado en arroces. También hay un bar que sirve tapas y cócteles por la noche.

El hotel cuenta con un aparcamiento amplio, disponible por un suplemento. La estación de metro más cercana es Aragón, situada a unos 400 metros. Desde allí podrá llegar en solo 10 minutos al casco antiguo y la catedral de la ciudad. La playa está a poco más de 2 km del Silken."
Hostal Antigua Morellana,"8,9","a 0,5 km del centro",,€ 705,https://www.booking.com/hotel/es/hostal-antigua-morellana.es.html?label=gen173nr-1FCAEoggI46AdIClgEaEaIAQGYAQq4ARfIAQ_YAQHoAQH4AQKIAgGoAgO4AvWhzq0GwAIB0gIkYTQ3OGY1ZmUtNzVlOS00NmIxLTg5MjQtOWUzNDhhNDhhZWFi2AIF4AIB&aid=304142&ucfs=1&arphpl=1&checkin=2024-02-25&checkout=2024-03-01&dest_id=-406131&dest_type=city&group_adults=2&req_adults=2&no_rooms=1&group_children=0&req_children=0&hpos=13&hapos=13&sr_order=popularity&srpvid=20ce4d8e43b40332&srepoch=1706266911&all_sr_blocks=127393702_184465133_0_0_0&highlighted_blocks=127393702_184465133_0_0_0&matching_block_id=127393702_184465133_0_0_0&sr_pri_blocks=127393702_184465133_0_0_0__70500&from=searchresults#hotelTmpl,4 de 5,"El Hostal Antigua Morellana está situado en el centro histórico de Valencia, a solo 3 minutos a pie de la catedral de Valencia, y ofrece conexión WiFi gratuita y recepción abierta las 24 horas. La Ciudad de las Artes y las Ciencias se encuentra a 3 km.

Las habitaciones disponen de TV vía satélite, aire acondicionado, escritorio y baño privado con secador de pelo y ducha. Además, hay una zona de TV compartida.

El Hostal Antigua Morellana proporciona servicio de información turística, consigna de equipaje gratuita y servicio de venta de entradas.

La estación Joaquín Sorolla está a 20 minutos a pie del Hostal Antigua Morellana y la playa de la Malvarrosa, a 8 km. El aeropuerto de Valencia se encuentra a 15 minutos en coche."
