Hotels,Ratings,Distance,District,Price,Link,Star,Descriptions
Maritime House Valencia Beach,"9,6","a 3,8 km del centro",,€ 1.313,https://www.booking.com/hotel/es/house-with-terrace-close-to-the-beach.es.html?label=gen173nr-1FCAEoggI46AdIClgEaEaIAQGYAQq4ARfIAQ_YAQHoAQH4AQKIAgGoAgO4AvWhzq0GwAIB0gIkYTQ3OGY1ZmUtNzVlOS00NmIxLTg5MjQtOWUzNDhhNDhhZWFi2AIF4AIB&aid=304142&ucfs=1&arphpl=1&checkin=2024-02-25&checkout=2024-03-01&dest_id=-406131&dest_type=city&group_adults=2&req_adults=2&no_rooms=1&group_children=0&req_children=0&hpos=9&hapos=109&sr_order=popularity&srpvid=20ce4d8e43b40332&srepoch=1706266966&all_sr_blocks=982578101_370538425_5_2_0&highlighted_blocks=982578101_370538425_5_2_0&matching_block_id=982578101_370538425_5_2_0&sr_pri_blocks=982578101_370538425_5_2_0__131277&from_sustainable_property_sr=1&from=searchresults#hotelTmpl,3 de 5,"Maritime House Valencia Beach está en Valencia, a menos de 1 km de Playa de las Arenas, y ofrece alojamiento con salón de uso común, wifi gratis, cocina compartida y recepción 24 horas. La casa o chalet, que tiene terraza, está en una zona en la que se pueden practicar actividades como senderismo, pesca y ciclismo.

Esta casa o chalet ofrece acceso directo a un balcón y cuenta con 3 dormitorios. La casa o chalet tiene aire acondicionado y también dispone de TV de pantalla plana, cocina totalmente equipada con nevera, zona de estar, lavadora y 2 baños con bidet, ducha y bañera.

La casa o chalet ofrece servicio de alquiler de bicicletas.

Cerca del alojamiento hay puntos de interés como Playa de la Malvarrosa, Playa de Patacona y Puerto de Valencia. El aeropuerto (Aeropuerto de Valencia) está a 12 km."
Serrano Park,"7,3",a 1 km del centro,,€ 377,https://www.booking.com/hotel/es/serrano-park.es.html?label=gen173nr-1FCAEoggI46AdIClgEaEaIAQGYAQq4ARfIAQ_YAQHoAQH4AQKIAgGoAgO4AvWhzq0GwAIB0gIkYTQ3OGY1ZmUtNzVlOS00NmIxLTg5MjQtOWUzNDhhNDhhZWFi2AIF4AIB&aid=304142&ucfs=1&arphpl=1&checkin=2024-02-25&checkout=2024-03-01&dest_id=-406131&dest_type=city&group_adults=2&req_adults=2&no_rooms=1&group_children=0&req_children=0&hpos=10&hapos=110&sr_order=popularity&srpvid=20ce4d8e43b40332&srepoch=1706266966&all_sr_blocks=660727702_351726050_2_0_0&highlighted_blocks=660727702_351726050_2_0_0&matching_block_id=660727702_351726050_2_0_0&sr_pri_blocks=660727702_351726050_2_0_0__37710&from=searchresults#hotelTmpl,4 de 5,"Serrano Park ofrece wifi gratis y se encuentra en el centro de Valencia, a 3 min a pie de Basílica de la Virgen de los Desamparados y a menos de 1 km de Jardines de Monforte. Este apartamento está a 9 min a pie de Church of Saint Nicolás y a 4,5 km de Puerto de Valencia.

Este apartamento con aire acondicionado consta de 1 dormitorio, una sala de estar, una zona de cocina totalmente equipada con microondas y 1 baño con bañera o ducha y secador de pelo. Se ofrece TV de pantalla plana.

Cerca del alojamiento hay puntos de interés como Jardín del Turia, Museo Nacional de Cerámica y Artes Santuarias González Martí y Estación de tren del Norte. El aeropuerto más cercano (Aeropuerto de Valencia) está a 10 km del alojamiento."
Apartamentos Plaza Picasso,"8,7",a 2 km del centro,,€ 626,https://www.booking.com/hotel/es/apartamentos-plaza-picasso.es.html?label=gen173nr-1FCAEoggI46AdIClgEaEaIAQGYAQq4ARfIAQ_YAQHoAQH4AQKIAgGoAgO4AvWhzq0GwAIB0gIkYTQ3OGY1ZmUtNzVlOS00NmIxLTg5MjQtOWUzNDhhNDhhZWFi2AIF4AIB&aid=304142&ucfs=1&arphpl=1&checkin=2024-02-25&checkout=2024-03-01&dest_id=-406131&dest_type=city&group_adults=2&req_adults=2&no_rooms=1&group_children=0&req_children=0&hpos=11&hapos=111&sr_order=popularity&srpvid=20ce4d8e43b40332&srepoch=1706266966&all_sr_blocks=9706301_338443199_2_2_0&highlighted_blocks=9706301_338443199_2_2_0&matching_block_id=9706301_338443199_2_2_0&sr_pri_blocks=9706301_338443199_2_2_0__62550&from=searchresults#hotelTmpl,3 de 5,"Estos apartamentos están situados en Valencia, junto al antiguo cauce del río Turia, ahora convertido en exuberantes jardines. Además, el establecimiento queda a 500 metros del zoológico Bioparc.

Estos modernos apartamentos son todos exteriores y están totalmente equipados. Ofrecen una ubicación ideal, a solo 5 minutos de las estaciones de metro y autobús.

La limpieza de los apartamentos se realiza cada 3 días e incluye el cambio de ropa de cama y toallas. Hay servicio de limpieza diario por un suplemento."
YOU & CO. Quart Boutique,"8,6",a 1 km del centro,,€ 840,https://www.booking.com/hotel/es/you-amp-co-quart-boutique.es.html?label=gen173nr-1FCAEoggI46AdIClgEaEaIAQGYAQq4ARfIAQ_YAQHoAQH4AQKIAgGoAgO4AvWhzq0GwAIB0gIkYTQ3OGY1ZmUtNzVlOS00NmIxLTg5MjQtOWUzNDhhNDhhZWFi2AIF4AIB&aid=304142&ucfs=1&arphpl=1&checkin=2024-02-25&checkout=2024-03-01&dest_id=-406131&dest_type=city&group_adults=2&req_adults=2&no_rooms=1&group_children=0&req_children=0&hpos=12&hapos=112&sr_order=popularity&srpvid=20ce4d8e43b40332&srepoch=1706266966&all_sr_blocks=521359802_279603622_0_2_0&highlighted_blocks=521359802_279603622_0_2_0&matching_block_id=521359802_279603622_0_2_0&sr_pri_blocks=521359802_279603622_0_2_0__84000&from_sustainable_property_sr=1&from=searchresults#hotelTmpl,4 de 5,"YOU & CO. Quart Boutique está en Valencia, a menos de 1 km de Church of Saint Nicolás, y dispone de servicio de conserjería, habitaciones libres de humo, restaurante, wifi gratis en todo el alojamiento y bar. Este hotel de 3 estrellas ofrece mostrador de información turística y guardaequipaje. Se ofrece parking privado por un suplemento.

El hotel ofrece habitaciones con aire acondicionado, escritorio, hervidor, nevera, caja fuerte, TV de pantalla plana y baño privado con ducha. En YOU & CO. Quart Boutique, las habitaciones disponen de ropa de cama y toallas.

En la recepción 24 horas se habla inglés, español y italiano, y el personal estará encantado de ayudar en cualquier momento.

Cerca del alojamiento hay puntos de interés como Estación de tren del Norte, Basílica de la Virgen de los Desamparados y Museo Nacional de Cerámica y Artes Santuarias González Martí. El aeropuerto (Aeropuerto de Valencia) está a 7 km."
Brand New Apartment With Super Comfortable Beds,"8,9","a 1,7 km del centro",,€ 817,https://www.booking.com/hotel/es/brand-new-apartment-with-super-comfortable-beds.es.html?label=gen173nr-1FCAEoggI46AdIClgEaEaIAQGYAQq4ARfIAQ_YAQHoAQH4AQKIAgGoAgO4AvWhzq0GwAIB0gIkYTQ3OGY1ZmUtNzVlOS00NmIxLTg5MjQtOWUzNDhhNDhhZWFi2AIF4AIB&aid=304142&ucfs=1&arphpl=1&checkin=2024-02-25&checkout=2024-03-01&dest_id=-406131&dest_type=city&group_adults=2&req_adults=2&no_rooms=1&group_children=0&req_children=0&hpos=13&hapos=113&sr_order=popularity&srpvid=20ce4d8e43b40332&srepoch=1706266966&all_sr_blocks=835656902_355947017_2_0_0&highlighted_blocks=835656902_355947017_2_0_0&matching_block_id=835656902_355947017_2_0_0&sr_pri_blocks=835656902_355947017_2_0_0__81660&from=searchresults#hotelTmpl,3 de 5,"Brand New Apartment With Super Comfortable Beds se encuentra en el barrio de Jesús, en Valencia, a 1,8 km de Estación de tren del Norte y a 3,7 km de Church of Saint Nicolás, y ofrece alojamiento equipado con balcón y wifi gratis. Este apartamento está a 4,2 km de Jardín del Turia y a 4,3 km de Museo Nacional de Cerámica y Artes Santuarias González Martí.

Este apartamento con aire acondicionado consta de 3 dormitorios, una sala de estar, una cocina totalmente equipada con nevera y cafetera, y 2 baños con bidet y ducha. Hay toallas y ropa de cama en el apartamento.

Basílica de la Virgen de los Desamparados está a 4,4 km del alojamiento, y Bioparc Valencia está a 4,5 km. El aeropuerto más cercano (Aeropuerto de Valencia) está a 8 km del alojamiento."
Style Apartments Cabanyal Marina Beach,"7,6",a 4 km del centro,,€ 729,https://www.booking.com/hotel/es/style-apartments-cabanyal-marina-beach.es.html?label=gen173nr-1FCAEoggI46AdIClgEaEaIAQGYAQq4ARfIAQ_YAQHoAQH4AQKIAgGoAgO4AvWhzq0GwAIB0gIkYTQ3OGY1ZmUtNzVlOS00NmIxLTg5MjQtOWUzNDhhNDhhZWFi2AIF4AIB&aid=304142&ucfs=1&arphpl=1&checkin=2024-02-25&checkout=2024-03-01&dest_id=-406131&dest_type=city&group_adults=2&req_adults=2&no_rooms=1&group_children=0&req_children=0&hpos=14&hapos=114&sr_order=popularity&srpvid=20ce4d8e43b40332&srepoch=1706266966&all_sr_blocks=502464102_347564493_4_0_0&highlighted_blocks=502464102_347564493_4_0_0&matching_block_id=502464102_347564493_4_0_0&sr_pri_blocks=502464102_347564493_4_0_0__72900&from_sustainable_property_sr=1&from=searchresults#hotelTmpl,4 de 5,"Style Apartments Cabanyal Marina Beach ofrece alojamiento con aire acondicionado en Valencia, a 8 min a pie de Playa de las Arenas, a menos de 1 km de Playa de la Malvarrosa y a 1,8 km de Playa de Patacona. Se ofrece wifi gratis en todo el alojamiento y parking privado en el propio alojamiento.

Cada unidad cuenta con cocina totalmente equipada con mesa de comedor, TV de pantalla plana con canales vía satélite y baño privado con ducha, artículos de aseo gratuitos y secador de pelo. También hay nevera, horno y microondas, además de cafetera y hervidor.

El apartamento ofrece servicio de alquiler de bicicletas.

Puerto de Valencia está a 1,7 km del alojamiento, y Jardín del Turia está a 4,2 km. El aeropuerto más cercano (Aeropuerto de Valencia) está a 13 km del alojamiento."
Amazinn Places EVIapartments,"8,6",a 450 m del centro,,€ 625,https://www.booking.com/hotel/es/1548-evi-apartments.es.html?label=gen173nr-1FCAEoggI46AdIClgEaEaIAQGYAQq4ARfIAQ_YAQHoAQH4AQKIAgGoAgO4AvWhzq0GwAIB0gIkYTQ3OGY1ZmUtNzVlOS00NmIxLTg5MjQtOWUzNDhhNDhhZWFi2AIF4AIB&aid=304142&ucfs=1&arphpl=1&checkin=2024-02-25&checkout=2024-03-01&dest_id=-406131&dest_type=city&group_adults=2&req_adults=2&no_rooms=1&group_children=0&req_children=0&hpos=15&hapos=115&sr_order=popularity&srpvid=20ce4d8e43b40332&srepoch=1706266966&all_sr_blocks=583593503_227841892_2_0_0&highlighted_blocks=583593503_227841892_2_0_0&matching_block_id=583593503_227841892_2_0_0&sr_pri_blocks=583593503_227841892_2_0_0__62549&from=searchresults#hotelTmpl,3 de 5,"Amazinn Places EVIapartments se encuentra a 14 min a pie de Church of Saint Nicolás, en Valencia, y ofrece alojamiento con aire acondicionado y wifi gratis.

El apartamento ofrece balcón, vistas a la ciudad, zona de estar, TV de pantalla plana, cocina totalmente equipada con nevera y horno, y baño privado con ducha y secador de pelo. También se ofrece microondas, además de cafetera y hervidor.

Cerca del alojamiento hay puntos de interés como Estación de tren del Norte, Jardín del Turia y Museo Nacional de Cerámica y Artes Santuarias González Martí. El aeropuerto (Aeropuerto de Valencia) está a 8 km, y el alojamiento ofrece servicio de traslado de pago para ir o volver del aeropuerto."
MD Julio Antonio Apartment Center,"7,7","a 0,5 km del centro",,€ 1.039,https://www.booking.com/hotel/es/md-julio-antonio-apartment-center.es.html?label=gen173nr-1FCAEoggI46AdIClgEaEaIAQGYAQq4ARfIAQ_YAQHoAQH4AQKIAgGoAgO4AvWhzq0GwAIB0gIkYTQ3OGY1ZmUtNzVlOS00NmIxLTg5MjQtOWUzNDhhNDhhZWFi2AIF4AIB&aid=304142&ucfs=1&arphpl=1&checkin=2024-02-25&checkout=2024-03-01&dest_id=-406131&dest_type=city&group_adults=2&req_adults=2&no_rooms=1&group_children=0&req_children=0&hpos=16&hapos=116&sr_order=popularity&srpvid=20ce4d8e43b40332&srepoch=1706266966&all_sr_blocks=396104901_125267246_0_0_0&highlighted_blocks=396104901_125267246_0_0_0&matching_block_id=396104901_125267246_0_0_0&sr_pri_blocks=396104901_125267246_0_0_0__103860&from_sustainable_property_sr=1&from=searchresults#hotelTmpl,4 de 5,"MD Julio Antonio Apartment Center, que tiene vistas a la ciudad, dispone de alojamiento con terraza y hervidor a unos 16 min a pie de Church of Saint Nicolás. El alojamiento, que dispone de balcón y wifi gratis, se construyó en 1920.

Este apartamento con aire acondicionado consta de 2 dormitorios, una sala de estar, una cocina totalmente equipada con nevera y cafetera, y 2 baños con ducha y artículos de aseo gratuitos. Hay toallas y ropa de cama en el apartamento.

Cerca del alojamiento hay puntos de interés como Estación de tren del Norte, Jardín del Turia y Museo Nacional de Cerámica y Artes Santuarias González Martí. El aeropuerto (Aeropuerto de Valencia) está a 8 km."
Victoria Site-Luxury Center,"8,8",a 200 m del centro,,€ 1.558,https://www.booking.com/hotel/es/victoria-site-centro-historico.es.html?label=gen173nr-1FCAEoggI46AdIClgEaEaIAQGYAQq4ARfIAQ_YAQHoAQH4AQKIAgGoAgO4AvWhzq0GwAIB0gIkYTQ3OGY1ZmUtNzVlOS00NmIxLTg5MjQtOWUzNDhhNDhhZWFi2AIF4AIB&aid=304142&ucfs=1&arphpl=1&checkin=2024-02-25&checkout=2024-03-01&dest_id=-406131&dest_type=city&group_adults=2&req_adults=2&no_rooms=1&group_children=0&req_children=0&hpos=17&hapos=117&sr_order=popularity&srpvid=20ce4d8e43b40332&srepoch=1706266966&all_sr_blocks=175649304_361774694_2_0_0&highlighted_blocks=175649304_361774694_2_0_0&matching_block_id=175649304_361774694_2_0_0&sr_pri_blocks=175649304_361774694_2_0_0__155750&from=searchresults#hotelTmpl,4 de 5,"El Victoria Site-Luxury Center ofrece alojamiento en Valencia, a 700 metros del barrio del Carmen y a 2,6 km de la Ciudad de las Artes y las Ciencias. El Bioparc Valencia está a 2,9 km. Hay WiFi gratuita en todas las instalaciones.

La cocina está equipada con microondas, tostadora y cafetera. Hay TV de pantalla plana.

El Victoria Site-Luxury Center se encuentra a 3,3 km del Oceanogràfic y a 4,2 km del puerto de Valencia. El aeropuerto de Valencia está a 9 km."
Modern Penthouse with Private Terrace,"8,5","a 1,7 km del centro",,€ 949,https://www.booking.com/hotel/es/modern-penthouse-with-private-terrace-valencia-valencia.es.html?label=gen173nr-1FCAEoggI46AdIClgEaEaIAQGYAQq4ARfIAQ_YAQHoAQH4AQKIAgGoAgO4AvWhzq0GwAIB0gIkYTQ3OGY1ZmUtNzVlOS00NmIxLTg5MjQtOWUzNDhhNDhhZWFi2AIF4AIB&aid=304142&ucfs=1&arphpl=1&checkin=2024-02-25&checkout=2024-03-01&dest_id=-406131&dest_type=city&group_adults=2&req_adults=2&no_rooms=1&group_children=0&req_children=0&hpos=18&hapos=118&sr_order=popularity&srpvid=20ce4d8e43b40332&srepoch=1706266966&all_sr_blocks=831204702_348290207_2_0_0&highlighted_blocks=831204702_348290207_2_0_0&matching_block_id=831204702_348290207_2_0_0&sr_pri_blocks=831204702_348290207_2_0_0__94900&from=searchresults#hotelTmpl,4 de 5,"Modern Penthouse with Private Terrace se encuentra en el barrio de Jesús, en Valencia, cerca de Estación de tren del Norte. Dispone de terraza, wifi gratis y lavadora. Este apartamento está a 3,7 km de Church of Saint Nicolás y a 4,2 km de Jardín del Turia.

Este apartamento con aire acondicionado se compone de 3 dormitorios y 2 baños con bidet, ducha y secador de pelo. La cocina está equipada con nevera, lavavajillas y horno, además de cafetera y hervidor.

Museo Nacional de Cerámica y Artes Santuarias González Martí está a 4,3 km del alojamiento, y Basílica de la Virgen de los Desamparados está a 4,4 km. El aeropuerto más cercano (Aeropuerto de Valencia) está a 8 km."
Hostal Blayet,"8,0","a 19,1 km del centro",,€ 279,https://www.booking.com/hotel/es/hostal-blayet.es.html?label=gen173nr-1FCAEoggI46AdIClgEaEaIAQGYAQq4ARfIAQ_YAQHoAQH4AQKIAgGoAgO4AvWhzq0GwAIB0gIkYTQ3OGY1ZmUtNzVlOS00NmIxLTg5MjQtOWUzNDhhNDhhZWFi2AIF4AIB&aid=304142&ucfs=1&arphpl=1&checkin=2024-02-25&checkout=2024-03-01&dest_id=-406131&dest_type=city&group_adults=2&req_adults=2&no_rooms=1&group_children=0&req_children=0&hpos=19&hapos=119&sr_order=popularity&srpvid=20ce4d8e43b40332&srepoch=1706266966&all_sr_blocks=1024357104_382678901_2_0_0&highlighted_blocks=1024357104_382678901_2_0_0&matching_block_id=1024357104_382678901_2_0_0&sr_pri_blocks=1024357104_382678901_2_0_0__27860&from_sustainable_property_sr=1&from=searchresults#hotelTmpl,4 de 5,"Hostal Blayet se encuentra en Valencia, a 2 min a pie de Playa La Devesa, y ofrece alojamiento con jardín, parking privado gratis y terraza. El alojamiento está a unos 4 min a pie de Playa Recatí, a 19 km de Oceanográfico y a 19 km de Puerto de Valencia. El hostal o pensión libre de humo cuenta con wifi gratis en todo el alojamiento.

En el hostal o pensión, todas las habitaciones disponen de escritorio. Las habitaciones del alojamiento tienen baño privado con ducha y artículos de aseo gratuitos, además de TV de pantalla plana y aire acondicionado. Algunas habitaciones están equipadas con patio. En Hostal Blayet, cada habitación está equipada con ropa de cama y toallas.

El alojamiento ofrece zona de juegos infantil. En los alrededores se pueden practicar actividades como senderismo, snorkel y ciclismo, o disfrutar de un momento de relax frente a la playa.

Jardín del Turia está a 21 km del alojamiento, y Jardines de Monforte está a 21 km. El aeropuerto más cercano (Aeropuerto de Valencia) está a 28 km del alojamiento."
Garden Turia Downtown,"9,0","a 0,9 km del centro",,€ 1.063,https://www.booking.com/hotel/es/garden-turia-valencia.es.html?label=gen173nr-1FCAEoggI46AdIClgEaEaIAQGYAQq4ARfIAQ_YAQHoAQH4AQKIAgGoAgO4AvWhzq0GwAIB0gIkYTQ3OGY1ZmUtNzVlOS00NmIxLTg5MjQtOWUzNDhhNDhhZWFi2AIF4AIB&aid=304142&ucfs=1&arphpl=1&checkin=2024-02-25&checkout=2024-03-01&dest_id=-406131&dest_type=city&group_adults=2&req_adults=2&no_rooms=1&group_children=0&req_children=0&hpos=20&hapos=120&sr_order=popularity&srpvid=20ce4d8e43b40332&srepoch=1706266966&all_sr_blocks=520120001_343519150_4_0_0&highlighted_blocks=520120001_343519150_4_0_0&matching_block_id=520120001_343519150_4_0_0&sr_pri_blocks=520120001_343519150_4_0_0__106250&from=searchresults#hotelTmpl,4 de 5,"El Garden Turia Downtown está situado en Valencia, a 100 metros de los jardines del Turia y a 1,2 km de los jardines de Monforte. Ofrece conexión Wi-Fi gratuita y aire acondicionado. El apartamento cuenta con aparcamiento privado y está a 1,2 km del Museo Nacional de Cerámica y Artes Decorativas González Martí.

El apartamento tiene 3 dormitorios, TV de pantalla plana, cocina equipada con microondas y nevera, lavadora y 1 baño con ducha.

El Garden Turia Downtown también ofrece servicio de alquiler de bicicletas.

El mercado central de Valencia se encuentra a 1,8 km del alojamiento, mientras que la Ciudad de las Artes y las Ciencias está a 2,1 km. El aeropuerto más cercano es el aeropuerto de Valencia, a 12 km del Garden Turia Downtown."
Loft de diseño cerca del mar,"9,5","a 3,9 km del centro",,€ 1.408,https://www.booking.com/hotel/es/loft-con-encanto-cerca-del-mar.es.html?label=gen173nr-1FCAEoggI46AdIClgEaEaIAQGYAQq4ARfIAQ_YAQHoAQH4AQKIAgGoAgO4AvWhzq0GwAIB0gIkYTQ3OGY1ZmUtNzVlOS00NmIxLTg5MjQtOWUzNDhhNDhhZWFi2AIF4AIB&aid=304142&ucfs=1&arphpl=1&checkin=2024-02-25&checkout=2024-03-01&dest_id=-406131&dest_type=city&group_adults=2&req_adults=2&no_rooms=1&group_children=0&req_children=0&hpos=21&hapos=121&sr_order=popularity&srpvid=20ce4d8e43b40332&srepoch=1706266966&all_sr_blocks=866554801_386840130_4_0_0&highlighted_blocks=866554801_386840130_4_0_0&matching_block_id=866554801_386840130_4_0_0&sr_pri_blocks=866554801_386840130_4_0_0__140750&from=searchresults#hotelTmpl,4 de 5,"Loft de diseño cerca del mar, que cuenta con vistas a la ciudad, ofrece alojamiento con terraza y balcón a unos 9 min a pie de Playa de las Arenas. El alojamiento está a 15 min a pie de Playa de la Malvarrosa y dispone de wifi gratis en todo el alojamiento.

Este apartamento con aire acondicionado consta de 3 dormitorios, una sala de estar, una cocina totalmente equipada con nevera y cafetera, y 2 baños con ducha y secador de pelo. Hay toallas y ropa de cama en el apartamento.

Playa de Patacona está a 2,2 km del alojamiento, y Puerto de Valencia está a 15 min a pie. El aeropuerto más cercano (Aeropuerto de Valencia) está a 13 km del alojamiento."
"BRAND NEW, Modern & Stylish Apartment","8,5","a 1,7 km del centro",,€ 817,https://www.booking.com/hotel/es/brand-new-modern-stylish-apartment.es.html?label=gen173nr-1FCAEoggI46AdIClgEaEaIAQGYAQq4ARfIAQ_YAQHoAQH4AQKIAgGoAgO4AvWhzq0GwAIB0gIkYTQ3OGY1ZmUtNzVlOS00NmIxLTg5MjQtOWUzNDhhNDhhZWFi2AIF4AIB&aid=304142&ucfs=1&arphpl=1&checkin=2024-02-25&checkout=2024-03-01&dest_id=-406131&dest_type=city&group_adults=2&req_adults=2&no_rooms=1&group_children=0&req_children=0&hpos=22&hapos=122&sr_order=popularity&srpvid=20ce4d8e43b40332&srepoch=1706266966&all_sr_blocks=835620702_348987698_2_0_0&highlighted_blocks=835620702_348987698_2_0_0&matching_block_id=835620702_348987698_2_0_0&sr_pri_blocks=835620702_348987698_2_0_0__81660&from=searchresults#hotelTmpl,4 de 5,"BRAND NEW, Modern & Stylish Apartment está en el barrio de Jesús, en Valencia, a 1,8 km de Estación de tren del Norte y a 3,7 km de Church of Saint Nicolás, y ofrece alojamiento equipado con balcón y wifi gratis. Este apartamento está a 4,2 km de Jardín del Turia y a 4,3 km de Museo Nacional de Cerámica y Artes Santuarias González Martí.

Este apartamento con aire acondicionado consta de 3 dormitorios, una sala de estar, una cocina totalmente equipada con nevera y cafetera, y 2 baños con bidet y ducha. Hay toallas y ropa de cama en el apartamento.

Basílica de la Virgen de los Desamparados está a 4,4 km del alojamiento, y Bioparc Valencia está a 4,5 km. El aeropuerto (Aeropuerto de Valencia) está a 8 km."
Singularstays Ruzafa Terrace,"8,1","a 0,8 km del centro",,€ 1.157,https://www.booking.com/hotel/es/singularstays-clero.es.html?label=gen173nr-1FCAEoggI46AdIClgEaEaIAQGYAQq4ARfIAQ_YAQHoAQH4AQKIAgGoAgO4AvWhzq0GwAIB0gIkYTQ3OGY1ZmUtNzVlOS00NmIxLTg5MjQtOWUzNDhhNDhhZWFi2AIF4AIB&aid=304142&ucfs=1&arphpl=1&checkin=2024-02-25&checkout=2024-03-01&dest_id=-406131&dest_type=city&group_adults=2&req_adults=2&no_rooms=1&group_children=0&req_children=0&hpos=23&hapos=123&sr_order=popularity&srpvid=20ce4d8e43b40332&srepoch=1706266966&all_sr_blocks=538978901_369961869_3_0_0&highlighted_blocks=538978901_369961869_3_0_0&matching_block_id=538978901_369961869_3_0_0&sr_pri_blocks=538978901_369961869_3_0_0__115668&from=searchresults#hotelTmpl,4 de 5,"Singularstays Ruzafa Terrace se encuentra en el barrio de Eixample, en Valencia, cerca de Estación de tren del Norte. Tiene terraza, wifi gratis y lavadora. Este apartamento ofrece alojamiento con balcón.

Este apartamento con aire acondicionado consta de 2 dormitorios, una sala de estar, una cocina totalmente equipada con nevera y cafetera, y 2 baños con bañera o ducha y secador de pelo. Hay TV de pantalla plana.

Cerca del alojamiento hay puntos de interés como Jardín del Turia, Museo Nacional de Cerámica y Artes Santuarias González Martí y Basílica de la Virgen de los Desamparados. El aeropuerto (Aeropuerto de Valencia) está a 9 km, y el alojamiento ofrece servicio de traslado de pago para ir o volver del aeropuerto."
apartamento las torres-botanico,"8,1","a 0,9 km del centro",,€ 608,https://www.booking.com/hotel/es/apartamento-las-torres-botanico.es.html?label=gen173nr-1FCAEoggI46AdIClgEaEaIAQGYAQq4ARfIAQ_YAQHoAQH4AQKIAgGoAgO4AvWhzq0GwAIB0gIkYTQ3OGY1ZmUtNzVlOS00NmIxLTg5MjQtOWUzNDhhNDhhZWFi2AIF4AIB&aid=304142&ucfs=1&arphpl=1&checkin=2024-02-25&checkout=2024-03-01&dest_id=-406131&dest_type=city&group_adults=2&req_adults=2&no_rooms=1&group_children=0&req_children=0&hpos=24&hapos=124&sr_order=popularity&srpvid=20ce4d8e43b40332&srepoch=1706266966&all_sr_blocks=469409001_357050275_2_0_0&highlighted_blocks=469409001_357050275_2_0_0&matching_block_id=469409001_357050275_2_0_0&sr_pri_blocks=469409001_357050275_2_0_0__60750&from=searchresults#hotelTmpl,4 de 5,"Apartamento las torres-botanico, que tiene vistas a la ciudad, dispone de alojamiento con terraza y hervidor a unos 8 min a pie de Church of Saint Nicolás. Este apartamento ofrece alojamiento con balcón y wifi gratis.

Este apartamento con aire acondicionado consta de 2 dormitorios, una sala de estar, una cocina totalmente equipada con nevera y cafetera, y 1 baño con bidet y ducha. Hay toallas y ropa de cama en el apartamento.

Cerca del alojamiento hay puntos de interés como Basílica de la Virgen de los Desamparados, Jardín del Turia y Museo Nacional de Cerámica y Artes Santuarias González Martí. El aeropuerto más cercano (Aeropuerto de Valencia) está a 8 km del alojamiento, que ofrece servicio de traslado de pago para ir o volver del aeropuerto."
Hi Valencia Canovas,"7,7","a 0,9 km del centro",,€ 399,https://www.booking.com/hotel/es/b-b-hivalencia.es.html?label=gen173nr-1FCAEoggI46AdIClgEaEaIAQGYAQq4ARfIAQ_YAQHoAQH4AQKIAgGoAgO4AvWhzq0GwAIB0gIkYTQ3OGY1ZmUtNzVlOS00NmIxLTg5MjQtOWUzNDhhNDhhZWFi2AIF4AIB&aid=304142&ucfs=1&arphpl=1&checkin=2024-02-25&checkout=2024-03-01&dest_id=-406131&dest_type=city&group_adults=2&req_adults=2&no_rooms=1&group_children=0&req_children=0&hpos=1&hapos=126&sr_order=popularity&srpvid=20ce4d8e43b40332&srepoch=1706266974&all_sr_blocks=30534903_88497564_0_2_0&highlighted_blocks=30534903_88497564_0_2_0&matching_block_id=30534903_88497564_0_2_0&sr_pri_blocks=30534903_88497564_0_2_0__39862&from_sustainable_property_sr=1&from=searchresults#hotelTmpl,1 de 5,"El Hi Valencia Canovas está situado a solo 100 metros del Paseo de la Alameda y a menos de 1 km del centro histórico de Valencia. Ofrece alojamiento sencillo y con encanto. El baño puede ser privado o compartido.

Las habitaciones del Hi Valencia Canovas están bien decoradas en un estilo moderno y disponen de calefacción, ventilador y TV.

El desayuno se sirve, por un suplemento, en una cafetería situada a 100 metros. Hay varias cafeterías, bares y restaurantes a poca distancia a pie. El centro histórico de Valencia se halla a menos de 1 km.

El barrio de El Carmen y la catedral de Valencia también están a menos de 1 km. La estación de metro Colón se encuentra a 10 minutos a pie. La estación de tren de Valencia queda a 1 parada de metro. La playa de la Malvarrosa está a 10 minutos en metro."
